店铺名称,用户名,评论
三牦记·牛肉火锅（温江店）,匿名用户, #五花肉# #西红柿锅# #三牦特色牛肉包# #鲜虾滑#
三牦记·牛肉火锅（温江店）,匿名用户,味道不错 #鲜切耗牛肉#
三牦记·牛肉火锅（温江店）,匿名用户, #鲜虾滑# #三牦特色牛肉包# #牛肉丸子# #鲜切耗牛肉#
三牦记·牛肉火锅（温江店）,Steamingten,不止一次选择了。有小孩 老人 不吃辣的 想吃汤锅的 想吃火锅的 想吃烤肉的。众口难调在这里能得到解决
三牦记·牛肉火锅（温江店）,匿名用户,团购的完全够吃了，我们是8个人，味道一直很不错，菜品有特色，豆浆很醇很浓！ #玉米锅边馍# #西红柿锅# #三牦特色牛肉包# #牛肉丸子# #三牦四喜# #牦牛大排# #秘制牦牛肉#
三牦记·牛肉火锅（温江店）,吃货雪莲花,肉很新鲜，服务也好。
三牦记·牛肉火锅（温江店）,XRA879620230,抢到29抵100的代金券 4个人才270 真的很划算 菜品价格30左右一份 分量中等 但胜在很新鲜 特别是牛肉 番茄锅是真心好喝 煮完牛肉喝汤能喝到一股牦牛油的味道 但是不腻反而很香 温江的火锅我是真的吃的不少 好多一开始味道很好 多吃两次就不行了 这次的体验真的不错会再来的 #西红柿锅# #鲜切耗牛肉#
三牦记·牛肉火锅（温江店）,匿名用户,两张2.9折卷、本来菜品消费183元、必须要200才能抵扣两张、最后又加了一个菜.
三牦记·牛肉火锅（温江店）,匿名用户,服务好，味道佳，很不错👍。
三牦记·牛肉火锅（温江店）,吃饱睡好大不了,妹妹在那边上学 19岁生日 我们作为家人不能陪她在那边 挑来挑去挑了这家 她和同学都满口称赞 叮嘱我一定要来帮她给个好评 谢谢你们陪她度过属于她的十九岁❤️感谢
三牦记·牛肉火锅（温江店）,匿名用户,来过很多次了，味道还是那个味道，分量很足，菜品新鲜，服务周到，原谅今天没来得及拍照 #玉米锅边馍# #西红柿锅# #牛肉丸子# #牛腩# #三牦特色牛肉包# #三牦四喜#
三牦记·牛肉火锅（温江店）,iWD698075447,【环境】比较好找 【等位】中午去的，比较大，空位很多 【服务】服务不错 【口味】番茄汤锅很好吃！汤我都喝了4.5碗，男朋友说喝汤都喝那么多也是服了我了，哈哈哈，团的63的还是66的中午餐，记不清楚了，团购性价比高，牛肉个别咬不动而且个别全是肥肉，其他还不错
三牦记·牛肉火锅（温江店）,art809964706,很好吃，手撕牛肉超赞。不过口味原因，烤的都不太接受，火锅很棒，汤底用料扎实，好吃
三牦记·牛肉火锅（温江店）,OPh184404886,菜品味道可以，个别服务员服务态度太差了，菜刚刚端上来还未放在桌子上，我说换一个贵一点的，他说不行，其他服务员就可以换，遇到了，醉了，真的是！
三牦记·牛肉火锅（温江店）,_sina89819035812,牛肉真的好吃！入口即化！
三牦记·牛肉火锅（温江店）,BzX839640258,服务非常好，味道不错，用了代金券很划算，推荐
三牦记·牛肉火锅（温江店）,清安qing,牛肉不错，好吃。就是饭店人多，服务员有些忙不过来。
三牦记·牛肉火锅（温江店）,geh521442261,哎。应该是来得有点晚 什么都没有了
三牦记·牛肉火锅（温江店）,hcb46230204,第二次去吃了，味道还不错，服务态度很好。
三牦记·牛肉火锅（温江店）,跑溜的包子, #玉米锅边馍# #西红柿锅# #三牦特色牛肉包# #牛肉丸子# #牦牛大排#
三牦记·牛肉火锅（温江店）,zYC507831761, #鸳鸯锅底# #西红柿锅# #牦牛大排# #牛肉丸子# #蔬菜组合# #三牦四喜# #鲜切耗牛肉#
三牦记·牛肉火锅（温江店）,彭于盐温江分盐,没劵吃，价格小贵。
三牦记·牛肉火锅（温江店）,gfc478670741,真的很屁，便宜没好货，不仅仅是不好吃，而且吃的胃不舒服
三牦记·牛肉火锅（温江店）,BEl291279285,吃了，很一般，感觉不值这个价，不过服务很好，下图是剩菜，好看不怎么好吃！
三牦记·牛肉火锅（温江店）,匿名用户,味道还不错，来过好多次了，可以买券更划算哈。
三牦记·牛肉火锅（温江店）,Rnj277715220,很好吃的一家火锅配烤肉，味道很好，服务热情。值得推荐 #五花肉# #三牦特色牛肉包# #牛肉丸子# #鲜切耗牛肉# #烤鲜玉米馍# #千层肚#
三牦记·牛肉火锅（温江店）,向往二次元的吃货,很不错，味道好，服务好
三牦记·牛肉火锅（温江店）,pluto12333,这家店的服务态度是真的好，可以说是面面俱到了，和朋友一起去的，朋友带了个3岁的小孩，服务员小妹儿对孩子很有耐心，一直都非常照顾，小孩走的时候还顺走了一盒小妹儿的好多鱼😂，给人家钱人家也不要，真的让我们都觉得不好意思了，下次绝对还来这家！ 【服务】
三牦记·牛肉火锅（温江店）,Xpu660431123,三牦记的服务一直很棒。玉米馍馍是我的最爱。来过两次了，还回再来 #玉米锅边馍# #西红柿锅# #三牦特色牛肉包# #龙利鱼片#
三牦记·牛肉火锅（温江店）,比比MaMa,菜品新鲜，味道很好👍服务也到位，而且有卷抵扣，很划算哦！
三牦记·牛肉火锅（温江店）,匿名用户,服务没问题，菜品也可以，没毛病
三牦记·牛肉火锅（温江店）,dQH778805622,菜品很多，味道优异，服务态度很好  下次还会来的。 #玉米锅边馍# #西红柿锅# #三牦四喜# #紫薯燕麦#
三牦记·牛肉火锅（温江店）,匿名用户,还好吧  还好吧  还好吧！！！感觉还好，可能每个人的要求不同吧！
三牦记·牛肉火锅（温江店）,金正19781008,味道很好、服务更好、环境也很好、下次还来。 #玉米锅边馍# #松茸牛骨锅#
三牦记·牛肉火锅（温江店）,ybb741234733,太热了 之前坐门口还不觉得 这次坐靠窗位置 热来直接不想吃
三牦记·牛肉火锅（温江店）,花的树2,味道还不错，就是没吃爽，套餐里牛肉太少，而且我们点的牛腩店家忘了给我们点了，整体来说一般般，个人感觉有点偏贵，没有吃牦牛肉的豪爽感觉。套餐的菜品太少个人不喜欢牛肝。
三牦记·牛肉火锅（温江店）,匿名用户,烤焦了都没人管，说了才夹起来，然后就这样了让我们吃。味道确实不怎么样，还吃上火了。
三牦记·牛肉火锅（温江店）,vri272077413,挺不错的，菜都很新鲜，虽然是中的霸王餐，但是现在在温江上班，也会时长去
三牦记·牛肉火锅（温江店）,FsQ499590551, #玉米锅边馍# #西红柿锅# #鲜虾滑# #毛肚# #烤鲜玉米馍# #紫薯燕麦# #松茸牛骨锅# #手撕牦牛肉#
三牦记·牛肉火锅（温江店）,xoE773269016,其他都还好，也是老顾客了，菜品新鲜，就是服务员少了，老板也很大气，吃了400多，结账的时候说包间低消500，也没有说什么，零头也少了的。就是服务员少了点，高峰时期就餐服务有点跟不上。
三牦记·牛肉火锅（温江店）,BEN413877973,味道很好，我点的6人套餐，6个人还没吃完，服务员的服务很到位。我们是中午去的，人少一点，感觉环境很舒适。 #五花肉# #秘制牛肉# #牛筋#
三牦记·牛肉火锅（温江店）,匿名用户,还是更喜欢汇锦那家的分量足，菜品多，服务好！ #玉米锅边馍# #五花肉#
三牦记·牛肉火锅（温江店）,WwW706856032,已经来了很多次，味道太赞，上菜那速度之快，好嗨哦，感觉人生达到了巅峰，还想来，推荐推荐
三牦记·牛肉火锅（温江店）,妹子阿西吧,份量很足，5.个人吃六个人的量，撑到不行都没吃完。全是牛肉，各种牛肉，太赞了
三牦记·牛肉火锅（温江店）,匿名用户,春节前带小孩吃的，点了两人餐，少的很，如果是两个大人是不够的
三牦记·牛肉火锅（温江店）,匿名用户,服务特别赞，上菜也快，最主要点的番茄汤锅，好好喝 #玉米锅边馍# #西红柿锅# #鲜切耗牛肉# #牦牛大排#
三牦记·牛肉火锅（温江店）,swallcd,买的套餐 觉得还行吧 性价比一般 服务不错
三牦记·牛肉火锅（温江店）,Alone欢情,四个人（两男两女）吃的，还剩了一点，味道也很好。
三牦记·牛肉火锅（温江店）,啊啦啦啦啊啦啦哈,菜品有点少啦啦啦啦啦啦啦啦啦啦啦啦啦啦啦
三牦记·牛肉火锅（温江店）,BAIYSOUj,两个人吃的一份双人餐…够吃…玉米锅边膜也挺不错…俩人没吃完…
三牦记·牛肉火锅（温江店）,为啥百八十,味道一如既往的好，超喜欢番茄汤锅，玉米汁，特别新鲜热乎乎的，服务态度超棒 #西红柿锅# #鲜玉米汁#
三牦记·牛肉火锅（温江店）,bXs177113143,味道还可以。分量少了点，我们8个人，我们用了一个480的8人餐卷，还又点了160元的菜。 #五花肉# #牛肉刺身# #鲜玉米汁# #牦牛大肚#
三牦记·牛肉火锅（温江店）,umin、,还可以，那个烤饼子不错，鸭血也很好吃
三牦记·牛肉火锅（温江店）,小区门卫,请注意!这估计是我二十多年来遇到服务最棒的一次，服务员真的很好，很细致，味道当然不错，量还是很多的，烤的馍馍，烤好之后蘸点料蘸点辣椒面简直不要那么好吃，可以尝试这种吃法! #玉米锅边馍# #西红柿锅# #龙利鱼片#
三牦记·牛肉火锅（温江店）,匿名用户,我是吃了汇锦城连锁才来这家比较近的，结果非常失望。牛肉分量不如汇锦城店，除了蔬菜的份量差不多，肉类的比那家店差太远！！只有那家店的一半吧，而且还不是正宗的牦牛！速冻牛腩！光是玉米馍馍就把肚子撑饱了！我个人认为汇锦城店的牛肉是正宗的，因为我之前就去过藏区吃了牦牛肉，要做比较的话，你们这家感觉像是速冻牛腩！牛肝一直觉得有腥味吃不来。 值得两点肯定的是，服务小哥的态度还不错，环境也还不错，但是相对于来说，性价比不够，吃一次勉强，吃二次是不可能滴，图是配图。
三牦记·牛肉火锅（温江店）,Cyanpink、,菜品不错，服务很好
三牦记·牛肉火锅（温江店）,香_冰,蕃茄锅底很不错，加汤时能看到加的确实是浓汤，而不是白水。推荐烤五花肉，可惜套餐里没有，要单点。这种就适合又想吃烤肉又想吃火锅的人。特别要说到的是他家的服务非常地好！服务员会主动帮忙烤玉米馍，提醒各类菜品的涮烫时间，而且说话都是面带微笑的。现在大家生活好了都喜欢出去用餐，但经常会遇到一些甩臭脸的服务员，毕竟谁喜欢吃个饭还看一堆臭脸呢？服务行业还是要以服务为本！为店家点赞！ #玉米锅边馍# #牛肉丸子# #番茄锅底# #五花肉# #油碟# #茼蒿# #鸳鸯锅底# #土豆#
三牦记·牛肉火锅（温江店）,BlL87378708,菜也少上，6個人吃了1000多沒有吃飽，我也是醉了。
三牦记·牛肉火锅（温江店）,停车坐爱枫林晚R,如果服务好是一种错，那我希望你们一错再错。服务好的很！还有礼物送，味道超赞，老板娘很热情。吃了很多家三牦记，还是温江的最好吃
三牦记·牛肉火锅（温江店）,WDz22832040,好评
三牦记·牛肉火锅（温江店）,WpI527205386,菜是不是太少点了，配菜，其他还不错
三牦记·牛肉火锅（温江店）,匿名用户,这个145的套餐不包含油碟所以呢买了10块钱的油碟。总体来说服务还是可以，中午去吃的，等于包场吃了只有我和我老公。145团购的说实话只够我两人吃的，4个人还是算了吧不适合这个套餐。
三牦记·牛肉火锅（温江店）,gq6687,菜品口味巴适，服务热情，性价比高，最近准备再去享享口福！
三牦记·牛肉火锅（温江店）,兜兜里木有糖呀,超好，生日还送了长寿面，服务态度也很赞
三牦记·牛肉火锅（温江店）,匿名用户,环境好，菜品也不错，老板也很热情，老板是我学车的教练，哈哈
三牦记·牛肉火锅（温江店）,一个个好吃嘴,两个人套餐，另外点了100元的菜。
三牦记·牛肉火锅（温江店）,rfF570898603,味道不错，特别是牛肉包，很好吃
三牦记·牛肉火锅（温江店）,香草653,好评，掌柜服务不错，价格合理，还会再去
三牦记·牛肉火锅（温江店）,Simba432,很好吃！看抖音的，没想到温江也有，很好吃，可以烤可以烫，番茄锅也好吃，吃辣和不吃辣但是爱吃肉的人去吃，肯定不会出错了
三牦记·牛肉火锅（温江店）,Ypn142145814,牦牛肉是很好吃
三牦记·牛肉火锅（温江店）,VBw198748993,不错哟，服务员态度很好👍
三牦记·牛肉火锅（温江店）,Zul272852975,服务很贴心，味道也可以，适合家庭朋友聚餐
三牦记·牛肉火锅（温江店）,AQp257547556,味道不错，菜品很新鲜，总之比较满意
三牦记·牛肉火锅（温江店）,gp2278506063,因为大一第一次的聚会，大家之前选了很久很久的，都没有选到格式的地方，后来终于选到啦！！！火锅味道超级棒！！！送的饮料也超好喝！！！我们一共团购了6个6到8人套餐的，有点点不够，但是大家后来加菜也有吃饱，嘻嘻，大家都吃的很开心！非常愉快的一次聚餐！！！给大家推荐，牛肉，还有馍馍，真的特别好吃，西红柿清汤锅，煮到后面味道特别浓郁，点赞😊😊😊
三牦记·牛肉火锅（温江店）,匿名用户,菜品都很新鲜，三个大人一个小孩，吃得好满足。味道也很不错，份量超级足，很适合带家人一起去，氛围也很好，最主要的是服务很满意！
三牦记·牛肉火锅（温江店）,匿名用户,本来锅底里面就有牛腩 这个锅底没有牛腩！ 注意！注意！
三牦记·牛肉火锅（温江店）,Harryjiaojiao,地点在家乐福旁边 转角处就是盒马鲜生 位置还是挺好找的 第一次吃这种涮烤 其实就可以理解为 潮汕牛肉加烤肉 汤头不错 不过没有火锅的那种麻辣鲜香 还是比较清淡 菌汤锅无功无过 锅底比较贵 但是送了一点牛肉制品 和 蔬菜拼盘 烤肉强烈推荐 烤五花肉超级好吃 烤牛肉 锅边馍也不错 环境还行 服务态度超级好 小姐姐还帮忙打绿豆汤 下次还来！
三牦记·牛肉火锅（温江店）,sya868393786,属于汤锅类，味道不错，菜品很实惠，服务很周到，耐心，环境还不错的
三牦记·牛肉火锅（温江店）,匿名用户,红锅超好吃！我们吃的鸳鸯锅，红汤味道很足，番茄锅有点酸，😂😂😂😂
三牦记·牛肉火锅（温江店）,瞌睡虫9,人均消费偏高 不晓得为啥团购了就不能使用会员优惠 这冲突吗
三牦记·牛肉火锅（温江店）,Lha596600751,强烈推荐！！！6个女生吃有点勉强，分量很足，生日的时候买了请室友吃饭的。
三牦记·牛肉火锅（温江店）,匿名用户,菜很少，价钱贵。。。。。。。。。
三牦记·牛肉火锅（温江店）,喵柯森瑟,第二次来吃了很好吃，这家干净
三牦记·牛肉火锅（温江店）,jWc135001065,团购的，人均50的样子，味道很好，推荐番茄锅
三牦记·牛肉火锅（温江店）,skH356759660,我们经常在这家吃都已经忘了评价了，但是非常不错的
三牦记·牛肉火锅（温江店）,kk小魔头,味道一般，不会再去第二次了，没什么特色
三牦记·牛肉火锅（温江店）,匿名用户,团了个套餐 再加了些菜 但是番茄锅有点甜个人不太喜欢 说真的 还挺喜欢烤肉的 涮锅没那么好吃 烤玉米馍馍很香但是要自己注意翻面免得糊 套餐很划算 烤五花裹生菜很香 料碟有特色 一次性阔以打三种不同的 还是有心了 我喜欢打个火锅碟一个干碟 一个随意
三牦记·牛肉火锅（温江店）,小鱼儿XYR1207,超级满意，服务态度特别好，菜也好吃，还给宝宝送了长寿面
三牦记·牛肉火锅（温江店）,匿名用户,菜品还可以吧，我团的两个人吃的合适，环境也还可以，周末人挺多的，服务员炒鸡热情，还会再去的
三牦记·牛肉火锅（温江店）,eok833995578,服务很好，菜品也很新鲜，来过很多次了 ，没有失望过！棒呆 【服务】 【环境】 【口味】
三牦记·牛肉火锅（温江店）,小蕾爷,环境和口味没什么可说的，每次来都有新的体验，最推荐这家的牛肉，涮起来很嫩，看着很少，两个人却饱的不行，看来是锅边馍很给力，如果不喜欢吃锅边馍的两人套餐可能有点少，尤其是男生，价格稍微有点贵，不过也值了，坐在窗边吃着美食，感觉很棒
三牦记·牛肉火锅（温江店）,骆驼骆驼客,菜品新鲜，肉真、不像合成肉压缩肉。服务小哥很热情细心。上菜快。味道挺好的。 不！要！让！宠！物！进！来！可！以！吗？我们自己也养有狗狗，但是餐饮店还是不要让宠物进来吧，一来有些没素质的主人用餐具喂狗，这个卫生问题就大了，二来宠物毛发还是会影响到周围人用餐的。你们家生意挺好的，也不缺客人，还是拒绝宠物入内吧，不然我个人而言很担心卫生问题。没给五星就是这个原因。
三牦记·牛肉火锅（温江店）,匿名用户,味道还不错，正宗的牦牛肉，牛肝不好吃(๑´ڡ`๑)，吃多了还是有点腻。
三牦记·牛肉火锅（温江店）,UlH969726206,味道不错，牛肉很鲜，牛肝必点。
三牦记·牛肉火锅（温江店）,花花_soul,分量足，菜品有特色，饮料也很好喝，性价比高，服务热情，环境好 #烤鲜玉米馍# #蔬菜组合# #牦牛大排#
三牦记·牛肉火锅（温江店）,龙帅阿,挺棒的，特别好吃，玉米粑粑点了两份，就糍粑不怎么好吃
三牦记·牛肉火锅（温江店）,SFc346969923,味道挺不错的，服务态度也很好！
三牦记·牛肉火锅（温江店）,CDEason,总体还不错，味道还可以，由于赶着万圣节去国色天乡，剩了好多菜，信号老板提醒了打包
三牦记·牛肉火锅（温江店）,qNB363092308,点的8人套餐，少上了好几个菜12312131213
三牦记·牛肉火锅（温江店）,GWN774918323,味道还行。两个人团双人餐，份量能吃饱。节假日最好预约留位，不然要排很久的队。这次没有预约，排队等了一个多小时。
三牦记·牛肉火锅（温江店）,匿名用户,社会学和电脑大别山女生宿舍就不当回事进行精细化喜欢就在你最不喜欢这件事看着看着就继续很喜欢
三牦记·牛肉火锅（温江店）,JgU256494832,味道可以 服务好
三牦记·牛肉火锅（温江店）,匿名用户,很不错，服务很安逸，味道比较好，但是烤东西的盘真的一般。
三牦记·牛肉火锅（温江店）,抵达你的爱,吃了很多次了，整体来说比较满意。番茄汤锅味道味鲜。
三牦记·牛肉火锅（温江店）,我是阳大凡,评分高肯定有他们家的不一样的地方，服务特别热情，不会因为我们买券就爱理不理，味道特别不错，昨晚上聚餐时间弄的有点晚，耽误两位小姐姐下班了，实在不好意思。
三牦记·牛肉火锅（温江店）,qazzjp,味道，还有环境不错。
三牦记·牛肉火锅（温江店）,liangxiaochuan09,味道很好，分量也很足！ #牦牛大排# #玉米锅边馍# #五花肉# #蔬菜组合# #鲜切耗牛肉# #生拌牛肉# #虾滑# #烤鲜玉米馍#
三牦记·牛肉火锅（温江店）,joyqiao7,菜品味道还可以，主要是空调太不给力了，吃的人汗流浃背的，同桌的有老人喝不了凉的饮料，想就茶壶在旁边自己到，服务员说的好听一会就来给倒，不用放茶壶在旁边，结果呢，让人失望，很久以后喊了才会来。菜品的样式还是可以的，就是环境让人很不舒服，空调不给力，还没有外面吹自然风舒服。
三牦记·牛肉火锅（温江店）,Jai202485849,服务态度很好。很到位。味道也可以。
三牦记·牛肉火锅（温江店）,Pure丶丶,非常给力，味道好，价格实惠，环境也不错，最主要的是团购还能开发票，良心店铺，好评
三牦记·牛肉火锅（温江店）,ovD995081953,看抖音去的，但是味道真心一般。
三牦记·牛肉火锅（温江店）,踏浪登天,我看中这家的服务。棒棒哒
三牦记·牛肉火锅（温江店）,EVO297581426,味道很好啊，10个人团了一个6-8人餐再加菜。第二次加菜的时候还不给加非让吃完了再加，结果真用不着再加了。节约意识很好！
三牦记·牛肉火锅（温江店）,GL1031,还不错 番茄锅 比红油锅底好吃太多
三牦记·牛肉火锅（温江店）,HKu278159631,服务很好，牛肉很好吃，推荐
三牦记·牛肉火锅（温江店）,我现在饿得很啊,菜品真的不错，每次来都吃的很好，今天生日老板还给煮了长寿面放了生日歌，很开心
三牦记·牛肉火锅（温江店）,你是我的亮晶晶,感觉没有以前好吃了，，，，，，
三牦记·牛肉火锅（温江店）,wiI939241974,首先服务很好，然后菜品很新鲜，特别是牦牛肉丸子，烤玉米饼也很好吃，强烈推荐
三牦记·牛肉火锅（温江店）,Gef402495036,不建议团购套餐，毕竟大冬天的团购里包括了一扎饮料，又冷又贵，还不如点一份五花肉
三牦记·牛肉火锅（温江店）,最爱3284,好啊特别好
三牦记·牛肉火锅（温江店）,khr454579801,环境不错，味道可以，鸳鸯锅辣度适中。份量一般，5人吃，6～8套餐，勉强够。烧烤挺不错的，有机会还回来光顾。
三牦记·牛肉火锅（温江店）,sgxy,因为离家不远，而且网上评价不错，就去了。老母亲过生日，鸳鸯锅解决了她不能吃辣的问题。团了个双人餐，分量很足。就餐环境还不错，服务也很热情。菜品都比较新鲜，味道还行，印象比较深刻的就是端上来没什么颜值的牛腩，所以没拍照，但味道却最好。
三牦记·牛肉火锅（温江店）,匿名用户,服务非常热情，牦牛肉🐮棒棒哒。其中牛腩很不错 #三牦特色牛肉包# #牛腩#
三牦记·牛肉火锅（温江店）,MrX469497005,两人餐吃得很饱，国庆节去的，有个10块钱买份五花肉的活动，必须要说五花肉真的爆好吃。 #五花肉# #烤鲜玉米馍# #鸳鸯锅底# #松茸牛骨锅#
三牦记·牛肉火锅（温江店）,燃情2006,味道很好，份量也足，服务员小哥长得很帅，服务态度也很好，推荐推荐。
三牦记·牛肉火锅（温江店）,saJ881355237,这个真的很棒，味道也很好吃，牛肉真的很棒，就是每次人太多了。
三牦记·牛肉火锅（温江店）,eKk448653216,味道还错 价格实惠 下次还要来吃 可以吃火锅也可以烤肉
三牦记·牛肉火锅（温江店）,ROH334571667,环境好，服务很周到。
三牦记·牛肉火锅（温江店）,xwo388324410,味道好，服务非常棒，宾至如归！
三牦记·牛肉火锅（温江店）,沐子蓝,吃了很多次，好吃
三牦记·牛肉火锅（温江店）,匿名用户,味道巴适，分量很足，已经吃了很多次了
三牦记·牛肉火锅（温江店）,LavinoLi,味道很赞，红汤锅底不算很辣，蕃茄汤锅底酸酸甜甜的，很好喝，耗牛肉真的强烈推荐，特别好吃，锅边馍也好吃，旁边是可以吃烤肉的，龙利鱼很嫩，涮一下就可以吃了，牛肝口感很好，涮一下会脆脆的，我一个不爱吃肝的人都觉得很棒！打的碟子要给满分好评了！可以一次性打3个碟！！我打了一个油碟一个干碟一个黑胡椒碟，都特别好吃，个人最爱吃干碟，配上耗牛肉真的绝了！服务的小哥哥特别热情，上菜也非常快，不用排队，加汤也很及时，我们5个人，团的4人餐，都吃的很撑，性价比超高的，只是吃的有点热，希望下次能开大点空调
三牦记·牛肉火锅（温江店）,Ljz505508652,味道不行，态度差。 【环境】一般，肯定不会去
三牦记·牛肉火锅（温江店）,匿名用户,非常完美的用餐体验，牛肉品质非常好.特别点赞服务的小哥哥，超级耐心，关键是长得也好看，其他姐姐服务态度也挺好.❤️
三牦记·牛肉火锅（温江店）,妍宝贝516,小贵
三牦记·牛肉火锅（温江店）,匿名用户,团购的双人套餐。足够吃了！特别是锅边馍（玉米的）很喜欢！小笼包是单点的，没有吃完，锅边馍也是没吃完。
三牦记·牛肉火锅（温江店）,kZC618247149,很不错，值得一试，就是自己不会煮牛肉，有时很容易煮老
三牦记·牛肉火锅（温江店）,一只三鹿奶粉x,很不错。比较推荐。价格实惠。
三牦记·牛肉火锅（温江店）,hzg529334339,牛肉还可以就是分量有点少，三个男生两个女生，酒水就点了个维E，所以还是挺贵了
三牦记·牛肉火锅（温江店）,VDX178864094,这家店真心不错，环境设计的很高尚，特别是牛肉片很好吃。
三牦记·牛肉火锅（温江店）,Cwj895369473,口味服务都不错，过生日，还送了寿面，放了生日快乐歌
