店铺名称,用户名,评论
三牦记·牛肉火锅（温江店）,AaP405480292,店铺位置还可以，环境比较大，有汤锅和烤肉，是烤涮一体的，汤锅的味道比较淡，玉米馍不是很好吃，面粉没有教劲，令人惊叹的是牛肉包子，很好吃，很香，有比较重的黑胡椒味道。烤五花肉，腌肉的时候没有放盐，其他的就一般般了
三牦记·牛肉火锅（温江店）,TVZ397198724,挺好的，味道不错，喜欢番茄锅。
三牦记·牛肉火锅（温江店）,LIP168945329,没有拍照，没必要，老店新店多次光顾，服务一流，很温馨，关键味道不错，值得你一试。
三牦记·牛肉火锅（温江店）,Ngd155578598,一般吧，味道不算很好，只能说可以烤肉
三牦记·牛肉火锅（温江店）,cdedc,此次用餐总体来说不错，觉得比较认可的地方有：环境、服务。
三牦记·牛肉火锅（温江店）,LIP168945329,老店新店都多次品尝了，适合各种口味的人，味道不错，服务很好！五星好评，还会再来！
三牦记·牛肉火锅（温江店）,cdedc,这次就餐整体感觉很赞，比较满意的方面有：服务。
三牦记·牛肉火锅（温江店）,ILT732837348,菜品很多   味道也很好   环境很好  老板很热情   反正给我的感觉很好   推荐大家去
三牦记·牛肉火锅（温江店）,AaP405480292,去的时候菜点多了，点了牛肉包子，很好吃，里面有黑胡椒调味，吃起来口感很好！牛肉也很新鲜，味道不错，挺好吃的，分量也不错，整体还是比较满意，但是汤底味道有点淡，不是很鲜，生菜也不是很新鲜，总的来说，还可以
三牦记·牛肉火锅（温江店）,Syv498947350,吃过好几次了。味道一如继往的好！牛肉包超赞！
三牦记·牛肉火锅（温江店）,Archiee阿奇,服务的态度超级好 一直在帮忙下菜还主动加汤 番茄汤超级好喝 不仅可以吃火锅还可以吃烤肉 真的太全面了 价格也很实惠 我们九个人买了券人均45元 真的很划算 味道也不错 走的时候还给我们说再见 服务真的很好 下次还会再来 离家也比较近
三牦记·牛肉火锅（温江店）,uPO669633839,总体分数6分吧，口味感觉起来属于一般般的类型，烤的那个五花肉很好吃，包浆豆腐烤起来也算比较好吃的，其他的就一般般了印象不深，服务态度挺好的，可是口味没有特别吸引人的地方，所以我不会再次去吃了。吃的时候照片忘记拍了。
三牦记·牛肉火锅（温江店）,gkX754714189,味道非常好  牛肉软硬恰到好处   很明显没有放太多嫩肉粉   菜品非常新鲜  牛肉毛肚看着就有食欲服务也是特别好   有个美女妹妹一直帮着烤煮   各种要求都要满足   需要烤个蒜瓣 青椒  马上去现切  热情  亲和力强  让人感觉心情非常舒畅 后面还好常去
三牦记·牛肉火锅（温江店）,cpc853545780290,个人觉得很不错，首先，说一下服务吧，我们是生日当天准备去的这家店，当时和商家联系预定了一个包间，然而我们超出了一个多小时才到达店铺，商家还是给我们预留了位置（用餐高峰期还给我们留了座）：其次，我们当时进店后，老板及服务员很耐心跟餐及介绍，上菜速度也很快，性价比也挺高的；第三，他们家的招牌菜品是真的不错，是牦牛肉（本人在阿坝州长大，熟悉牦牛肉味道）不是平常吃的黄牛肉，味道也很好哦，性价比也高，推荐
三牦记·牛肉火锅（温江店）,匿名用户,看评价很好来的，来了感觉服务态度一般吧，服务员太少了感觉，根本忙不过来，菜品正常水平。
三牦记·牛肉火锅（温江店）,匿名用户,味道一直都很好，牛肉很正宗，特别喜欢牛肉刺身😋😋
三牦记·牛肉火锅（温江店）,BB换个环境,环境不错服务到位，价格也很实惠带小朋友来了好几次了
三牦记·牛肉火锅（温江店）,匿名用户,有特色
三牦记·牛肉火锅（温江店）,嫣媄,味道不好吃非常辣，价格也贵、不会去了
三牦记·牛肉火锅（温江店）,刘微97,看代金卷50的使用规则是说每桌可用八张所以和老公两个人一共团了八张五十的卷但是结账的时候被告知只能用五张，超出的需要另外补钱，这里想给商家说如果只能用五张就不要在使用规则上注明每桌可用八张，误导消费者，退了剩下的三张卷，像这种商家只想说下次不会再去了
三牦记·牛肉火锅（温江店）,bsD150069594,首先说说进店的感觉吧，进门工作人员特别热情给我们安排，环境也很不错，关键是味道真的很好，菜品也很新鲜，以前吃过三牦记锅底很好吃，这次点了他们家新推出的市井锅底，哇塞味道超级赞，朋友们都说好吃，人均消费也不高，关键是性价比超高，下次还会再来
三牦记·牛肉火锅（温江店）,ever离别,确实味道可以，值得下次继续去好好感受呢 服务也很好
三牦记·牛肉火锅（温江店）,BeA741308427,必须点个大赞，老板人真的很好。 我们用了7张半价优惠券，还赠送了一罐饮料，很给力。 菜也很不错，够大份！味道也阔以。 遗憾的是，忘了拍照…… 下次又去……
三牦记·牛肉火锅（温江店）,nKD916320496,一直都那么好吃，尤其是三牦记的虾滑肥牛和牛肉还有烤起的五花肉，超级棒！～啊啊啊啊啊啊啊啊啊啊啊啊啊啊啊啊啊啊啊啊啊啊啊啊啊啊啊啊啊啊啊啊啊啊啊啊啊啊啊啊啊啊啊啊啊啊啊啊啊啊啊啊啊啊啊啊啊啊啊啊啊啊啊啊啊啊啊啊啊啊啊啊
三牦记·牛肉火锅（温江店）,心血来潮i,以前在家乐福的现在搬到南熏大道了，味道还不错价格也挺实惠的团劵吃的很划算。
三牦记·牛肉火锅（温江店）,yuU282727878,「#玉米锅边馍」 【性价比】 【服务】 【环境】 【口味】「#五花肉」「#牛肉丸子」「#三牦特色牛肉包」「#五花肉」
三牦记·牛肉火锅（温江店）,匿名用户,牛腩和牛丸细腻滑嫩、口感鲜美，玉米贴饼香甜可口，香辣牛肉片滑爽劲辣，其它的菜不一一点评了，但强烈推荐她家的牛腩和牛丸。总的来说四人餐的各种牛肉份量很足，蔬菜类也很新鲜，要的是西红柿锅底和松茸锅底汤料醇厚配料足。最后值得夸赞的是店家的服务人员态度超好👍👍👍，下次还会再去。
三牦记·牛肉火锅（温江店）,DYZ447736454,牦牛肉口感味道很棒，铐五花肉和煎牛排还是一样好吃，锅底送一份玉米馍。牛肉包子也是非常好吃。服务态度很好，美女店员还教如何用券省钱。一家人吃得比较开心！
三牦记·牛肉火锅（温江店）,琳儿8989,新店还是第一次来，味道不错，服务环境都好，牛肉过瘾
三牦记·牛肉火锅（温江店）,addyourm,味道不错，烤煮一体，服务员很热情，牛肉包子是现做现蒸的，还可以
三牦记·牛肉火锅（温江店）,yuU282727878,【环境】 【服务】 【性价比】 【环境】 【口味】「#牛肉丸子」 【性价比】 【服务】
三牦记·牛肉火锅（温江店）,匿名用户,以前在别的地方吃过，觉得味道很不错，现在看到温江有，就毫不犹豫下单了，结果:味道挺失望的，最喜欢的鹌鹑蛋也不怎么样，火锅味道也平平无奇，烤肉也一般化吧，环境:一般，疫情过后人真的太少了，全是空位。价格:一如既往的贵，希望提升一下口味吧，这个价格恐怕很难走下去的
三牦记·牛肉火锅（温江店）,匿名用户,味道巴适，服务态度很好，强烈推荐下次还来
三牦记·牛肉火锅（温江店）,哈儿多喝烫水,味道真的不错，我朋友评价比蜀大侠味道都好，真心不错，点赞
三牦记·牛肉火锅（温江店）,chi货丹妹儿,菜品新鲜，分量足，红锅锅底👍牦牛肉包子也非常好吃😋店家优惠力度非常大，特别划算。准备屯券下次带家人又来吃😄
三牦记·牛肉火锅（温江店）,Jun-35,经常来吃，味道很不错，牛肉也很新鲜。
三牦记·牛肉火锅（温江店）,JYG561625676,味道巴适.服务好…
三牦记·牛肉火锅（温江店）,pdA765962538,还不错，味道很赞，喜欢喔。
三牦记·牛肉火锅（温江店）,kiU904097205,环境好，干净卫生，味道巴适，老板很热情，做活动的时候来的，很划算，以后会经常光顾的！
三牦记·牛肉火锅（温江店）,kVe509212760,很满意的一次就餐体验，整体评价的话我觉得：份量充足、菜品丰富、环境优美、口味不错、配菜合理、服务到位。
三牦记·牛肉火锅（温江店）,ZZZ701839639,味道还是很不错的，烤涮一体，建议烤肉的话，不要点市井锅，会挡着。牛腩很不错，热一下就能吃，耙耙的，烤肉我忘记名字了，感觉牦牛肉烤的好吃些，因人而异。价格的话，人均75左右，基本就是火锅价位。店家送了牛肉包，很好吃，热的时候吃最好
三牦记·牛肉火锅（温江店）,OyV957623481,班上去聚餐哒，20多个人，价格合适，套餐也挺丰富哒，值得去。
三牦记·牛肉火锅（温江店）,你不是我11,味道还不错，小姐姐服务也挺好
三牦记·牛肉火锅（温江店）,匿名用户,再次打卡三牦记，之前在家乐福旁，现在搬到文化路336号，服务一如既往的好，让人觉得非常亲切。到店发现他们家新增设了市井火锅，店家也在搞菜品打折活动，选择了市井锅底，赠送了一份玉米馍，火锅新吃法，周围可以烤馍烤肉，菜品种类也比之前更加丰富，也十分新鲜，分量足。点的牦牛也是正宗新鲜牦牛肉，锅底香辣，以后吃火锅就打卡这里了，最后菜品折扣下来人均50左右，性价比高！推荐！
三牦记·牛肉火锅（温江店）,VlU198128182,此次用餐总体来说不错，觉得比较认可的地方有：环境优美、菜品丰富、服务到位、口味不错、份量充足、配菜合理。
三牦记·牛肉火锅（温江店）,欦忆,真的好好吃，和朋友们来了好几次，非常不错
三牦记·牛肉火锅（温江店）,Dcs399287119,味道非常好，环境也不错，牛肉嫩。
三牦记·牛肉火锅（温江店）,匿名用户,停车还是比较方便的，味道的话还是一般，适合带老年人和小孩子去吃，红锅也不辣，还有番茄锅和菌汤锅。买的套餐，5个人买的6人餐，但是去吃的话建议单点，要划算一些。味道最好的。就是牛肉包子了，现包现做的。很新鲜，建议：送的豆浆味道太淡了，多加点豆子打
三牦记·牛肉火锅（温江店）,NOy149765383,服务很好
三牦记·牛肉火锅（温江店）,len256,味道一般般，价格贵，停车不方便。 牛肉还是新鲜
三牦记·牛肉火锅（温江店）,GGj994765586,此次用餐总体来说不错，觉得比较认可的地方有：服务非常周到，配菜好巴适哟！尤其佐料调配碗新颖，超赞！！！配菜合理、服务到位。
三牦记·牛肉火锅（温江店）,o波0000,此次用餐总体来说不错，觉得比较认可的地方有：口味好、服务到位、菜品丰富、环境优美、份量充足、配菜合理。
三牦记·牛肉火锅（温江店）,gmC178739544,有机会抢到29抵100的券，于是约了几个小伙伴准备来尝一下，看一下这么样。 先来说一下菜品：菜的品种还是算挺多的，牛肉看起来也是蛮新鲜的，牛肉份量中规中矩，不少也不多适中。牛肉的质感还可以，牛肉丸是纯牛肉的丸子，不是市面上的那种海霸王牛肉丸但是那个牛排就感觉很一般，可以改进一下。「#三牦四喜」「#鸳鸯锅底」「#牛腩」「#牛肉丸子」 服务：服务人员也是很不错的，两位小姐姐人漂亮服务也好，用餐过程中会主动来帮你烤东西。 锅底：锅底也挺不错的，不像有一些店是清汤的，这家店有红锅，我们点的番茄鸳鸯锅，番茄锅也挺鲜的，红锅也挺有味道的。 对了还有调料，那个辣椒面和藤椒面超香，干碟一定要加！ 综合下来这家店也是蛮不错的，两位朋友也是觉得可以。
三牦记·牛肉火锅（温江店）,cai327115583,两个人够吃了，份量充足，素菜没吃完
三牦记·牛肉火锅（温江店）,gsl252581965,还可以，服务不错。菜品值这个价格
三牦记·牛肉火锅（温江店）,UNY544337563,此次用餐总体来说不错，觉得比较认可的地方有：口味不错。
三牦记·牛肉火锅（温江店）,VbY220876954,很满意的一次就餐体验，整体评价的话我觉得：配菜合理、口味好、份量充足、菜品丰富、服务到位。
三牦记·牛肉火锅（温江店）,lmx182101,很满意的一次就餐体验，整体评价的话我觉得：口味不错、服务到位、配菜合理。
三牦记·牛肉火锅（温江店）,len256,根朋友一起去吃的，牛肉火锅「#西红柿锅」味道一般，还是要麻辣味才能压住腥味，不喜欢，菜品价格偏贵，不推荐。「#玉米锅边馍」「#三牦四喜」「#鲜虾滑」「#烤鲜玉米馍」
三牦记·牛肉火锅（温江店）,gQy569258767,有些牛肉怎么都咬不烂，优惠券使用的限制很多
三牦记·牛肉火锅（温江店）,匿名用户,菜品丰富 牦牛肉系列正宗 蘸料多样化 牛肉火候适中 烤五花肉不错 下次还要去
三牦记·牛肉火锅（温江店）,匿名用户,差非常差、味道差、服务差.卫生也差
三牦记·牛肉火锅（温江店）,zpfsh501,跟老公一块来的，不知道第几次了，反正喜欢
三牦记·牛肉火锅（温江店）,zpfsh501,我的最爱，喝了几碗汤，真的好吃！
三牦记·牛肉火锅（温江店）,柳柳17448,服务态度很好，我们是团卷来的，4人吃了200多很划算吃的很饱很饱，菜品也是不错的，边吃火锅边吃烤肉了
三牦记·牛肉火锅（温江店）,君君同学晓,一直喜欢这里的火锅，搬了地方也找来了，朋友都很满意
三牦记·牛肉火锅（温江店）,FFFYYY1123,我们四个成年人刚好，但如果是肉食爱好者的话，在肉系的菜上会不足，其他的都刚好
三牦记·牛肉火锅（温江店）,maD561311985,下一次去温江了，请朋友一起去吃
三牦记·牛肉火锅（温江店）,pdd943612984,还是可以嘛
三牦记·牛肉火锅（温江店）,妍宝贝516,好吃
三牦记·牛肉火锅（温江店）,天阳宝,味道不错，我们一家人经常来吃。今天中午又来，朋友圈发了照片还送了包子，包子也好吃。服务员态度也多好的，老板也很热情。推荐牛蹄筋和秘制牛肉。
三牦记·牛肉火锅（温江店）,只吃辣条的小仙女,没搬之前就在我家楼下，店里聚餐去过几次然后又和男朋友单独去过好几次，搬走以后这是第一次去，锅底都会送牛肉丸和牛腩还有蔬菜，玉米馍和牛肉包很好吃，下次我要烤一份再打包一份！还是原来的味道，番茄汤底还是那么浓！店里的阿姨和小姐姐们都超级温柔！服务都超好！每次和男朋友吃完都很开心因为冲着小姐姐们的服务态度下一次我们还是会再来吃。希望三牦记能越来越好，生意兴隆呀！不要看到我夸就觉得是托😂 好歹我也是去吃过至少六七次了，每次都很满意！
三牦记·牛肉火锅（温江店）,毅毅依依,味道挺好的
三牦记·牛肉火锅（温江店）,美如夏花、,性价比不高，分量少「#套餐：四人餐」
三牦记·牛肉火锅（温江店）,lxy40095138,还行吧！菜品质量不错，比较新鲜。服务态度很好热情。就是美团上还是有点问题。说可以团两张。可是一下单就说库存不足。但是我一用完这一张卷。平台上就又可以团了。说明就只能团一张嘛！还是有些欺骗消费者。
三牦记·牛肉火锅（温江店）,XzY240869473,去过很多次，这家店原来在家乐福旁边，现在在柳城文化路口，味道一如既往的好，服务也非常贴心，玉米馍和牛肉包超好吃，涮牛肉特别新鲜，番茄汤喝进嘴里全是新鲜番茄颗粒，非常鲜美，适合老人小孩，服务员还给我们介绍了一款新锅底酸菜汤锅很不错，准备下次又去品尝！三牦记的服务一直非常棒，准备继续打卡！
三牦记·牛肉火锅（温江店）,WZQ427005882,性价比不高，味道一般，不过服务态度挺好的
三牦记·牛肉火锅（温江店）,蜗牛壁虎漫步,感觉很好！
三牦记·牛肉火锅（温江店）,温暖阳光536,味道不错！吃过几次了。
三牦记·牛肉火锅（温江店）,IsP779300672,不错不错
三牦记·牛肉火锅（温江店）,OLX376631431,好吃
三牦记·牛肉火锅（温江店）,WkX489588746,非常不错，涮跟烤都大赞
三牦记·牛肉火锅（温江店）,Stitch娃娃熊,非常好吃，很好的味道呢
三牦记·牛肉火锅（温江店）,PKq679417382,锅底新鲜，小姐姐服务很贴心！下次还会再来
三牦记·牛肉火锅（温江店）,honey20060928,味道分量都还可以，吃得很开心，肉质很新鲜，不错的一次外食！
三牦记·牛肉火锅（温江店）,匿名用户,还不错 以前在家乐福那边 现在搬到何师烧烤旁边 味道海不错 工作人员态度挺好 现在有扎啤了
三牦记·牛肉火锅（温江店）,ilw685975141,第二次吃了，啥时候再去吃一次，感觉很不错
三牦记·牛肉火锅（温江店）,黄丽娟同学,味道很醇厚。。也不腻也不燥。。吃到最后都还不辣。。超级好吃。。菜品也很好。。强烈推荐坨坨牛肉。。就是忘了拍照。。
三牦记·牛肉火锅（温江店）,DQE602629222,菜品丰富，新鲜，涮烤一体，满足不同味蕾，服务热情！
三牦记·牛肉火锅（温江店）,槿枫楠,带父母去吃的，当时感觉还是很棒的，味道也不错。
三牦记·牛肉火锅（温江店）,pZW615247300,好吃，肉很新鲜，服务也很好，份量比较足
三牦记·牛肉火锅（温江店）,Su、an,超级好吃，物美价廉。经常来吃
三牦记·牛肉火锅（温江店）,匿名用户,怎么说呢，味道和菜品确实还行。但是蘸料区和用餐工具确实配置不足，都需要呼唤服务员来解决。美团券的抵扣没有明确指明不能点小吃。用券的朋友注意点菜就好。酥肉很肥，不怎么样，炒饭没什么味，也不怎么样。烤五花肉还行。
三牦记·牛肉火锅（温江店）,似醒非醒11,a
三牦记·牛肉火锅（温江店）,Usb117572057,很实惠，价格也不错。人均消费也不高
三牦记·牛肉火锅（温江店）,CHO126867564,味道还不错，服务也比较热情，性价比很高，值得前来一试。
三牦记·牛肉火锅（温江店）,匿名用户,味道好，服务好，菜品好，:
三牦记·牛肉火锅（温江店）,WRN584158959,我们一家人去的点的西红柿锅底。因为西红柿锅底的汤还可以喝，味道很鲜美哦。而且他们家的牛肉也特别好吃。
三牦记·牛肉火锅（温江店）,ECM607411276,很不错的一家火锅店，味道巴适，可以烤也可以涮，五花肉加生菜巴适，菜品也很新鲜！服务也很好，已经去过几次了，值得推荐！停车也很方便，位置也很好找！
三牦记·牛肉火锅（温江店）,嗯哼大王yeah,不错👍
三牦记·牛肉火锅（温江店）,yuhongxian,味道还行，一百多三个人就吃到饱了。
三牦记·牛肉火锅（温江店）,一眼一辈子li,味道不错，搬到光华大道口子了。服务相当好，菜品很新鲜，包子牛肉丸子都是现场做的。
三牦记·牛肉火锅（温江店）,燕3679,底料和菜品都非常新鲜，服务态度非常好👍，分量也很足，我们六个人还带了两个小朋友，吃撑了，馍馍和包子还打包了！套餐配的喝的两大壶也很巴适，下次还去！
三牦记·牛肉火锅（温江店）,肖森雨,吃法还是挺丰富的，就是小贵，番茄熬的没之前吃的另外的店好
三牦记·牛肉火锅（温江店）,匿名用户,牦牛肉很少，只有熟肉是牦牛肉，其余生肉都不是
三牦记·牛肉火锅（温江店）,匿名用户,味道真的不错，朋友都喜欢吃。今天还是比较幸运的，去了没有排队，坐下之后人瞬间好多。感觉菜吃很好吃，量也是够的。
三牦记·牛肉火锅（温江店）,oSX384338877,味道不错， 口味是偏辣的
三牦记·牛肉火锅（温江店）,匿名用户,现在服务特别不好，老顾客了，不会再来了。
三牦记·牛肉火锅（温江店）,Jag905429869,服务非常好，味道也非常好，性价比高，值得推荐。
三牦记·牛肉火锅（温江店）,ySx794139483,味道可以，孩子喜欢吃
三牦记·牛肉火锅（温江店）,iTZ727297820,味道很棒，超喜欢
三牦记·牛肉火锅（温江店）,匿名用户,菜品少，三个荤菜一个素菜，一个玉米馍，感觉不是很值，体验好也不是很好，可能因为我们只有两个人啊，反正没感觉到多热情，没纸，我叫拿的，没摆杯子，也是我叫拿的 【口味】调料太少，我来的时候调料都见底了，也没人管 【环境】一般 【服务】有待更进 【等位】没多少人，所以没有等位
三牦记·牛肉火锅（温江店）,MMa940043553,去吃的时候生意比较火爆，就是吃的时候排队太久了点。菜品的好吃成都只能说中等，但是服务真的挺好的。
三牦记·牛肉火锅（温江店）,打雷了啊,不错，很不错，味道好，汤好喝，玉米饼好吃
三牦记·牛肉火锅（温江店）,CDscofield,一如既往的好，服务菜品味道依然很好，继续支持！
三牦记·牛肉火锅（温江店）,小时候可猛了XH,锅子溅油好厉害，松茸汤锅不知道是不是没放盐哇，好淡的，总体一般。
三牦记·牛肉火锅（温江店）,ywP464859538,团购下来很划算，两个人吃的很饱才100元，玉米锅边馍馍强烈推荐，忘了拍照了，反正吃完了，松茸汤很鲜，牛腩也好吃，很软不柴，菜品很新鲜，套餐搭配很合理，蘸水也是非常棒，都可以直接下饭吃了的，哈哈哈，总之对得起这个团购价，很棒，
三牦记·牛肉火锅（温江店）,匿名用户,价格比预期贵了一些，服务的话不错
三牦记·牛肉火锅（温江店）,cc123橙子,味道和环境都很好，菜品也比较有品质。。。。
三牦记·牛肉火锅（温江店）,夏夏家de,味道不错，关键是肉很好，牛腩非常好吃，五花肉，牛肉都可以烤，不错的。
三牦记·牛肉火锅（温江店）,FZK514505987,总体味道不错，值得尝试，只是服务员有点慢我点白酒一直没人应我，我直接去家乐福买了一瓶！
三牦记·牛肉火锅（温江店）,匿名用户,挺好吃的
三牦记·牛肉火锅（温江店）,菲菲小可爱666,服务态度一般，味道也一般，两个人吃了293差点300，很不值得又贵又不怎么样。
三牦记·牛肉火锅（温江店）,btq367288808,之前去吃过几次，刚开始觉得还不错，喜欢那儿的玉米馍馍，就是番茄汤鸡精味道太浓太浓了
三牦记·牛肉火锅（温江店）,匿名用户,好吃，只是有点小贵哦，不过味道真的不错
三牦记·牛肉火锅（温江店）,MqI509273342,菜品不错比较新鲜，服务热情耐心。
三牦记·牛肉火锅（温江店）,于非立,非常好吃的牛肉，服务周到，菜品新鲜 #玉米锅边馍# #牛肉丸子# #五花肉# #三牦特色牛肉包# #三牦四喜# #鸳鸯锅底# #手撕牦牛肉# #凉拌牛舌# #茼蒿# #秘制牦牛肉# #喜头牦牛肉# #烤鲜玉米馍# #鲜虾滑#
三牦记·牛肉火锅（温江店）,匿名用户,【口味】不是很辣，菜品丰富新鲜 【环境】停车方便
三牦记·牛肉火锅（温江店）,NHk539171999,还可以，色泽鲜艳，味道一般，就是折扣太少
三牦记·牛肉火锅（温江店）,君君同学晓,菜品很新鲜，味道很好，有专人服务，以后会常去
三牦记·牛肉火锅（温江店）,爸爸的小碎花,可能因为不是周末，人不是很多，服务态度很好，环境也不错。朋友过生日还送了一碗寿面。锅底是包含3道菜的，分量也还可以，蔬菜组合一大盆，没错是盆，有金针菇、玉米、娃娃菜什么的，当时看到这个顿时感觉应该少点一些素菜的。 #牛肉丸子# #蔬菜组合#
三牦记·牛肉火锅（温江店）,雪小妞Z,去了几次都是，味道好，服务好，值得推荐
三牦记·牛肉火锅（温江店）,魅影妖妖泪,还行，我们中午来没什么人，味道还可以
三牦记·牛肉火锅（温江店）,ll玲0,菜品很新鲜，环境也挺好的，服务态度更好，特别是人美心善的老板娘，还亲自给我们推荐合适的菜品，一点也没有因为用抵用券而怠慢，特别好，希望生意兴隆，我们也会常去的 #五花肉# #鲜切耗牛肉# #毛肚# #红汤锅底#
三牦记·牛肉火锅（温江店）,长腿中国小伙儿,不错
三牦记·牛肉火锅（温江店）,Steamingten,服务好应该是我重复选择的主要原因之一了，另一原因是味道本身真的好，烤肉 汤锅 火锅一站式购齐 【口味】 【环境】 【服务】 【等位】
