店铺名称,用户名,评论
三牦记·牛肉火锅（温江店）,段平平1127,「#套餐：精致六人套餐」 【口味】味道很不错的一家牦牛肉，涮烤一体的，已经来很多次了，一家人都说吃了不上火，菜品种类很多，看到都很舒服，吃微辣可以点他们家鸳鸯锅，番茄可以喝，新鲜番茄熬制的，喝到嘴里番茄味十足，小吃推荐现炸酥肉，锅边馍也不错哟，服务也特别周到的，大家可以来试试，停车也方便，环境不错(*๓´╰╯`๓)♡
三牦记·牛肉火锅（温江店）,嘟嘟狗狗,「#套餐：精致八人套餐」一直在他们家吃火锅，从图片可以看出来，牦牛肉很新鲜，牛肉丸是手工做的，吃起来很劲道，锅边馍是那种新鲜玉米打碎的弄得，烤着都能闻着挺香的，吃起来软软甜甜的，玉米的味道很多，刺身口感也很不错，番茄汤喝着特别鲜，喝了才知道，服务特别周到热情，值得来这家牦牛肉试吃味道，我们家就认他们家了
三牦记·牛肉火锅（温江店）,KbY160808175,「#套餐：精致八人套餐」 【口味】今天一家人又相聚三牦记，他们家牦牛肉很新鲜，吃了营养好，不上火，清汤可以喝 【环境】离我住的地方很近，就在马路边边上，停车方便，店里风格也很不错 【服务】服务热情，随时关注我们 【性价比】吃下来不贵，人均划算，主要是牦牛肉贵，下次又来，推荐这家牦牛肉
三牦记·牛肉火锅（温江店）,周小伟0523,「#套餐：四人餐」「#玉米锅边馍」「#牛肉丸子」「#三牦特色牛肉包」 【口味】今天和同事第二次来吃这家牦牛肉了，味道很不错的，我们喜欢吃辣，点的红锅，巴适的很 【环境】停车很方便 【服务】服务很热情，周到，随时关注，忙的情况下可以理解 【性价比】套餐菜份量很足，吃下来价格不贵，改天还会再来吃的
三牦记·牛肉火锅（温江店）,单时时时,吃完很久后反应是：这店怎么能这样骗人？ 吓得我第一次写超过一百字的评价。 我是被美团五星好评的外婆市井火锅人均40的标签名号吸引过来的。 市井火锅多么好评的名字。 没想到这家店实际上是卖牛肉的火锅店。 如果知道，我是绝对不会跑了两公里，踏进外婆市井火锅的门。 进店坐上了，拿到菜单看着中间较贵的火锅菜品，心中没有数，毕竟一份绝对不是很新鲜的毛肚都卖49块钱，一份菜就超过了人均40的标签，比小龙坎都贵，以为有什么骨折巨扣，结账的时候看着365金额确实十分震惊，实际结账花了300。 确实我点的肉菜很多，以潮汕牛肉的角度来评价我点的两个涮牛肉：一份牛肉30价格比正宗潮汕牛肉便宜十多块，但是肉质要比正宗潮汕牛肉差点。 嫩牛肉这道菜特别老，叫老牛肉吧。 火锅味道：吃着没有多少火锅味，有些菜煮着都不入味，吃完后身上全是火锅味。 男朋友口味比较挑，喜欢吃小龙坎和重庆火锅这种类型火锅，他吃了两份菜的量就没有吃了，我吃了剩下的所有，我胃口确实要大很多，吃了剩下的，但是我居然没有撑，平时小龙坎这种量就撑了，就离谱。 最后店家说买这家的代金券一样的用，呵呵，这样我就不能去市井火锅给差评了，会不会有更多的人像我一样上当受骗？
三牦记·牛肉火锅（温江店）,HUO567940426,「#套餐：精致八人套餐」 【口味】以前来吃过一次，味道真心不错，很少好评，他们家牦牛肉值得推荐给大家 【环境】位置就在马路边上，好停车，环境进来看到很舒服的，干干净净的，从菜品可以看得出来很舒服 【服务】服务员很热情，帮着煮菜，烤肉，烙饼 【性价比】份量还是不错的，套餐吃下来很划算
三牦记·牛肉火锅（温江店）,fPT646316080,菜品从图片可以看出来确实很新鲜，牦牛肉也是新鲜牦牛肉，我们点的鸳鸯锅，红锅味道真的涮肉很好吃，中间清汤可以喝，锅边可以烤牛排，五花肉，还不错，第一次吃涮烤一体锅，服务还不错，下次来温江又来她们家，推荐这家牦牛肉👍👍👍
三牦记·牛肉火锅（温江店）,uNB577126547,「#套餐：精致八人套餐」「#玉米锅边馍」「#五花肉」「#牛肉丸子」「#鲜切耗牛肉」「#三牦四喜」「#蔬菜组合」今天女朋友生日带她来吃三牦记，看到这家好评挺好，他们家可以涮可以烤，满足了我们一大桌的口味，菜品很新鲜，很多菜都很好吃，服务也很周到，用了心的，下次吃火锅又来，推荐给大家
三牦记·牛肉火锅（温江店）,txP940777986,"「#套餐：精致六人套餐」
   
【口味】这家涮烤一体的，同时吃两个味道，两种感觉「#牛肉丸子」牦牛肉丸子肉很劲道，感觉的出来是新鲜的牦牛肉，还是手工的
【环境】环境多好的，位置还多好找的，停车方便

【服务】服务比很多家的很好👌🏻，帮着煮菜，烤肉
 
【性价比】份量对于牦牛肉来说还是比较够了，毕竟牦牛肉贵，吃了感觉还是很好的，
   今晚吃的很好，下次聚会还会再来的，给大家推荐"
三牦记·牛肉火锅（温江店）,ccL713373061,「#套餐：精致六人套餐」「#玉米锅边馍」「#牛肉丸子」「#三牦特色牛肉包」「#牛腩」「#毛肚」 【口味】味道不错，第二次来了，第一次也是朋友推荐的，确实很不错，牦牛肉肉质很新鲜，涮烤都可以，巴适 【服务】服务很好，周到 【性价比】分量很足，吃下来划算
三牦记·牛肉火锅（温江店）,,
三牦记·牛肉火锅（温江店）,kemuzi88,「#套餐：精致八人套餐」「#玉米锅边馍」「#牛肉丸子」「#三牦特色牛肉包」「#鸳鸯锅底」 【口味】锅底味道十分浓厚，料很足。喜欢吃辣的可以点辣锅 【环境】位置很好找，就在马路边上环境不错，我喜欢这种风格 【服务】服务很周到，可以帮煮菜，烤肉 【性价比】份量很足，价格实惠，吃下来划算 推荐这家牦牛肉火锅
三牦记·牛肉火锅（温江店）,BIO856729576,「#套餐：精致八人套餐」「#牛肉丸子」「#三牦特色牛肉包」「#五花肉」「#三牦四喜」味道很不错👍菜很新鲜哟。份量很足。吃下来划算
三牦记·牛肉火锅（温江店）,Fch266580029,「#套餐：2-3 人市井火锅套餐」吃过其它地方的三牦记，温江这家还是第一次来吃，锅底更浓厚那种，番茄汤喝着很新鲜，新鲜番茄炒的味道就是不一样，锅边馍吃着就是那种新鲜玉米做的，烤着都特别香，牛肉不错，小吃我们点的南瓜饼，很好吃，服务不错，下次过来还会再来的
三牦记·牛肉火锅（温江店）,Hgz563002062,"通过朋友介绍这家牦牛肉火锅
      
【口味】锅底十分浓香，一次性锅底，吃的很满意，我们都是中年人了，都觉得非常不错，
【环境】用餐环境还可以，牦牛肉的风格
【性价比】菜品丰富新鲜，摆盘特别漂亮，看到都有食欲，火锅主要就是菜品新鲜
【服务】小妹妹服务特别好，十分热情。
向大家推荐这家牦牛肉，可以涮可以烤！满分"
三牦记·牛肉火锅（温江店）,MWk771654035,【口味】味道比想象中的更好吃，以后都来这家牦牛肉了，菜品新鲜，摆盘多漂亮，边涮边烤，烤肉推荐五花肉，小吃推荐包子 【环境】环境不错，中午比晚上清净些，安逸 【服务】服务员周到，热情 【性价比】性价比真的高，吃下来划算
三牦记·牛肉火锅（温江店）,zBB410370061,之前和闺蜜来吃过一次，都说很好吃，锅边可以烤肉，推荐他们家五花肉。卷着生菜别有一番滋味，真的很好吃，菜种类很多，也很新鲜，主要是吃下来还不贵，服务很好，牦牛肉很嫩，吃得很好
三牦记·牛肉火锅（温江店）,尘缘无惜,牛肉特别正宗，店面环境相对宽敞，菜品什么的有要求的话服务员会下锅，吃的时候玉米饼有一两个没来得及翻面焦掉了，直接又送了我们一份，上菜速度还算快，其他肉不知道是不是现切的，牛肉是真的都是现做的，新鲜的很，毛肚，肠子啥的很脆很新鲜。 相比附近的其他火锅店而言，菜品和锅底口感都不错，火锅底料好像和上次吃不一样，更香更好吃了。菜品量的话就是正常火锅店的量。 全点的肉，牛肉点了有10来份，还有毛肚虾滑鸭肠啥的都各点了一份，五个人吃加锅底500左右，人均109，还可以
三牦记·牛肉火锅（温江店）,fwo320480141,「#套餐：四人餐」今天不知道是第几次过来吃了，味道真的很不错，环境优美，菜品很丰富，样式还多漂亮，星期六星期天晚上需要排队，牦牛肉绝对比黄牛肉那些很好吃，服务员也贴心，煮菜多热情，小吃推荐包子，现包现蒸的，味道很不错的一家火锅。
三牦记·牛肉火锅（温江店）,zy长牙,"今天生日和朋友一起来试试这家牦牛肉，评分很高！地方很好找，进来环境不错。
          味道，我们点的鸳鸯锅，清汤很鲜，红汤色香味俱全，我们都喜欢，越吃越想那种。
            菜品摆盘很漂亮，看得出来生意很好，菜很新鲜，还送了玉米膜，小吃很不错，特别是牛肉包。
             服务很好，出来吃饭就是要这种感觉！把这家牦牛肉火锅推荐给大家。"
三牦记·牛肉火锅（温江店）,Zad627369842,服务态度好，口味也不错，有一点点辣，菜品新鲜
三牦记·牛肉火锅（温江店）,igq161949615,一家性价比非常高的店，从老店到新店，一直都喜欢去他家吃，番茄锅底健康又好吃，从怀孕到现在宝宝都近4岁了，一如既往钟爱他家，宝宝特别喜欢他家的烤玉米饼，每次去一份玉米饼基本上都要留给宝宝吃，老板人也特别好，吃他家炝锅鱼，没法烤玉米饼，那天人特别多，因为小朋友喜欢玉米饼，老板还专门给小朋友开小灶烤了一份玉米饼，另外他们家的牦牛肉包子也好吃，家人都喜欢，有时还会打包带走，特别推荐的一家店。
三牦记·牛肉火锅（温江店）,www19875,「#套餐：精致六人套餐」「#五花肉」「#三牦特色牛肉包」「#牛肉丸子」「#蔬菜组合」「#牛腩」「#千层肚」推荐这几个菜，太好吃了，吃完才想起拍照，哈哈😄，锅底调料十分足，越吃越想吃那种，虾滑真的是真🦐那种，小吃推荐包子，牦牛肉，喜欢吃牦牛肉可以来这家，服务也很到位，不错
三牦记·牛肉火锅（温江店）,带着腹肌吃美食,今天下午看着美团这家评论挺高的，和朋友来试试，我们三个，味道不错，价格优惠，份量很足，菜品摆盘很漂亮，新鲜，还送了玉米膜，新鲜的玉米，偶尔吃点促粮挺好，特别是烤的五花肉，配着生菜特别好吃，服务不错，推荐这家，味道太巴适了，下次再来
三牦记·牛肉火锅（温江店）,CNO93777395,第一次吃到上菜这么慢的火锅店，味道是确实比较巴适的，就是服务不行，生意好卖多请两个服务员嘛，真的是，我们九个感觉锅底都要熬干了人都要饿死了才上来两三个菜
三牦记·牛肉火锅（温江店）,匿名用户,地方很好找，环境也挺好的。牛腩牛杂煮过之后真的巨好吃。服务员小姐姐也都很热情，服务的很到位。牛肉种类好多，想都尝一遍的话得多来几次了😄。蛮不错的，下次想吃牛肉的话首选这家。
三牦记·牛肉火锅（温江店）,君君同学晓,吃过很多次，搬了地方也经常来，牛肉很喜欢，也推荐朋友都来了
三牦记·牛肉火锅（温江店）,rGE132043843,前天才来吃了，觉得味道还不错，今天带朋友一起来吃，服务也很好，主要是菜品很新鲜，推荐这家牦牛肉，他们都说好吃
三牦记·牛肉火锅（温江店）,DPZ406747261,在美团上看到这家评论很好，决定来试试味道，生意不错，菜品新鲜，摆盘也很好看，漂亮，番茄特别新鲜，不像其他的家清汤是番茄酱，喝着特别好，红锅特别好吃，服务很好，下次还会来这家火锅！给他家点个赞！推荐给你们！
三牦记·牛肉火锅（温江店）,匿名用户,踩坑了，不好吃，连锁店怎么和龙泉那家味道差那么远，不推荐
三牦记·牛肉火锅（温江店）,匿名用户,「#套餐：2-3 人市井火锅套餐」今天排队吃的这家牦牛肉，味道真的不错，我们点的鸳鸯锅。不太能吃辣，服务员太贴心了，下次再来，会推荐给朋友的
三牦记·牛肉火锅（温江店）,喂迩别闹,在门口都闻着特别香，吃着味道确实巴适，我们点的红锅，看着胃口都来了，吃着是正宗牦牛肉，越吃越想吃，还送了我们玉米馍，特别香，菜品特别新鲜，下次还会来的，环境也特别好，推荐给喜欢吃牛肉的朋友，服务特别贴心。这次吃的特别好
三牦记·牛肉火锅（温江店）,郑丹702,老顾客，味道一如既往的好。值得多次回顾。。。。，，，，，服务态度好。位于公园对面，吃了可以散散步。玉米馍馍超级棒，
三牦记·牛肉火锅（温江店）,zgF189451859,下雨天突然想吃牦牛肉了，约起朋友说来就来，他们家味道真的不错，很新鲜，口感各方面我们都觉得很高，点个赞，性价比很高
三牦记·牛肉火锅（温江店）,VxT299921487,味道非常棒 ，大年初一路过看到生意火爆，就进去试一下，点了几份牦牛肉，货真价实非常新鲜，鲜牛肉吃起来口感确实和冻品不一样，点了两三份小吃，酥肉特别大特别脆吃起来很过瘾，还有牛肉包也非常好吃，等了十多分钟但是没让我失望，锅底味吃到最后也非常舒服。性价比也很高，过节优惠力度也很大，下次还来。
三牦记·牛肉火锅（温江店）,GRI424222533,第一次来温江，在美团上评分很高，决定来试试味道，进店环境很好，菜品种类很多，主要是卖牦牛肉，摆盘特别好看，我们点的红锅，色香味俱全，闻着特别香吃着更香，服务也很好，下次到温江还会来吃，我们三个人吃的挺好，价格不贵！
三牦记·牛肉火锅（温江店）,ZZZ701839639,「#玉米锅边馍」「#五花肉」「#鲜虾滑」「#龙利鱼片」「#风味烤牛肉」这几个菜我都很喜欢吃，我们两个都是老顾客了，经常来吃的，喜欢吃他们家烤的五花肉，很好吃，服务周到，可以帮我烤肉，点个赞，改天又来
三牦记·牛肉火锅（温江店）,wsdxj888,此次用餐总体来说不错，觉得比较认可的地方有：服务。味道都很好，四人餐完全够吃，后面还剩了一点点素菜。火锅烤肉都吃了，价格也挺便宜的，总体很满意，以后还会来！性价比高！比预期的好很多，环境也还可以，服务也不错！
三牦记·牛肉火锅（温江店）,_qqc5m1352688601,经常和朋友来吃，味道越来越好吃，菜品分量很足，营养又健康，很划算的8人餐，小吃，喝得饮料都有两个，用餐环境很舒服，感觉在家里的感觉，推荐给大家
三牦记·牛肉火锅（温江店）,TxQ341346018,「#玉米锅边馍」「#五花肉」「#牛肉丸子」「#三牦特色牛肉包」「#鲜切耗牛肉」他们的菜都很新鲜，锅底味道很不错，很好吃，服务很好，推荐给喜欢赤果果的朋友
三牦记·牛肉火锅（温江店）,dHB647306888,「#套餐：精致八人套餐」「#玉米锅边馍」「#牛肉丸子」「#五花肉」「#三牦特色牛肉包」「#鲜虾滑」「#牛肉刺身」这几个菜我都好喜欢，真的锅底味道太好吃了，煮菜很入味，越煮越好吃，推荐
三牦记·牛肉火锅（温江店）,米凝儿,看到美团好评来的，味道确实很不错，锅底看到都很有食欲那种，菜品丰富多样，最主要看到很新鲜，服务也很好，热情，周到，做餐饮就是要这样，客人才喜欢，喜欢吃火锅的小伙伴的可以来试试这家牦牛肉，肉质各方面都还不错，推荐
三牦记·牛肉火锅（温江店）,上弦月2021,「#套餐：2-3 人市井火锅套餐」来温江玩，看到他们家感觉还不错，味道确实不错，我们点的清汤的，喝起来特别舒服，很鲜，下次有机会再来吃
三牦记·牛肉火锅（温江店）,KAK259209456,跟几个月前吃的改变了不少，调料少了，菜贵了很多，性价比不高。跟几个月前吃的改变了不少，调料少了，菜贵了很多，性价比不高。跟几个月前吃的改变了不少，调料少了，菜贵了很多，性价比不高。跟几个月前吃的改变了不少，调料少了，菜贵了很多，性价比不高。跟几个月前吃的改变了不少，调料少了，菜贵了很多，性价比不高。跟几个月前吃的改变了不少，调料少了，菜贵了很多，性价比不高。
三牦记·牛肉火锅（温江店）,oFd313213835,今天放假看到好评来的，味道真的不错，我们读书就是过来有点远，我们买的套餐，吃下来价格很划算，菜品很新鲜，服务特别好，环境不错，推荐这家，玉米饼太香了，小吃最爱包子，虽然有点远，但是我们还是会再来的，赞赞赞赞👍
三牦记·牛肉火锅（温江店）,yangwenxu007,「#套餐：四人餐」今天路过他们牦牛肉，生意太好了吧，排队吃的火锅，等了很久还是觉得值得，这个味道很不错，菜品，服务各方面都不错，下次又来
三牦记·牛肉火锅（温江店）,uRW530887660,「#玉米锅边馍」「#牛肉丸子」「#三牦特色牛肉包」「#鲜切耗牛肉」味道很不错的一家牦牛肉，服务也好，推荐他们家
三牦记·牛肉火锅（温江店）,匿名用户,三牦记锅底味道真心不错，菜品丰富新鲜，量足，看到菜品食欲特别足，忍不住流口水。环境干净、整洁。牛肉丸特别正宗，牛肉包棒棒哒，好吃的太多了，一个月来吃几次了。是聚会首选之地。
三牦记·牛肉火锅（温江店）,匿名用户,菜品非常不错，很好吃，吃它吃它。
三牦记·牛肉火锅（温江店）,eik983027443,火锅很好吃 肉都是新鲜肥美 小姐姐服务也很好 下次还会和姐妹再来的
三牦记·牛肉火锅（温江店）,XtZ939253960,【口味】味道很不错，👍👍 【环境】停车方便，环境不错 【服务】服务很周到，热情 【性价比】份量很足，吃下来很划算
三牦记·牛肉火锅（温江店）,euS545177727,「#玉米锅边馍」「#五花肉」「#三牦特色牛肉包」「#牛肉丸子」「#西红柿锅」这些都是每次必点的几个菜，番茄汤特别鲜，好喝，服务也好，推荐给大家
三牦记·牛肉火锅（温江店）,XzP222692513,「#套餐：精致六人套餐」味道好极了，环境不错，服务热情，下次和朋友又来，份量很足，吃下来价格很划算
三牦记·牛肉火锅（温江店）,Wiy944953832,中午来温江办事，过来试试这家高分牛肉火锅，本来抱着试试的态度，但是一上菜就被惊艳到了，菜品很丰富，份量也很足，火锅很香，味道很独特，一点也不油腻，配料可以调很多种口味！！！还会继续打卡。
三牦记·牛肉火锅（温江店）,ijS867873347,「#套餐：2-3 人市井火锅套餐」看到好评来的，味道的的确确很好吃，番茄很新鲜，喝着很好喝，牦牛肉口感挺不错的，第一次吃，下次吃火锅又来
三牦记·牛肉火锅（温江店）,ZZZ701839639,好吃噢，火锅强烈推荐牛腩，煮出来耙耙的，十分入味儿
三牦记·牛肉火锅（温江店）,冰阔乐配火锅儿,服务：老板阿姨人特好，跟我朋友产生分歧，他想要菌汤的白锅，我想要番茄汤白锅，为了喝番茄汤，朋友喝不惯番茄汤的酸，老板阿姨直接去端了两碗番茄汤给我和我老公喝。有个小姐姐人还是很好，就是记性不怎么好，说的要可乐转身就忘了，说的要豆奶转身也给忘了，不过经提醒第二次很快就拿来了，动作也很麻利。吃完的盘子及时就收走了。 口味：本来个人一贯对那种边涮边烤的锅底浓厚程度都不抱希望的，同事强烈推荐，红锅锅底确实很浓厚，辣度适中，就是有个疑惑，感觉有点甜。番茄汤好喝。玉米馍馍好吃，外酥里嫩。有些店的招牌牛肉会放香菜末洒在牛肉上，香菜简直就是我的噩梦，这家不错，招牌款牛肉没有在上面洒香菜，喜欢香菜的可以自己调蘸碟的时候加。干海椒面也好吃，配上花生碎简直不摆了。唯一就是千层肚的份量太少，拿上来的时候我以为是拿错了，比推荐菜的照片少了很多，问了阿姨说是这个份量。
三牦记·牛肉火锅（温江店）,yxq灰姑娘,牦牛肉吃了营养好，锅边馍小朋友可以吃，很好吃，很香，菜品也不错，推荐给大家
三牦记·牛肉火锅（温江店）,顾夏卿,"发生了一些非常不满意的情况，真的糟糕透了。最后，我说我会写大众点评曝光这事儿。女老板急了，追出来说他们有监控，要调监控。我不怕，我一没骂人，二没打人，三没乱说，我怕什么?倒是女老板心虚了吧，又出来威胁我，说她拍了我的照片，我要是写大众点评，就要曝光我。还说她们在温江开了二十多年，不怕的。

你这么威胁我，没问题，我就要把这事情在大众点评详细说出来，让大家都知道哦。"
三牦记·牛肉火锅（温江店）,XaN750996464,以前他们在家乐福楼上我们都去吃过了，味道真的很好，正宗的牦牛肉，吃着肉特别好吃那种，服务也很好，清汤可以喝，还会再来的
三牦记·牛肉火锅（温江店）,bDV518973237,菜品丰富很新鲜，锅底味道很浓厚，香辣足，分量很足，下次又来，推荐
三牦记·牛肉火锅（温江店）,_qqs3t1428825125,去吃过好多次了，真心觉得不错，当时是是朋友推荐去的，去了一次就爱上了，哈哈哈哈，番茄汤是真的很好喝，每次去必点牛蹄筋，煮起真的超级香的，而且是烤涮煮一体的，很方便，不得不说每个锅送的那个玉米锅边馍真的超级好吃。推荐推荐！！！
三牦记·牛肉火锅（温江店）,JeS502306153,"在温江公园附近，带娃娃们在公园玩去吃的，点的鸳鸯锅,蕃茄锅很鲜非常好喝，他们家牛肉包子特别好吃，还打包带了一笼回家。红糖糍粑外酥里嫩相当不错👍牛肉也是相当正宗的牦牛肉，口感不错👍。老板人很热情，服务也很好。"
三牦记·牛肉火锅（温江店）,Syv498947350,味道棒棒，辣味适中，越吃越有点辣越想吃，食材很新鲜让人放心，牛肉很鲜嫰，正宗牦牛肉，带上几个朋友来吃，他们一个劲说好吃。吃不腻，哈哈哈
三牦记·牛肉火锅（温江店）,xushilan,「#五花肉」「#玉米锅边馍」「#三牦特色牛肉包」「#牛肉丸子」推荐这几个菜，我个人觉得很好吃，服务态度好，点个赞
三牦记·牛肉火锅（温江店）,JPs314543805,「#玉米锅边馍」「#牛肉丸子」「#三牦特色牛肉包」「#鲜虾滑」推荐小吃牛肉包，现包现蒸的´◡`，牛肉丸子是我最爱，推荐，菜品很新鲜
三牦记·牛肉火锅（温江店）,zcs5550,总体来说，味道，服务，菜品，环境，卫生，都蛮不错的，主要是价格实惠，小吃巴适，吃的饱饱的，下次又来，推荐这家牦牛肉。
三牦记·牛肉火锅（温江店）,fwo320480141,环境不错，味道也蛮好的，不错不错哦哦哦哦哦哦哦哦
三牦记·牛肉火锅（温江店）,匿名用户,环境不错，菜品质量也挺好的，味道巴适适合朋友三四聚会，吃了饭还可以到温江公园散步游逛😄 😄 
三牦记·牛肉火锅（温江店）,pxY378712118,此次用餐总体来说不错，觉得比较认可的地方有：口味、团购接待、环境。
三牦记·牛肉火锅（温江店）,小浆果263,两个人 用了券还额外支付了两百七 可以说性价比很低了
三牦记·牛肉火锅（温江店）,GGLLLX,红锅味道很好，番茄汤味道很浓郁，一定要点圆子，牛肉圆子很劲道，还免费送了玉米馍馍，店员随时照顾，值得回顾。
三牦记·牛肉火锅（温江店）,Gck0526,每次来必点糍粑，特别好吃，吃了就知道
三牦记·牛肉火锅（温江店）,only後,又来吃了，想吃他们家的牛肉包，推荐手打牛肉丸，手工做出来的，五花肉是他们家特色，去他们家必点菜，服务很好，点个赞
三牦记·牛肉火锅（温江店）,匿名用户,越来越差了，算是老顾客了，拉胯。
三牦记·牛肉火锅（温江店）,gnR123883563,「#套餐：2-3 人午市超值套餐A」牛肉很嫩，玉米饼吃起来很糯，很甜，牛肉丸子吃起来很Q弹，牛肉很新鲜，素菜也很新鲜，服务员服务态度也很好，服务员还会陪你聊天，帮忙剪玉米饼，还送了一份小布丁，超级赞👍！很棒！推荐！淦！
