店铺名称,用户名,评论
鱼契·烤鱼（西南财大总店）,匿名用户,就餐环境很可，菜量真的很大，性价比很高。
鱼契·烤鱼（西南财大总店）,熊仔伯伯,性价比贼高，味道和烤匠比有烤匠的一半吧，主要感觉鱼不新鲜，肉很软了，成都烤鱼还是觉得烤匠好吃。也有可能运气不好刚好遇到鱼是不新鲜的，其他都很满意，玉米饼和五花肉都很好吃，酸梅汤也可以
鱼契·烤鱼（西南财大总店）,zqllllove66,味道还不错，环境也还是可以，无意间美团看到，
鱼契·烤鱼（西南财大总店）,淼淼可可洁,味道咸了些
鱼契·烤鱼（西南财大总店）,OCN822574321,「#套餐：情侣烤鱼双人餐」可以不错，环境是真的好，小姐姐也很好哈哈
鱼契·烤鱼（西南财大总店）,痴痴大魔女,烤鱼真的很不错，包浆豆腐也不错，就是豆腐里有折耳根我受不了，提醒不爱吃的人记得提前告知。「#套餐：超值烤鱼三至四人餐」
鱼契·烤鱼（西南财大总店）,gVY604720647,味道不错，新开的店，坐的二楼，环境很喜欢，三个人吃份量比较足，玉米饼也很香，酸梅汤稍稍酸了一点，不过不是那种粉粉兑的，是真的用山楂这些泡的，用料很足，挺浓的，总之很满意，值得！「#套餐：超值烤鱼三至四人餐」 【性价比】很高
鱼契·烤鱼（西南财大总店）,晓夜清寒,不错的
鱼契·烤鱼（西南财大总店）,S.H134,还行，主要是环境好，烤鱼的话没什么特别的
鱼契·烤鱼（西南财大总店）,昌昌昌昌昌。,东口味可以，环境可以，不过这个3-4人餐有点过分了，两到三人餐还差不多，量那么少，虚报
鱼契·烤鱼（西南财大总店）,Yfg814952402,味道不错 性价比极高 分量也很多 两个人吃的很撑
鱼契·烤鱼（西南财大总店）,锦7087,秒杀券买的感觉那个蒜香鱼很不错，但是那个干锅里面的肉太少了味道不怎么样，他们家装修很不错，适合情侣约会
鱼契·烤鱼（西南财大总店）,_qqx8s1431141091,除了套餐里的红糖糍粑有点冷不是很好吃除外都不错了？三个人点了一个套餐再加份小酥肉，吃的太撑太舒服了，环境也不错，力推。
鱼契·烤鱼（西南财大总店）,Tting_ye,不错不错，就是菜品相对较少一点，玉米饼特别好吃，很香甜！分量很足，环境不错，就是有点儿热，然后水果供应不足，我们去拿的时候已经没有了，哈哈哈哈
鱼契·烤鱼（西南财大总店）,匿名用户,这次就餐整体感觉很赞，比较满意的方面有：口味、环境、性价比。这次就餐整体感觉很赞，比较满意的方面有：口味、环境、性价比。这次就餐整体感觉很赞，比较满意的方面有：口味、环境、性价比。四个人去吃的 ，都没吃完，分量挺足的。
鱼契·烤鱼（西南财大总店）,dTS992254538,真的超划算！！！也很好吃！！！不是托
鱼契·烤鱼（西南财大总店）,天赐呵呵灬,味道好，分量很足，每次都吃的好饱，哈哈 推荐给大家，值得品尝
鱼契·烤鱼（西南财大总店）,小吖嘛小可爱,味道很不错 超级不错 强烈推进哟。
鱼契·烤鱼（西南财大总店）,醉饮红茶,很不错的一家店，味道很不错，小食也很可口！好评！！
鱼契·烤鱼（西南财大总店）,NTF255946581,分量很足，味道很川味，赞👍🏻
鱼契·烤鱼（西南财大总店）,aef164995810,不是特别有味，平淡，但环境可以
鱼契·烤鱼（西南财大总店）,elZ340639378,真是吃得满足！第二次吃了，第一次是假期来，吃了念念不忘期盼着，终于开学又来了。招牌味道的烤鱼和泡椒味都好吃，现在新店搞活动，性价比也不错，已经安利给同事。还会再来。如果能够抢到秒杀券就更好了，哈哈哈哈
鱼契·烤鱼（西南财大总店）,EhG374640977,首先地理位置很好找，然后店面内的环境很不错，服务也很好周到，味道也很好，我们三个人吃，都还没有吃完，玉米饼要趁热吃好吃，掌中宝很不错，店里还有各种小吃，总之，各方面都还挺不错的，下次还会去他们家吃的。
鱼契·烤鱼（西南财大总店）,xwjq1988,我点的香辣的，味道还不错，加我三个人吃，刚刚好，吃完了，份量算比较足的了，下次还会去
鱼契·烤鱼（西南财大总店）,熊熊bear20,非常喜欢！都去了很多次了！！！！！！
鱼契·烤鱼（西南财大总店）,Cnn652052075,这家店环境比较高级，但是价钱合适，不贵，鱼的味道也很好吃，我很喜欢。
鱼契·烤鱼（西南财大总店）,匿名用户,味道不错   就是等的时间很久很久很久
鱼契·烤鱼（西南财大总店）,by侧耳倾听,性价比Gao经常购买，棒棒哒，那个沙拉酱不晓得咋搞的味道棒，下次吃蒜香的
鱼契·烤鱼（西南财大总店）,bSd294139779,很满意的一次就餐体验，整体评价的话我觉得：环境。
鱼契·烤鱼（西南财大总店）,ath364049061,还不错，就是素菜少了点，真的只有点点素菜
鱼契·烤鱼（西南财大总店）,uEl911969030,是一家新店，刚开张优惠也很多，两人餐也比较实惠，烤串味道挺好吃的，玉米饼也挺好吃的，就是感觉点的口味有点太辣了，鱼有点不太紧致，其他配菜还是挺多的，比较丰富 【环境】环境比较好，一进去冷气比较足，是那种暗调的装修，还是挺有风格的，总体来说还是值得
鱼契·烤鱼（西南财大总店）,薇薇一笑有小木子,不喜欢吃鱼的我，好爱这个味道，蒜香的有点吃海鲜扇贝的感觉
鱼契·烤鱼（西南财大总店）,素兮99,很不错，环境很好，味道也很棒，美团上订的很划算，而且物超所值，
鱼契·烤鱼（西南财大总店）,Cnn652052075,这家店的鱼味道很好，不是很辣。环境相当好，干净整洁。
鱼契·烤鱼（西南财大总店）,IdX942356976,看着是温江美食第一名就直奔过去的，环境很好，上菜速度也很快，小哥哥小姐姐服务也很好，味道不错不错滴，四个人吃了也没有吃完，总得来说非常完美。
鱼契·烤鱼（西南财大总店）,Eriklees,烤鱼很好吃
鱼契·烤鱼（西南财大总店）,相信659,不好吃呀「#套餐：情侣烤鱼双人餐」
鱼契·烤鱼（西南财大总店）,顶楼主说,感觉店内环境很不错，菜品口味也ok
鱼契·烤鱼（西南财大总店）,nXi882082585,此次用餐总体来说不错，觉得比较认可的地方有：口味、环境、性价比。
鱼契·烤鱼（西南财大总店）,xwjq1988,这个团购的种类比较多选择，味道还是挺不错的
鱼契·烤鱼（西南财大总店）,ztt明天,烤鱼点的蒜香味，鱼肉很嫩，口感不错
鱼契·烤鱼（西南财大总店）,kimyuyue,之前团了3-4人餐，后来退了，没那么多人……两人餐，终于吃上了，大写的赞，玉米饼不错，小孩子喜欢，烤肉无功无过，豆鼓烤鱼，鱼皮脆脆的，个人挺喜欢
鱼契·烤鱼（西南财大总店）,xfd582842422,烤鱼味道可以 鱼肉不是很入味 三人吃刚刚好
鱼契·烤鱼（西南财大总店）,匿名用户,很不错，份量很足
鱼契·烤鱼（西南财大总店）,Euynas,还可以吧 很划算但是味道一般 服务很好哦 鱼有一点没入味环境也非常不错
鱼契·烤鱼（西南财大总店）,ItO877704081,「#套餐：情侣烤鱼双人餐」和男朋友一起去吃的，味道不错，米饭也很香
鱼契·烤鱼（西南财大总店）,_qqxkm1374421961,这次就餐整体感觉很赞，比较满意的方面有：配菜合理、口味不错、服务到位。 餐厅主色调装修灰色系列，时下流行的风格！菜品方面味道中上，主打烤鱼不会太咸太辣，但是香味是有的。服务的阿姨、小姐姐很nice.所以会推荐给其他人！
鱼契·烤鱼（西南财大总店）,fRS606613842,特别好吃，子姜烤鱼和鱿鱼干锅，和室友都很满意
鱼契·烤鱼（西南财大总店）,hiccxie,「#套餐：超值烤鱼三至四人餐」 【性价比】我们是两个人吃的，还是挺合适。 【环境】环境很好，像西餐风格。 【服务】服务也到位 「#自制酸梅汤」味道有点过于浓郁了…哈哈哈 「#特色烤鱼」我们要的蒜香味，我以为是带辣的，但是有点淡了，没有其他味道。但是也还好，🐟挺大的，要是再焦一点更好。感觉麻辣的应该要好吃点 「#玉米饼」好吃好吃 喜欢 【口味】总体不错，还有其他小吃
鱼契·烤鱼（西南财大总店）,wyy5511,还可以吧 哈哈「#套餐：超值烤鱼三至四人餐」「#套餐：超值烤鱼三至四人餐」团购的
鱼契·烤鱼（西南财大总店）,出门不带桨,这家真的超值，可惜忘了拍照，当时我们四个大人和一个小孩，性价比高，吃到撑还是没吃完，东西都挺大份的，正常点也够吃了，去的时候比较忙，有自助水果和零食，等了不到二十分钟就上菜了，烤五花肉和掌中宝味道都不错，推荐！
鱼契·烤鱼（西南财大总店）,好久不见xt,此次用餐总体来说不错，觉得比较认可的地方有：口味、环境、性价比、服务、团购接待。
鱼契·烤鱼（西南财大总店）,祈福or浅妆微黛,点了份双人套餐又加了菜味道很好特别是香辣烤鱼 酥肉 玉米饼饼（着急吃没来及拍照）太符合我的胃了啊 好评 环境很好装修风格很舒适 小姐姐的服务态度也超好 赞
鱼契·烤鱼（西南财大总店）,tdz591174360,目前，我觉得温江比较好吃的烤鱼。
鱼契·烤鱼（西南财大总店）,障障,烤鱼很不错，就是蔬菜品种和数量可以增加一些，酸梅汁略酸了一些
鱼契·烤鱼（西南财大总店）,悦悦莫得感情,从国色天乡过去的 位置有点远 点的是一个88元的双人套餐 美团还立减了20元 份量啥的都很合适 好吃又实惠 服务也蛮不错的
鱼契·烤鱼（西南财大总店）,匿名用户,味道不错 上菜也比较快 挺好的 环境也不错 有两层楼 位置也好找 酸梅汤也好喝
鱼契·烤鱼（西南财大总店）,tdz591174360,很好。。
鱼契·烤鱼（西南财大总店）,Dll46692711,装修好，环境干净，服务热情。烤鱼味道不错，吃过多次。
鱼契·烤鱼（西南财大总店）,jiS960626510,刚好到成都陪老婆考试，考完了就准备选个地方吃饭，看这个排名挺靠前，然后刚好有秒杀活动，120的套餐差不多打了对折，我觉得占了店家的便宜，所以来评论下，首先每个菜的分量都很足，我没吃多少就打包回家了。其实味道也还可以，值得一吃！
鱼契·烤鱼（西南财大总店）,pyy328520,第二次来了，感觉这次的泡椒味好咸，不太喜欢！里面的素菜少了些
鱼契·烤鱼（西南财大总店）,追风筝的……,环境不错 但是鱼还是差一点味道，
鱼契·烤鱼（西南财大总店）,nkU168561344,麻辣烤鱼挺好吃的 酸梅汁是冰的味道也很好 环境挺高大上的 值得去
鱼契·烤鱼（西南财大总店）,Hmh402383125,来吃过好几次了，一直没时间评论，味道很好，服务也可以，价格实惠。
鱼契·烤鱼（西南财大总店）,yu_han123,味道很好，但是第二次去就很淡了，不知道是不是换厨师了
鱼契·烤鱼（西南财大总店）,zUN720770518,环境很不错，烤鱼的味道也很棒，套餐划算
鱼契·烤鱼（西南财大总店）,aMF311037262,忘了拍照了，但黄金蒜香味烤鱼真的绝赞呀！烤五花肉味道也不错～店里的小菜黄瓜真的好吃，两个人吃了好多
鱼契·烤鱼（西南财大总店）,iGW667527266,朋友推荐的。很好吃。服务态度很好！
鱼契·烤鱼（西南财大总店）,狂热分子494,此次用餐总体来说不错，觉得比较认可的地方有：环境、服务、性价比、口味。
鱼契·烤鱼（西南财大总店）,总要起个名字2020,味道不行，装修环境挺好，下次可能还回来试试
鱼契·烤鱼（西南财大总店）,YDl973187648,一般吧，不咋好吃，蒜蓉的。有点腻，鱼不入味，以前吃其他烤鱼都吃完，这个剩下了，战斗力强的老公都吃不下。烧烤还可以，不过2串😹。
鱼契·烤鱼（西南财大总店）,颖若晓风,不吹不黑 味道差一点儿 环境还可以 烤鱼干锅包浆豆腐 差评
鱼契·烤鱼（西南财大总店）,LyK937618897,此次用餐总体来说不错，觉得比较认可的地方有：口味不错、菜品丰富、份量充足、环境优美、配菜合理、服务到位。两个人没吃完一条鱼，份量很足！！！！！，但是鱼有点儿不入味
鱼契·烤鱼（西南财大总店）,Zvo818884329,此次用餐总体来说不错，觉得比较认可的地方有：口味。
鱼契·烤鱼（西南财大总店）,AfM328600120,不错
鱼契·烤鱼（西南财大总店）,oKr866403818,垂涎已久的财大门口新开烤鱼店，周末和男朋友一起去试吃了一下。店面装修逼格高，服务热情，上菜快，烤鱼味道简直不要太赞，份量足，团购实惠，推荐推荐！ 「#套餐：超值烤鱼三至四人餐」
鱼契·烤鱼（西南财大总店）,cCz749282790,颜值高，味道正，份量足。3个人一起选的蒜香，我个人喜欢辣的，大姐给准备了小米辣，太感谢了。有自助小吃。
鱼契·烤鱼（西南财大总店）,JVz853955684,味道巴适  服务又好   有五花肉肉串  玉米饼  一次性买了两张卷的
鱼契·烤鱼（西南财大总店）,yRe378194698,味道不错，，两个人去吃的话分量很足，很满意
鱼契·烤鱼（西南财大总店）,薄荷草931,环境可以，味道还行！值得来，不错哦。
鱼契·烤鱼（西南财大总店）,匿名用户,「#套餐：情侣烤鱼双人餐」选的香辣豆豉烤鱼，量挺足的两个人都没吃完，配菜味道还行，鱼有点儿太咸了～玉米饼味道也一般
鱼契·烤鱼（西南财大总店）,uQu594093137,味道可以，就是人太多了，有点热。我们点的四人餐，两个人吃撑了。
鱼契·烤鱼（西南财大总店）,Ily171587865,环境好，服务热情，菜品也好吃，推荐给大家！
鱼契·烤鱼（西南财大总店）,eGo310729386,味道不错，份量也足。
鱼契·烤鱼（西南财大总店）,cyj19850825,冲着装修去的，蛮时尚。结果味道让我惊喜了，而且老板也很好，推荐！
鱼契·烤鱼（西南财大总店）,mEy412324513,味道好，服务好，干净卫生，值得推荐，谢谢小哥哥小姐姐们的辛苦付出🤝
鱼契·烤鱼（西南财大总店）,gjksndjd,去的时候没有排队 当时是因为要考试就在美团看了吃的 评分说这家还不错 就买了 服务挺好的 鱼没有吃完 量挺足 喜欢吃那个玉米饼
鱼契·烤鱼（西南财大总店）,HtE678671998,环境很好，态度也很好！小吃什么的都很赞，就是主菜烤鱼味道有待提升，麻辣味，味道太淡，而且鱼肉不入味，蒜香，肉不入味，而且辅料沾吃会很腻。
鱼契·烤鱼（西南财大总店）,UMe887803669,很满意的一次就餐体验，整体评价的话我觉得：性价比。
鱼契·烤鱼（西南财大总店）,匿名用户,服务态度很好，味道也不错，菜品新鲜，环境比较好，干净整洁，下次还会的
鱼契·烤鱼（西南财大总店）,sHh564695749,美团上团的套餐非常不错 店家服务态度好，菜品味道也不错，环境也很好 值得一去
鱼契·烤鱼（西南财大总店）,曾真的饿鸟,还可以，性价比棒，鱼稍微没那么入味的感觉
鱼契·烤鱼（西南财大总店）,Hrr659344168,头一次吃鱼没吃到啥骨头，应该是处理过的，我不爱吃鱼的人被老婆拉过来，结果还吃了半条。。。味道巴适，价格也合适，这次吃的香辣的，下次再来试试蒜香的，另外玉米饼真不错，合我口味😘
鱼契·烤鱼（西南财大总店）,Weijiabei,此次用餐总体来说不错，觉得比较认可的地方有：配菜合理、服务到位、环境优美、菜品丰富。
鱼契·烤鱼（西南财大总店）,NdE687071733,「#黄金蒜香烤鱼」烤鱼越吃后面越感觉腻
鱼契·烤鱼（西南财大总店）,匿名用户,味道超好，环境也很好，不错的一次用餐！
鱼契·烤鱼（西南财大总店）,仙气腔,烤鱼吃的蒜香的很好吃蒜很多很香烤串也非常不错
鱼契·烤鱼（西南财大总店）,ZIg622873270,很满意的一次就餐体验，整体评价的话我觉得：环境、性价比、团购接待。
鱼契·烤鱼（西南财大总店）,aqv631332896,环境很巴适，点的香辣味，味道不错
鱼契·烤鱼（西南财大总店）,一个大大鸡蛋,蒜香的烤鱼有一些腻，烤五花肉好吃😋
鱼契·烤鱼（西南财大总店）,匿名用户,体验感不是很好，进店到吃完饭50分钟，菜也没上齐，不可能为了两串五花肉一直等呗，忙碌能理解，但是态度真的是个问题。
鱼契·烤鱼（西南财大总店）,ZTo449689086,很满意的一次就餐体验，整体评价的话我觉得：口味不错、服务到位、环境优美。酸梅汤好好喝
鱼契·烤鱼（西南财大总店）,番茄加糖了呀,环境很舒服，烤鱼味道很不错，推荐
鱼契·烤鱼（西南财大总店）,小林又吃肉啦,想尝试就冲冲冲！
鱼契·烤鱼（西南财大总店）,_qqtdz1378972451,此次用餐总体来说不错，觉得比较认可的地方有：口味、团购接待、性价比、环境、服务。
鱼契·烤鱼（西南财大总店）,王者者mikewang,此次用餐总体来说不错，觉得比较认可的地方有：口味、服务、环境。
鱼契·烤鱼（西南财大总店）,匿名用户,烤鱼，玉米饼，酸梅汤的味道都不错，装修也很用心，有适合聚餐的位置，也有开放性厨房，一楼服务员都很积极，尤其是手虎口有纹身的服务员，感觉最尽心，附近几桌来来回回忙碌。
鱼契·烤鱼（西南财大总店）,对方正在长头发p,双人餐68真的很划算，两个人吃得很饱，蒜香味很好吃。店的环境也挺好的。
鱼契·烤鱼（西南财大总店）,yyb512307115,这家烤鱼店的环境很好，本人很喜欢，烤鱼味道特别好吃，份量特别足，沙拉好吃，玉米饼特别好吃，服务也特别好，还会光顾。
鱼契·烤鱼（西南财大总店）,匿名用户,烤鱼味道可以，就是上菜有点慢，团购的很划算，三个人够吃，服务很一般
鱼契·烤鱼（西南财大总店）,你看那花儿都谢了,美女老板热情，味道好吃
鱼契·烤鱼（西南财大总店）,匿名用户,真的很好吃，点的经典麻辣。个人接受的了，不是很辣，但味道确实不错。玉米饼很好吃😋，赞👍！种草这家烤鱼了，以后会跟朋友常来的。就是附近不好停车，找了好久的停车位。
鱼契·烤鱼（西南财大总店）,VaN605568608,和室友一起去吃的，都吃得好满足啊，味道很不错，还有烤肉串，酸梅汤也很好喝
鱼契·烤鱼（西南财大总店）,lXU845752071,味道挺好的，环境也很好，自制酸梅汁味道也不错
鱼契·烤鱼（西南财大总店）,彩霞cx,此次用餐总体来说不错，觉得比较认可的地方有：配菜合理、口味不错、份量充足、服务到位、菜品丰富、环境优美。
鱼契·烤鱼（西南财大总店）,CGP188808467,味道不错，环境很好，服务态度也很好 。唯一不足的是烤鱼里面配菜有点少，就只有土豆和洋葱，希望下次都加点其他配菜，如豆芽，宽粉，花菜，黄瓜，这些烤鱼常用的配菜就更加好了。
鱼契·烤鱼（西南财大总店）,yanhua1990815,环境不错很安静，装修都很大气，点的麻辣味的烤鱼，很巴适，份量也很足，还有很多配菜，玉米饼也很好吃，好评，下次还会去的。
鱼契·烤鱼（西南财大总店）,苏打红茶ss,味道挺不错的，是真心觉得不错，我感觉比烤匠好吃点，烤匠吃到最后很咸，这个还好。
鱼契·烤鱼（西南财大总店）,木南丶瓜,环境好，服务态度好，前台美女漂亮，酸梅汤很正宗，鱼也好吃，玉米饼好吃，点了一个鸭脑壳，估计丢在冰箱丢久了，吃了一半，有股冰箱味
鱼契·烤鱼（西南财大总店）,诸子百家路,很满意的一次就餐体验，整体评价的话我觉得：份量充足、环境优美、配菜合理、口味好、菜品丰富、服务到位。
鱼契·烤鱼（西南财大总店）,Michelle771,味道可以，装修也很漂亮。就是卫生需要重视了。地上一看就是很腻很滑。几次差点滑倒。大体很不错。
鱼契·烤鱼（西南财大总店）,Sam丶Ss,鱼没入味。环境还行。饮品不错。
鱼契·烤鱼（西南财大总店）,羊驼驼492,环境挺好的 味道也还不错 这个套餐特别划算
鱼契·烤鱼（西南财大总店）,代姗,环境挺好，就是桌子有点儿小，点多了就放不下了
鱼契·烤鱼（西南财大总店）,耐看啦,这次就餐整体感觉很赞，比较满意的方面有：配菜合理、口味不错、份量充足、服务到位、菜品丰富、环境优美。
鱼契·烤鱼（西南财大总店）,CloverFU1107,很满意的一次就餐体验，整体评价的话我觉得：份量充足、口味不错、环境优美、菜品丰富、服务到位、配菜合理。
鱼契·烤鱼（西南财大总店）,qNQ810266003,包浆豆腐没得万州烤鱼好吃，鱼的味道不够麻。还行。酸梅汤好喝。
鱼契·烤鱼（西南财大总店）,噶话111,很满意的一次就餐体验，整体评价的话我觉得：配菜合理、份量充足、环境优美、菜品丰富、口味不错、服务到位。
鱼契·烤鱼（西南财大总店）,FqD690900494,环境很好，干净卫生，服务人员也很热情，推荐
鱼契·烤鱼（西南财大总店）,tanan408,这次就餐整体感觉很赞，比较满意的方面有：口味不错、菜品丰富、环境优美。
鱼契·烤鱼（西南财大总店）,GiraffeGongzl,环境好，位置好，服务棒，味道也很赞
鱼契·烤鱼（西南财大总店）,0王9子0刚2,比我们后来的先上菜！还吃得焖人
鱼契·烤鱼（西南财大总店）,gtW625891007,这次就餐整体感觉很赞，比较满意的方面有：配菜合理、菜品丰富、口味不错、环境优美、服务到位、份量充足。
鱼契·烤鱼（西南财大总店）,羊驼驼492,此次用餐总体来说不错，觉得比较认可的地方有：配菜合理、服务到位、菜品丰富、环境优美、份量充足、口味不错。
鱼契·烤鱼（西南财大总店）,ehz813695657,这次就餐整体感觉很赞，比较满意的方面有：配菜合理、菜品丰富、口味不错、份量充足、环境优美、服务到位。
鱼契·烤鱼（西南财大总店）,by侧耳倾听,很满意，环境不错，上错菜也很快的解决了
鱼契·烤鱼（西南财大总店）,vJl208901196,不行，配菜和味道都一般，但是服务好，最不好的是很热，空调没啥用
鱼契·烤鱼（西南财大总店）,匿名用户,环境可以  味道一般 上菜快吧 优惠力度蛮大
鱼契·烤鱼（西南财大总店）,王_之伊,环境很好，鱼也好吃，新店开业的时候抢购来的，小哥哥服务很热情。
鱼契·烤鱼（西南财大总店）,续425,鱼肉一点味儿都没有，生蚝也不新鲜，不懂为什么分这么高
鱼契·烤鱼（西南财大总店）,垂耳大兔叽,味道确实可以哦，推荐，实惠
鱼契·烤鱼（西南财大总店）,Mrn597800688,此次用餐总体来说不错，觉得比较认可的地方有：配菜合理、口味不错、份量充足、服务到位、菜品丰富、环境优美。
鱼契·烤鱼（西南财大总店）,AZH110953417,我们吃的麻辣豆豉味儿，很合我的口味，两人餐吃的很饱，而且环境服务都很好，超级满意
鱼契·烤鱼（西南财大总店）,llkv,此次用餐总体来说不错，觉得比较认可的地方有：配菜合理、口味不错、份量充足、菜品丰富、服务到位。
鱼契·烤鱼（西南财大总店）,不爱吃蘑菇的提莫,大晚上去的，两个人吃了5～6人餐，除了红糖糍粑一般般没吃完，其他都很好吃，服务态度也很好。
鱼契·烤鱼（西南财大总店）,nzD963557040,还可以
鱼契·烤鱼（西南财大总店）,kxp911490760,服务热情，店面干净整洁，空调凉快。
鱼契·烤鱼（西南财大总店）,勇往值钱lqy,这次人多，需要排队。但味道确实不错。
鱼契·烤鱼（西南财大总店）,薇薇兒儿,此次用餐总体来说不错，觉得比较认可的地方有：配菜合理、口味不错、份量充足、环境优美、菜品丰富、服务到位。
鱼契·烤鱼（西南财大总店）,匿名用户,希望店家好好培培训下二楼员工，如果那么喜欢摆龙门阵不理客人，完全可以辞职回家慢慢摆。
鱼契·烤鱼（西南财大总店）,匿名用户,不知道是蒜香味还是什么原因 鱼与配菜都没入味 又比较油
鱼契·烤鱼（西南财大总店）,uuU203659989,客观说一下，店铺打折58二人餐，味道和环境还是不错的。单子打错两次，空调不起作用，用餐途中跳闸，有点混乱
鱼契·烤鱼（西南财大总店）,MPl70894366,非常好
