店铺名称,用户名,评论
鱼契·烤鱼（西南财大总店）,上善若水879,鱼契的烤鱼是百吃不厌，除了蒜香味个人不太喜欢，（没有一点辣味，适合口味清淡的）。偏爱子姜混椒味。里面的姜丝都给吃完了。就是垫的魔芋太多了，能不能换点别的蔬菜呢？前台的小吃任意自取，酸梅汁汤里面货真价实有很多山楂，不是那种酸梅粉冲的。味道好极了。
鱼契·烤鱼（西南财大总店）,hQx831844805,「#干锅香辣鱿鱼须」「#特色烤串」「#招牌烤鱼」 和姐姐一起来过一次，也和朋友来了一次，味道不错，比很多地方都好了，喜欢装修 【环境】环境非常好，装潢很有格调，很喜欢。 【口味】口味也还不错 【服务】挺好的 【性价比】挺高的
鱼契·烤鱼（西南财大总店）,西城的老街巷,第一次来鱼契·烤鱼(西南财大总店)品尝美味！选择的是麻辣味的烤鱼。烤鱼非常入味，色泽鲜艳，口感极佳！使用团购非常方便，去的时候店内顾客不多，所以上餐速度很快，总体来说非常满意，以后有时间还会再次购买体验！
鱼契·烤鱼（西南财大总店）,jgq906908521,鱼契和其他烤鱼不太一样，感觉鱼更新鲜一些，味道选择比较多，肉嫩多汁，服务态度很好，就是有时候需要等位，鱼现烤要等些时间，「#套餐：情侣烤鱼双人餐」「#玉米饼」「#烤鱼」烤五花好吃，下回可以试试烧烤和干锅之类的。。。。
鱼契·烤鱼（西南财大总店）,桜井田橙,是朋友推荐的一家店，说是非常适合情侣的！ 有很多种味道，我们点的是泡椒，感觉很好吃，非常下饭哈哈哈哈， 玉米饼味道不错，酸梅汤也不错，五花肉也是不够吃呀！ 吃到最后的时候土豆焦焦的我觉得很好吃 综合:口味，环境，服务，我觉得性价比还是蛮高的
鱼契·烤鱼（西南财大总店）,vrR878935507,「#套餐：超值烤鱼三至四人餐」 环境很不错，菜品也挺美味的，香辣烤鱼也很可口，不是很辣，玉米饼很好吃，值得五星好评！！ 但是烤鱼上菜稍微有点慢了哟，在吃烤鱼之前就吃了很多小食，吃的有点饱了，希望可以上菜更快些
鱼契·烤鱼（西南财大总店）,奈斯46569,太绝了，只有那么好吃了，而且好划算哦，感觉特别便宜，性价比很高，店员的服务态度也很好，会帮你收东西拿东西之类的，环境也很不错，干净卫生，鱼都是现杀的，我朋友不吃鱼的都吃了好多，鱼的刺也不多，真的非常推荐！！！！
鱼契·烤鱼（西南财大总店）,匿名用户,已经来吃第二次了，这家烤鱼的味道算是大学城比较好的，分量也很足，在网上定套餐算是很便宜的，还可以在店里加自己喜欢的菜品，肉沫茄子的味道非常赞。环境很好，而且麻辣口味很不错，性价比也很高，还有一些小零食可以免费吃。
鱼契·烤鱼（西南财大总店）,Vot926600426,「#套餐：情侣烤鱼双人餐」「#烤鱼」 【口味】不好吃，烤鱼一点味道都没有，里面的素菜又很咸，真的难吃，三个人只吃了一点，菜很少，鱼肉也少，再不回来了 【口味 【环境】环境好是唯一的优点 【服务】一般，跟谁欠他钱一样臭着一张脸不耐烦 【性价比】低，吃点啥不好
鱼契·烤鱼（西南财大总店）,匿名用户,"上次点了份双人套餐，额外点了两份玉米饼，没上，我们也没说什么，就几块钱。
这次又弄错了，多上了份鸡中翅，然后扭扭捏捏徘徊半天又给撤掉了。
倒也不在于两块鸡中翅，但是我们吃着吃着突然旁边撤掉，不考虑一下客人的心情吗？
难道格局就这么小，只能少上不能多上，不能送了算了？谁在乎这几块钱，但你已经开吃了还当面拿走，真是无语死了。
"
鱼契·烤鱼（西南财大总店）,,
鱼契·烤鱼（西南财大总店）,一只香芋派,挺好吃的！第一次吃这种蒜蓉味的烤鱼，感觉老少皆宜咸淡合适，玉米饼很赞
鱼契·烤鱼（西南财大总店）,clwcx,生意好排队排了很久理解！点完餐等了接近一个小时……很多人都在催菜，等得真的不耐烦，点的菜吃完了还没上齐！说好了把没上的菜钱原路退换到微信，也没退 就很无语哦！上菜慢就不要接那么多人 ……饭店大家都在哪里饿着等菜 ！味道还是不错的  吃了好几次
鱼契·烤鱼（西南财大总店）,梦遗少年丨,"有一说一，环境还可以，上菜具慢，等了将近一小时，自己看我下单时间和上菜时间，将近一个小时,怕是现钓的鱼吧。"
鱼契·烤鱼（西南财大总店）,匿名用户,在他们家吃过很多次了，确实好吃！
鱼契·烤鱼（西南财大总店）,匿名用户,很满意的一次就餐体验，整体评价的话我觉得：性价比。性价比极高 味道非常不错，是和好朋友一起聚餐的好地方，非常可以去尝试，新客户还可以有优惠，在美团上面会更便宜一些，鱼的大小可能会有些差异，尽量点大一点，小了可能会不够哈哈哈。
鱼契·烤鱼（西南财大总店）,EDh879400619,才开没多久，卫生很好，很干净。环境也是很不错的哦，推荐大家来这里，吃的是麻辣的，下次可以试一下蒜蓉的看这也很不错，玉米饼一般般，酥肉还是可以的
鱼契·烤鱼（西南财大总店）,Qpw590983994,好好好好好好好好好好好好好好好好好好好好好好好好好好陪陪他每次辅导孩子家庭作业爸爸辅导孩子作业总是很多的谎我们女儿常常会辅导小孩很多噢辅导都是这样做起来我们都已经看到了吗……这里也很重要了……不想做自己想做什么工作了……在乎过的人
鱼契·烤鱼（西南财大总店）,飞翔的小马猪,还不错反正我们两个人吃味道还可以
鱼契·烤鱼（西南财大总店）,Otsan_,干锅和掌中宝真的还不错好吃，其他就都一般般，那个地是真有点滑差点摔倒，干锅分量还不错，鱼就有点少
鱼契·烤鱼（西南财大总店）,YfM526371920,味道相当好，烤鱼鲜嫩入味，酸梅汤真材实料！
鱼契·烤鱼（西南财大总店）,Luo5353,三个人吃吃撑了 味道不错 烤鱼很入味 干锅排骨超好吃 最爱酸梅汤 酸梅汤真的必点 太好喝了 我们喝的就剩渣了哈哈哈
鱼契·烤鱼（西南财大总店）,kwd120350647,我们一共5个人，在美团买了有一个套餐，有一份干锅鱿鱼和烤鱼，还有两份小吃，一个烤掌中宝和蔬菜沙拉，东西味道都很不错，大家吃的很满意，都吃的很撑，哈哈哈，餐厅环境也是一级棒，人很多，可能是因为人太多了所以服务员服务不过来，不过还是挺好的啦。
鱼契·烤鱼（西南财大总店）,破者号,很好吃，环境也很好，好干净，胃口大开
鱼契·烤鱼（西南财大总店）,小慧慧985,来吃过两次了，很喜欢这家的烤鱼，环境也很好，吃得不辣的人推荐蒜香味，能吃辣点的可以吃香辣，香辣的味道也很不错，他这里的豆浆我很喜欢，很浓稠，应该是鲜榨的，还有小零食可以免费吃，可以几个人一起来吃，，，
鱼契·烤鱼（西南财大总店）,温暖131,第一次来这里。。环境很好看着也很有感觉，排队还算快的，价格实惠！！味道还是巴适的很！团购来的服务员态度一样很好，下次还可以约朋友来吃！对了，烤肉烧烤也特别不错，喜欢的朋友可以试试呢！！爱了爱了！拍了一些照片供大家参考
鱼契·烤鱼（西南财大总店）,风潇雨茴,非常的优惠，味道也很好，环境很好
鱼契·烤鱼（西南财大总店）,惦念ling,还可以吧
鱼契·烤鱼（西南财大总店）,xueli422160669,位置在大学城西南财大对门，挺好找的，味道和环境都很不错，最喜欢麻辣味的烤黔鱼，酥肉，烤五花肉，玉米棒，距离几个地铁站，还是经常来，约朋友、约邻居一起去都挺好的，价格也比较适中，吃完了还可以约着逛一下大学城，各种小饰品、奶茶饮品，还有小吃和其他很多东西。
鱼契·烤鱼（西南财大总店）,Abq842633618,这次就餐整体感觉很赞，比较满意的方面有：环境。
鱼契·烤鱼（西南财大总店）,CAwhite,好吃  现烤的很新鲜
鱼契·烤鱼（西南财大总店）,sZd582696313,上菜非常非常慢！！！！！！！！
鱼契·烤鱼（西南财大总店）,SwR495045366,每一样菜品都超级好吃，真的绝绝子
鱼契·烤鱼（西南财大总店）,BZq468334285,环境还行，味道一般，个人口味有点咸
鱼契·烤鱼（西南财大总店）,Z大机智,来了好多好多次了，哈哈哈哈因为真的好吃
鱼契·烤鱼（西南财大总店）,随缘zs123456789,各方面都很不错，「#套餐：四人餐」有机会再去
鱼契·烤鱼（西南财大总店）,dBS252317734,还挺好，在大湾这边算是味道还不错的烤鱼了，肉串挺不错，豆乳汁也听好喝，就是可以凉的太快了，后来单点的中翅一般般，服务也还行，就是鱼上的有点慢
鱼契·烤鱼（西南财大总店）,神木清瞳,还挺不错的，就是上菜比较慢，味道还是可以的，不错不错。
鱼契·烤鱼（西南财大总店）,hlY237964476,还行吧，就是感觉份量不大，但是味道还是可以的
鱼契·烤鱼（西南财大总店）,我在等吃e,「#套餐：情侣烤鱼双人餐」很久才来评价的，在财大旁边，之前和朋友来吃蒜香的，才开吃就感觉很不错，所以这是第二次来吃。那个玉米饼烤的非常棒，趁热吃最好吃。还有烤串也是非常好吃。烤鱼味道很多，我更喜欢麻辣的。环境是很不错。之前不冷的时候就是酸梅，冬天就给的是热豆浆。就很奈斯。
鱼契·烤鱼（西南财大总店）,dcJ282379946,很好，主要是男朋友强推的，哈哈哈哈
鱼契·烤鱼（西南财大总店）,Jkm627389422,「#套餐：实惠烤鱼五至六人餐」「#玉米饼」「#烤掌中宝」「#沙拉时蔬」「#自助小吃」 【环境】环境很好，适合聚餐约会「#玉米饼」玉米饼很好吃😋😋老少皆宜
鱼契·烤鱼（西南财大总店）,wfX277151326,一般，上菜慢，服务一般，味道不怎么样，主要价钱感觉不值这个啊！但是可能比较卫生健康吧
鱼契·烤鱼（西南财大总店）,zGd342311474,【口味】这次菜品说实话我是失望的，之前吃的蒜香味道上桌感觉鱼也是热的腥味没有那么大，这次换了口味晚上去的比较迟感觉上桌鱼冷的腥味比较重。这次完全没有吃多少 【环境】可能比较迟看见隔壁在收拾碗，就感觉自己吃的碗也是这样擦出来的，卫生方面我还真的有点担心。
鱼契·烤鱼（西南财大总店）,pxY378712118,环境很不错，适合情侣约会，朋友聚餐什么的，味道也很不错，还有自助炒饭，小零食之类的，酸梅汁好喝，还能看见里面的大颗梅子，卫生间在二楼比较不方便，可能人比较多，上菜是稍微慢一点的，不过买的套餐里面有小吃，会比较快上小吃，感觉没等到正菜上来都吃差不多
鱼契·烤鱼（西南财大总店）,张张要少吃外卖,招牌蒜香吃着腥味很大，煮多久都一样，难以下咽，非常不愉快的体验，从没吃过这么难吃的鱼。
鱼契·烤鱼（西南财大总店）,Ahx360812610,很满意的一次就餐体验，整体评价的话我觉得：环境优雅、口味赞、性价比高。
鱼契·烤鱼（西南财大总店）,Love伊南,环境还不错，味道也挺好的。以后还会继续光临本店
鱼契·烤鱼（西南财大总店）,gLW411757101,我只想说上菜速度真的差到爆炸，不知道是不是差别对待，我美团上订的餐，到一个小时了还没上，但是到店点餐的很快就上了🙃，无语，如果美团上订餐愿意等就来吧，反正等到你饿的不行，重要的事情说三遍！上菜特别慢！上菜特别慢！上菜特别慢！🙃🙃🙃🙃🙃🙃🙃
鱼契·烤鱼（西南财大总店）,ILo876984650,我已经不是第一次去了，之前去吃的鱼还可以，但是重要的是→我单点了一个干锅排骨虾，服务员说可以拼两个，我以为就点一个拼的就可以了，结果最后上菜后我就知道我失策了，只有点的那个拼菜，吃了几口也没往下翻，就把表面上的排骨吃了，也没几块，我还以为肉在里面，等我翻了翻，可给我气笑了！！！下图就是我们把表面上的能看到的肉吃了后的样子😡多么清晰可见的几坨肉，吃了就没了！这就是干锅掌中宝，可真敢做出来。上菜时还说下次再来点排骨虾，没下次了，除非我家没土豆，想让土豆给我撑饱🙂
鱼契·烤鱼（西南财大总店）,匿名用户,烤鱼一般般，干锅和烤串的味道倒是很不错，如果是单独去吃烤鱼的话不怎么推荐，去吃干锅和烤串倒是很可以的
鱼契·烤鱼（西南财大总店）,Z大机智,吃了第一次就不停想吃第二次，第三次第四次，已经来了很多次了，还安利了同学们过来，真的好吃
鱼契·烤鱼（西南财大总店）,whx妈妈,烤鱼味道不错，位置，环境都还好，就是配菜少了点，而且后面加的配菜没味道
鱼契·烤鱼（西南财大总店）,OSM144188955,很满意的一次就餐体验，整体评价的话我觉得：口味、服务、团购接待、性价比、环境。从市中心跑来吃这家，性价比很高，好吃不贵，尤其是它家的蒜香味道非常好哈哈哈哈，好吃的上头了，大学城这边好吃的太多了，大家快来吃呀，冲冲冲
鱼契·烤鱼（西南财大总店）,匿名用户,味道比较好客服也很好很不错喔！
鱼契·烤鱼（西南财大总店）,一身仙女味吖I,味道挺不错的，就是上的有点点慢
鱼契·烤鱼（西南财大总店）,影子小飞鱼,好吃不贵
鱼契·烤鱼（西南财大总店）,Qfo380867787,鱼的口感非常不错，量也特别充足！点了一个套餐里面有沙拉、酥肉、其他的小吃，这些吃味道也特别不错，量同样也很多！我们是三个人一起去吃的，都能吃饱，觉得下次还会来吃的，而且里面的服务也特别周到，特别贴心。
鱼契·烤鱼（西南财大总店）,罗源源啊,味道还是很不错，但是感觉烤鱼分量有点少，不够吃，服务态度还是很不错，环境也很好，总体还是可以的
鱼契·烤鱼（西南财大总店）,hzB643411262,「#套餐：超值烤鱼三至四人餐」「#玉米饼」「#烤掌中宝」「#特色烤鱼」我们自己还加了个酥肉，味道不错性价比也高，环境干净整洁，适合家庭或朋友聚餐！
鱼契·烤鱼（西南财大总店）,秋水6436,3人团的3.4人餐，基本吃不饱，味道比刚开业的时候差远了，鱼基本不入味，下次就不去了。只有泡菜还比较可以。
鱼契·烤鱼（西南财大总店）,匿名用户,冷的  盘子还有一股怪味，鱼也烤糊了  苦涩 ，总之是一次不好的用餐体验
鱼契·烤鱼（西南财大总店）,LNa794977415,味道很好，份量也很足，不用排队
鱼契·烤鱼（西南财大总店）,LiLiMp,蛮好吃的，分量足，环境不错，「#套餐：情侣烤鱼双人餐」
鱼契·烤鱼（西南财大总店）,深呼吸outside,环境比较好，口味不行，菜一点也不入味
鱼契·烤鱼（西南财大总店）,SK上邪,鱼比较小哦，但是环境比周边餐厅好点
鱼契·烤鱼（西南财大总店）,Kxc699832828,「#套餐：超值烤鱼三至四人餐」味道可以 虽然有点上菜慢但是人很多这个可以理解 主要是味道很好所以等等也是可以滴
鱼契·烤鱼（西南财大总店）,jll828795527,开学了，送女儿上学来吃的，味道蛮好的。
鱼契·烤鱼（西南财大总店）,剪墨816,味道中规中矩，没有惊艳。上鱼比较慢，可能鱼是现杀的？小吃上的还挺快，环境也还不错，小吃看别人晒的有水果呀，我们去没了。 偏个题，对了，下次不要同时放罗聪和许嵩的歌好嘛？毕竟这个人自称许嵩没他火，怎么能一起放呢？好多翻唱的歌曲，是因为你不是尊贵的vip吗
鱼契·烤鱼（西南财大总店）,称心c,不是托不是托好吃好吃真的好吃 我们三个人吃的5-6人餐还多了很多打包了的 玉米馍馍很推荐 家里老年人喜欢吃这种的可以打包一份 里面有水果玉米的玉米粒 性价比也真的很高 就是吃到后面有点咸「#玉米饼」 一直在喝水
鱼契·烤鱼（西南财大总店）,Jag905429869,优点：环境好，服务好，性价比高； 待提高：鱼和配菜不够入味，油汤太多； 终结：烤鱼要做好味道，老板仍需努力，建议去重庆万州的烤鱼博览馆学习下。
鱼契·烤鱼（西南财大总店）,匿名用户,很满意的一次就餐体验，整体评价的话我觉得「#黄金蒜香烤鱼」很好吃香「#特色烤鱼」暑假来吃过了「#自制酸梅汤」很好喝！正点 【口味】很棒，可以和万州烤鱼媲美 【环境】很舒适 【服务】热情 【性价比】高
鱼契·烤鱼（西南财大总店）,匿名用户,蒜蓉的很一般，不辣的盖不住鱼腥味。人很多以至于我要勺子一直都没有，快吃完了都没给我拿，还是自己去后厨要的。一开始套餐里的烤五花肉好吃，就加了四串五花肉十串把把烧，结果难吃的要死！一个像辣椒面打翻了，一个像胡椒面打翻了，师傅发挥不好就别卖烧烤！胜在环境好吧，对了酸梅汤没有了，也没跟我们商量直接换成了黑糖豆浆（黑糖豆浆很难喝，至少我看到附近桌的人都没怎么喝）
鱼契·烤鱼（西南财大总店）,sFX79977127,元旦一家人聚餐，就近找了一家，味道还可以，份量略小。点那个蒜香烤鱼，还有一个干锅鱿鱼丝，烤茄子，蔬菜沙拉，红糖糍粑，玉米饼儿，后面还加了烤五花肉和把把烧牛肉串儿。整体还可以呀，还可以吃哦，小朋友们也能吃一点儿。
鱼契·烤鱼（西南财大总店）,QPC456917191,十分好吃
鱼契·烤鱼（西南财大总店）,KKs306447786,味道巴士，烤鱼经典「#套餐：四人餐」
鱼契·烤鱼（西南财大总店）,ywP579064754,服务差，进店半天也没人来点餐。
鱼契·烤鱼（西南财大总店）,uoK310427493,性价比高，去了几次了，唯一遗憾的是干锅鱿鱼不能换，看评论同样套餐有网友换过，不知为啥不给我换。
鱼契·烤鱼（西南财大总店）,霞啊_,棒棒棒棒棒死了 环境味道都很好 回头客
鱼契·烤鱼（西南财大总店）,Mjx867979097,分量没得说，性价比超级高，店内环境赞
鱼契·烤鱼（西南财大总店）,LmM457876054,团购的挺便宜，环境可以，因为是元旦所以排了半小时队。 但是上菜等太久了，等那么久上来的鱼和配菜全冷的？从年尾冷到年头？味道本来就一般不会改全程冷吃，我是无法接受，等半个小时等一盘全冷烤鱼。加的配菜也等了很久，半生就倒进来…烤鱼都加不热指望把配菜煮熟？
鱼契·烤鱼（西南财大总店）,兵问我,这次就餐整体感觉很赞，比较满意的方面有：口味、团购接待、性价比、环境、服务。好吃
鱼契·烤鱼（西南财大总店）,厚颜无耻之徒、,就在家楼下，刚开业的时候就去过了，环境很不错 价格也很合理，前台小姐姐多热情。当时好像是点的经典麻辣味，(图一)感觉就是很平平无奇。但是！我们上周末又去，点了个好像是泡椒双拼？(图二)这味道绝了绝了！贼好吃哈哈哈！是我吃过最好吃的烤鱼！没有之一！下次去再试试其他味道～ps:建议老板儿可以多加点素菜这些，感觉素菜也超级好吃😋！
鱼契·烤鱼（西南财大总店）,菠萝菠萝蜜菠,「#套餐：情侣烤鱼双人餐」 【环境】西财东门对面，很显眼。店里明亮整洁，厕所和开放式厨房都在二楼。二楼烟火气息重，更适合多人聚餐吧。 【服务】端鱼上来的阿姨臭脸，碎碎念前台小妹怎么没有给我们拿订单小票怎样怎样，把锅斜着放上就去前台哇啦哇啦。上菜的时候最好就不要说话了，又没戴口罩。反正很没有礼貌。另一个年长的阿姨态度还是很热情的。 【口味】麻辣感觉没什么味道，一般般。肉串味道不错。自助酸黄瓜可以。
鱼契·烤鱼（西南财大总店）,fJx973125369,环境和味道都很不错，分量也很足。我们4个人吃没有吃完还打包！
鱼契·烤鱼（西南财大总店）,nlz733956626,「#套餐：情侣烤鱼双人餐」环境不错，味道也还行。
鱼契·烤鱼（西南财大总店）,LIAOQIAN—,味道还可以，就是等鱼的时间有点久，其他都吃完了，鱼等了很久，环境很好，刚好周四有活动，性价比很高，总体来说还是很赞，👍👍👍👍👍👍👍👍👍👍👍👍👍👍👍👍👍👍👍👍👍👍👍👍
鱼契·烤鱼（西南财大总店）,LYc626301772,一如既往，但是第二份喊的脑花有点散，没有第一份的新鲜，烤茄子油有点多了
鱼契·烤鱼（西南财大总店）,匿名用户,抢的秒杀券，烤鱼掌中宝和玉米饼挺好吃，朋友吃不惯沙拉都被我吃了，我觉得还行，酸梅汁因为天气原因被换成了山药红枣汁，不太喝的惯，还是想喝酸梅汁🌚 希望店家能在换饮料之前先问问换不换吧，毕竟看到服务员都端上来了也不好意思说不想换……而且喝的时候也差不多凉了，也不算热饮。 烤鱼很好吃，可惜配菜少了点，味道还不错。掌中宝也很好吃，非常香，上菜也很快，玉米饼甜甜的，我外卖应该还会点👍 。 另外就是隔壁桌有人吸烟有点影响心情。总体来说还是满意的。
鱼契·烤鱼（西南财大总店）,xgQ152520396,味道很好，环境也不错，服务也还可以，室友们也吃的很好，哈哈哈哈哈哈哈哈哈哈哈哈哈哈哈哈哈哈哈哈哈哈哈哈哈哈哈哈好哈哈哈哈哈哈哈哈哈哈哈哈好哈哈哈哈哈给别个hi吃啊傻了哈哈哈哈哈回来后拉锯他啊酷兔兔啦啦啦
鱼契·烤鱼（西南财大总店）,fxa950294209,去吃了两次，第一次吃的子姜味，这次吃的蒜香味，相比之下蒜香味真的不推荐，蒜蓉很少，面包糠倒是一大堆，这玩意儿太吸油了，吃得人好腻啊OTZ，玉米饼一如既往的好吃，烤串也不错，但是单买烤串不划算，搭配在套餐里面不错
鱼契·烤鱼（西南财大总店）,李准基爱你lzj,"【环境】用餐环境不错  装修比较喜欢 但考鱼味道一般 相比于其他烤鱼 鱼契配菜较少  价格想对其他贵一点点       上菜速度也挺慢         但服务态度挺好的  
【口味】点了套餐还送了玉米饼   玉米饼还不错 
总体来说  性价比不高     相对来说还是喜欢万州烤鱼"
鱼契·烤鱼（西南财大总店）,A1588357,鱼是冷的，洋葱是冷的，土豆也是冷的，就鱼是热的
鱼契·烤鱼（西南财大总店）,oKr866403818,比较之下，麻辣味烤鱼比蒜蓉味烤鱼好吃
鱼契·烤鱼（西南财大总店）,GEU911919135,反正两个人吃不饱，味道个人口味很咸
鱼契·烤鱼（西南财大总店）,西西嘎的帅哥,这家菜品的话，和平常的一样吧！还好，没有很差也没有很惊艳的感觉！装修很不错，环境很好！适合请别人吃饭！点的烤鱼，配菜很一般就土豆，藕，魔芋之类。自助的饭和小水果还是不错的。。。。。。。。。。。总的来说味道一般，价格一般，环境很好，
鱼契·烤鱼（西南财大总店）,xMo759548179,价格实惠，八个人吃，还点了其他的，红糖糍粑还有包浆豆腐都炒鸡好吃。服务态度也很好啦！烤五花肉！！推荐！！
鱼契·烤鱼（西南财大总店）,小予呀呀呀,不错不错 第二次来这里吃了 感觉小吃什么的都不错但烤鱼的口感还需要再提升一下 柠檬水不错 但是豆浆不怎么样 白米饭和炒饭都很喜欢 还有凉菜什么的可以自己拿 环境是很不错的 服务的话无功无过 鱿鱼须由于太少了一点但是锅里的土豆很好吃
鱼契·烤鱼（西南财大总店）,tomri328,味道一般，感觉鱼没怎么入味，环境还不错
鱼契·烤鱼（西南财大总店）,cye00,"三四人餐才划算呢，秒杀比双人餐还划算。
我买的双人餐，主要是怕吃不完
双人餐分量很足，也没吃完😅打包盒另付两块~

最近不吃辣选的蒜香，超棒👍🏻

【环境】生意很好，一会就坐满了~人多吃饭都香些~

【服务】非常热情~据说还可以充值~经常吃还是可以充点~"
鱼契·烤鱼（西南财大总店）,糖淇子,我非常失望，卖相看起来还行，但是味道实在难以恭维，过于油腻而且除了油腻之外没有任何味道。上菜速度慢到极致了，不知道等了多久，仿佛一个世纪，而且服务根本没有，找不到人，关键价格还高！这是第一次也是最后一次来这家。
