店铺名称,用户名,评论
鱼契·烤鱼（西南财大总店）,与厌厌,「#套餐：实惠烤鱼五至六人餐」 「#特色烤鱼」点的酸辣，挺好吃就是鱼太小了，四个人一下子就吃完了，里面土豆很少 「#干锅香辣鱿鱼须」换成了干锅掌中宝，还可以，就是藕太多了 「#沙拉时蔬」芝麻酱太咸了，还行 「#烤掌中宝」好吃 「#玉米饼」油了点，倒还行 「#红糖糍粑」不脆，太黏了太厚了不推荐 【服务】服务态度很好，但是服务人员有点混乱，说收拾桌子加菜都很慢，感觉分工不明确 【性价比】套餐还是便宜的，就是服务和一些菜品还是改进一下吧
鱼契·烤鱼（西南财大总店）,匿名用户,等了差不多40分钟  真的等来很无语  而且鱼的味道也不是很好  一条鱼88
鱼契·烤鱼（西南财大总店）,牛变成了哑巴,很好「#套餐：超值烤鱼三至四人餐」经常吃，最爱蒜香味的烤鱼。这个玉米粒也很好吃，锅巴也不错，烤的掌中宝也挺好吃的。柠檬水也很好喝。烤鱼的配菜有点少，加的菜味道不是很够。这个字数也太难凑了，凑够了又能怎样呢？
鱼契·烤鱼（西南财大总店）,mLU341760208,好吃
鱼契·烤鱼（西南财大总店）,阿飞nbsl,很不错，88情侣套餐，不贵十分优惠，味道也比较好，我和我女朋友都很喜欢，都来这家店很多次了，然后粉丝群做活动，任意消费就送盆栽，然后我忘拿了，很遗憾，😓😓😓🙏🏻🙏🏻🙏🏻🙏🏻🙏🏻🙏🏻
鱼契·烤鱼（西南财大总店）,匿名用户,很满意的一次就餐体验，整体评价的话我觉得：环境、团购接待、性价比、口味、服务。
鱼契·烤鱼（西南财大总店）,芒果酸奶jiang,店面环境不错，特别适合情侣约会，就是坐了小一会儿了没人来招呼，点的麻辣烤鱼，没啥特别的，感觉除了烤匠味道合我口味点其他都大差不差，玉米饼、小酥肉不错，也叫过几次外卖，不错，价格还是很实惠的，学生党的话很推荐
鱼契·烤鱼（西南财大总店）,思g啊,感觉鱼没入味 菜品是新鲜的 也好吃 就是没味道😭 但是玉米馍馍超级好吃😋
鱼契·烤鱼（西南财大总店）,dXb637833615,味道还行，不知道是不是我点的蒜香的原因，味道有点淡。主要是性价比挺高的，还有服务也挺不错的，之前看到评价说服务不好，还有点小担心，上菜也挺快的，大概半个小时左右就全部上齐了。总体来说还是可以，值得五分好评，就是6点左右来的，小吃居然没什么了
鱼契·烤鱼（西南财大总店）,本宝奔跑,意外的惊喜！两个人，团了个100元的套餐，主菜选的泡椒味烤鱼，味道太霸气了，外酥里嫩，鱼肉新鲜柔软味道满分！ 好好吃，玉米饼子也得满分 就是沙拉的菜有一些单调 不过卫生也是满分！ 装修风格是年轻人喜欢的极简风格也爱了
鱼契·烤鱼（西南财大总店）,WJ流馨,在学校附近，性价比挺高的，我们团的都没吃完，味道也不错，「#套餐：实惠烤鱼五至六人餐」「#烤掌中宝」蒜香味的感觉有点淡，上次点的麻辣味还不错，不过团购还是比较划算……………………，有时间还可以去吃 【环境】不错 【性价比】挺高的
鱼契·烤鱼（西南财大总店）,cyC368448024,这次就餐整体感觉很赞，比较满意的方面有：口味。
鱼契·烤鱼（西南财大总店）,XLF259782970,从外表上来看麻辣十足，色香味俱全 实际上是麻辣味色香味一味都不占 除了大头菜的咸味 没有任何麻辣味
鱼契·烤鱼（西南财大总店）,sMV554487747,服务态度很好，又好吃，真的真的太好吃了。
鱼契·烤鱼（西南财大总店）,X小X虾M米,非常不错！
鱼契·烤鱼（西南财大总店）,Nal189159436,此次用餐总体来说不错，觉得比较认可的地方有：性价比。玉米饼很好吃，量非常的足，服务态度也非常棒，
鱼契·烤鱼（西南财大总店）,iOg944389325,环境不错，两个人吃的话分量也比较足，两个女生吃完全够了。味道也不错👍🏻
鱼契·烤鱼（西南财大总店）,白桃乌龙啵啵啵,没有蔬菜沙拉给我们换成了酥肉 玉米饼有点腻 酥肉好香好香 豆鼓鱼安逸惨了「#套餐：超值烤鱼三至四人餐」「#烤掌中宝」「#香辣豆豉烤鱼」「#现炸酥肉」「#玉米饼」 【环境】环境条件优越 体验感比较好 【服务】有点慢 可能是现杀现烤的原因
鱼契·烤鱼（西南财大总店）,mcw901894756,服务很好，送的很到位，最重要的是平安夜还送了小礼物。是一家很不错的烤鱼店
鱼契·烤鱼（西南财大总店）,匿名用户,烤鱼味道不错，服务也很到位，性价比也挺高的。
鱼契·烤鱼（西南财大总店）,nFC332196412,财大旁边最好吃的一家店了，吃他就对了。
鱼契·烤鱼（西南财大总店）,Fearless240,店面环境挺好的，味道一般也不差。 烤五花不错
鱼契·烤鱼（西南财大总店）,夏沫浅夏,环境可以，烤鱼也不错。
鱼契·烤鱼（西南财大总店）,D辉仔,环境简洁大方，相对学生，价格略高，划算很多。 主打是烤鱼，那天天气有点冷，点的麻辣味鱼。鱼很嫩气，也够大，但不咋入味，虽然等了T很久。但是，必须强烈推荐家的烧烤，哈哈！还有很正宗的杨梅饮料和沙拉！免费小吃，真心服务周到！难怪什么这么好！完全是惊喜啊。
鱼契·烤鱼（西南财大总店）,匿名用户,一下子就注意到了这一家店，装修看起来很不错，味道也是真的很好，上菜的速度相对还挺快，小姐姐也很热情，特别喜欢。性价比也挺高，可能因为是三个男生，显得鱼有点小，女生肯定绰绰有余，小吃很不错，下次可以尝试一下店里的其他菜品
鱼契·烤鱼（西南财大总店）,薄荷草931,他家的位置还比较好找，有两层楼，不过由于带娃每次都在一楼，下次去二楼看看。他家上菜的速度还可以 ，他家的玉米饼推荐尝试味道不错哦！烤鱼的味道不错，还有酸梅汁好喝 这里提一个小小的建议 ，你家的蛋炒饭去晚了就没了，多整点
鱼契·烤鱼（西南财大总店）,男主家伟,环境简单优雅 很喜欢在这种环境下享受美食 特别说一下 他们家的腌黄瓜超级好吃 黄瓜是那种小时候家里自己种的那种 味道让人很满意 服务也很好 我点的是泡椒味的烤鱼 看着就非常有食欲 我只能超级满意这次的用餐 配的小吃玉米饼真的是外酥里嫩，以后会常来的
鱼契·烤鱼（西南财大总店）,fkb311408321,当时新开店去吃的，相当划算，后来朋友带家人去吃了，味道也说可以。喜欢她家自制的酸梅汤。我一个人就可以喝一扎。关键这家店装修也还行，不是那种看起来脏脏的烤鱼店。带亲朋好友去吃是没有问题的，人均消费也不高
鱼契·烤鱼（西南财大总店）,tEa495641307,点的是蒜蓉味 其它味道应该不错 但是作为一个川妹子来讲 这个蒜蓉淡得有点怀疑人生
鱼契·烤鱼（西南财大总店）,fkb311408321,这回抢的四人餐的劵，还是只有一条鱼，我又另外加了一条鱼，才够我们吃。还是觉得辣味的好吃些，蒜香味的个人觉得太淡了，小朋友都不太喜欢的样子。但是四人套餐的饮品不好喝，还是喜欢酸梅汁。中午去吃的时候没有水果啦，唉。
鱼契·烤鱼（西南财大总店）,elZ340639378,来了三次了，秒杀价特别划算，如果只是团购价一般般。份量不是很大，四人餐两人吃剩下不多
鱼契·烤鱼（西南财大总店）,ge闲情雅致,这家首先位置不错，在一个丁字路口口子上，今天天气是非常热，我们运气很好，前脚走进门后脚下起瓢泼大雨[憨笑]，我们点的是一个香辣可有味钱鱼，色泽红亮，皮酥肉嫩细滑，第一眼看着就很有食欲，上面还撒了一点点黄豆，入口酥脆，看着辣椒挺多可，入口没想象中的那么辣，刚好，但因每个人的口味不同吧[微笑]，搭配的还有，烤串儿，应该是脆骨吧，比专业的烧烤店烤的味道还好[强]。特别是那个玉米粑粑，吃着挺鲜嫩的，用油煎的，一点都不腻，配套的还有那个酸梅汤，酸梅汤特别酸，喝起来挺开胃的，而且是冰镇的！ 值得非常满意的就是他的服务，服务员着装青新色的整齐，是随叫随到[强]，消费嘛，体验的就是这种感觉[强][强]。 这家店应该是刚重新装修过的，里面的内部摆设与设施都比较新，卫生也搞得非常干净，他家的厨房在2楼，里面有很多卡座，非常舒适。
鱼契·烤鱼（西南财大总店）,UDQ570936122,味道一般，鱼肉不入味。并且鱼感觉不新鲜。肉质一夹就散。不推荐去吃。
鱼契·烤鱼（西南财大总店）,nKF152908321,好吃嘻嘻，第二次来吃了，特别喜欢掌中宝，推荐哈哈哈哈。他家厨房是透明的，吃的很放心。沙拉也不错哦，完美！
鱼契·烤鱼（西南财大总店）,无语子的纠结,不错「#套餐：超值烤鱼三至四人餐」
鱼契·烤鱼（西南财大总店）,EUo861217845,味道很好，量也很足，用餐环境还可以，服务态度一流，不知道怎么说了，我就随便加字了，总之值得一去，我也不晓得怎么说了，推荐给大家这家店，确实还比较实惠，然后量也不错，我也不知道怎么说了，我就随便加字了。
鱼契·烤鱼（西南财大总店）,hrr349490274,环境很好，服务很周到，烤鱼味道不错，量大。值得去吃！
鱼契·烤鱼（西南财大总店）,胡战歌,第一次来生意很好，服务态度好，老板很热情，味道好。￼我推荐推荐推荐推荐推荐推荐推荐推荐推荐推荐推荐推荐推荐推荐推荐推荐推荐非常好非常好非常好非常好非常好非常好非常好非常好非常好非常好非常好非常好非常好非常好非常好，非常好非常好。￼
鱼契·烤鱼（西南财大总店）,zKJ706195254,小吃好吃，点的蒜香味的，鱼没有盐，而且也没有蒜香味
鱼契·烤鱼（西南财大总店）,qVK521099058,味道很棒 十分实惠 蛋炒饭很好吃。
鱼契·烤鱼（西南财大总店）,爱笑的笑猫,还可以好吃不过不是酸梅汁是豆浆不过还是好喝
鱼契·烤鱼（西南财大总店）,ykN826630119,烤鱼的味道真的一般，环境不错，配菜也行。
鱼契·烤鱼（西南财大总店）,wsD488495852,昧道真的不错．环境也很好．
鱼契·烤鱼（西南财大总店）,匿名用户,第一，一开始给人的感觉不错，环境不错，验劵的小姐姐态度不错 第二，后面就开始出现问题了，一个服务员上错了菜，我们点的酥肉给我们上成沙拉，然后我们说我们还是要酥肉，服务员的意思是让我们再点一份酥肉，然后沙拉也让我们买单，然后我提出了疑问毕竟不是我们的问题造成的不错误肯定不能让我们买单涩，然后服务员离开了有五分钟然后把酥肉上上桌然后把沙拉端起来然后又很重的放下来说一句这个就送给你们吃嘛，一种跟我们要到吃碰瓷吃一样，这就很让人不舒服了，然后我们还是让把那盘沙拉下桌了，一筷子都没动，因为我们也不是那种占小便宜的人，我们点了啥我们就该为我们点的菜买单，不是我们的菜我们就不去占欺头，问题关键点就是员工自己做错了对我们没有一句不好意思，态度还很傲起傲起的 让人不舒服哈 希望老板能多多教教员工怎么处理这些临时问题吧
鱼契·烤鱼（西南财大总店）,z澄澈,鱼的味道没得说，环境也很棒，上菜也挺快，总之很推荐～
鱼契·烤鱼（西南财大总店）,XgI451287069,味道一般没有什么出彩的地方，鱼不大
鱼契·烤鱼（西南财大总店）,rmQ916106110,很不错噢！还有一些自助的小食，两个人团了个券都没吃完欸！
鱼契·烤鱼（西南财大总店）,inneedyou,比较划算，菜品有点太少了，看着都有点辣，不太适合口味清淡的人，环境挺好的，服务态度也挺好，后面都是为了积分，，，，，，、，，，，，，，，，，，、，，，，，，，，，，，，，，、，，，，，，，，，，、，，，，
鱼契·烤鱼（西南财大总店）,匿名用户,菜品味超级好，用餐环境也还不错，服务员小姐姐的态度真的超好。他的特色烤鱼真的绝了，我和朋友下次一定还去*^_^*最最重要的是他家的菜真的挺适合贫民窟的学生党，价格真的超级合理，好吃不贵，下次还来\^O^/
鱼契·烤鱼（西南财大总店）,jLt453370837,给个5分不是问题，环境超好，价格很便宜。 主要的是!!!我朋友抽到68的抵扣券，简直不要太棒呀。3-4人餐，用券后才84 噜啦噜啦嘞溜啦溜啦溜啦溜啦溜啦溜啦溜啦溜啦溜啦溜啦噜溜啦溜啦溜啦溜啦 噜啦噜啦嘞。。
鱼契·烤鱼（西南财大总店）,吧唧一口玖儿,环境真的是我喜欢的风格，鱼也超级好吃！！！强烈推介他们家的香辣味的巨好吃！！！还有他们家的五花肉和玉米饼！！！玉米饼里面还有玉米粒！！！！！真的太喜欢了还有服务也超级好，还有他们家的黄瓜真的太下饭了！！！！！！
鱼契·烤鱼（西南财大总店）,NFa538154038,环境非常好   在网上团购的  找了很久才找到   刚进去被惊艳到了  一直以为是一家环境很一般的店  结果看到环境很好 菜品味道也很好  赞赞赞
鱼契·烤鱼（西南财大总店）,hBs73051371,味道很一般，我们8点多去的，我们是最后一桌，服务员居然给我们把二楼厕所的灯都关了，还喊我们用手机打灯去上厕所，如果要下班就给我们说，下次不来了
鱼契·烤鱼（西南财大总店）,psx520ww,今天和同事出来吃饭，同事说想吃烤鱼，她觉得她带我来到这家才开张不久烤鱼店，看着环境都还比较可以，里面的服务员都很热情，他们都是统一工作装，看上去特别的干练。餐厅分为上下层，厨房也二楼，还有一个送餐的小电梯，可以直接通过二楼，直到达一楼，这家烤鱼味道还不错，我们点的是一个经典麻辣味，鱼皮特别的香脆，烤串味道也不错，值得推荐一下。夏季正是吃玉米的时候，玉米饼做的很美味
鱼契·烤鱼（西南财大总店）,香水百合香不香,这家环境真的很不错，朋友聚会，约会的特别合适。装修很有格调，黑色灰色为主的现代风格，很漂亮。运气很好，我刚到店点好餐，后脚五分钟就进来的朋友被淋雨了，哈哈哈 味道不错，麻辣的最美味，他们家还有个蒜蓉的味的烤鱼，好特别，下次想再来试试。鱼的份量还是比较足哈。不吃米饭的我都忍不住来一碗下烤鱼。小姐姐们服务很热情，态度又好，性价比又高，不再来说不过去吧，哈哈哈
鱼契·烤鱼（西南财大总店）,没事继续吃吧,烤鱼感觉有点小但是玉米和掌中宝很好吃，量感觉最多两个人吃，三个人有点点不够
鱼契·烤鱼（西南财大总店）,Fhy349。,菜品口味好，分量多，价格相当实惠了。「#套餐：情侣烤鱼双人餐」店里环境很好，很适合约会哦，特别喜欢玉米饼，太太太太好吃了，自己还另外点了一份酥肉，非常nice。
鱼契·烤鱼（西南财大总店）,楼上很傻,店内装修服务超ok🙈🙈🙈🙈
鱼契·烤鱼（西南财大总店）,流年lyris,"在公司附近看到这家新开的店，于是和同事约上团了个3-4人餐，烤鱼点的麻辣味，味道合适不会太辣刚刚好，鱼肉也鲜嫩，玉米饼也好吃哟，甜甜的，这个份量很合适，不会浪费
烧烤推荐，掌中宝好吃～
座位也是卡座，可能因为新开的店，环境卫生都挺好的，团券划算，赠送了一份小吃和西瓜🍉

适合朋友聚餐，价格合适，推荐～"
鱼契·烤鱼（西南财大总店）,sunwenjie9828,墙裂推荐！玉米饼绝了，超级超级好吃，又香又甜；酸梅汤也好喝。烤鱼分量还可以，要的经典辣度，很好吃，外皮酥酥的。如果多加一些配菜就更完美了
鱼契·烤鱼（西南财大总店）,LiuuuuuWan,卖色很好看的，可是！鱼摆摆真的没味道，真的很神奇，配菜那些都有味道，就只有🐟没有，服气！炒饭好吃，玉米饼好吃！鱼摆摆加大味道就好了，吃的是酸辣的「#泡椒酸辣烤鱼」 【环境】很好 【性价比】一般 【服务】特别好特别好
鱼契·烤鱼（西南财大总店）,可爱漂亮的周乖乖,味道和环境都很不错 很赞   朋友们也都觉得很好 就是说实话干锅里面真的配菜多余最主要的 但其他的是很不错的
鱼契·烤鱼（西南财大总店）,xXW816531211,很满意的一次就餐体验，整体评价的话我觉得：口味、环境、性价比。
鱼契·烤鱼（西南财大总店）,nKF152908321,超级好吃呀，喜欢极了。环境很好，口味不错，而且店里经常有活动，对学生友好会再来的。
鱼契·烤鱼（西南财大总店）,匿名用户,菜品的味道很好，也很实惠，分量特别足。但是特别特别热，只有少数几个桌子对着空调会凉快一点。没得包间，然后隔壁桌的人说话喝酒等超级大声。整个店都听得见他们的说话声，笑声。服务员帮忙提醒了依然很吵。吃着吃着突然停电了，也没给出解决办法就让我们一直等，问多久来电一直都说不知道，没办法就直接打包回家回家吃！整个用餐体验极其差。应该不会去第二次了！！
鱼契·烤鱼（西南财大总店）,xXW816531211,感觉很不错，店家服务态度很好！很值得和朋友一起去用餐「#套餐：超值烤鱼三至四人餐」
鱼契·烤鱼（西南财大总店）,msR826738942,确实味道不错，新开的店环境不错。厨房是透明玻璃隔着的，能看清楚里面厨师在干嘛，感觉卫生有保障很放心。味道也不错，还赶上了84四人餐的优惠，物美价廉，值得来。
鱼契·烤鱼（西南财大总店）,hOV36136466,下班出来逛街看到这家开业做活动，从外面装修就让人眼前一亮，室内也很奈斯👍👍👍；套餐配菜也很适中，吃着烤鱼配着酸梅汁😃😃😀； 味道：经典烤鱼味道，辣味适度。吃的很清淡的朋友大力推荐哦；玉米饼的味道也很好都很喜欢😊。摆盘也很高大上。 环境，服务:环境很干净整洁，八位桌也很适合盆友一起来聚餐；小哥哥小姐姐服务态度也是值得肯定的🌹🌹🌹🌹🌹
鱼契·烤鱼（西南财大总店）,gWu120827948,坐标：睿城楼下的拐角处 住在这附近，也在这附近上班，新开的店就来尝尝，简直是意外之喜，味道真的非常好，不管是烤串、玉米饼、蔬菜沙拉还是烤串，简直是非常好吃，这个套餐4个女生完全够了，吃得饱饱的，关键是味道真的秒杀这附近的所有烤鱼，店面装修很nice，性价比超高！推荐
鱼契·烤鱼（西南财大总店）,八级大狂风zr,蒜香的不好吃(｢･ω･)｢嘿，还是点普通麻辣吧，烤肉串挺好吃的，味道不错，
鱼契·烤鱼（西南财大总店）,赵团团818,新来的店，有秒杀活动，也不知道吃什么，抱着试试的心态来了。店面不是很大，上下两层。8点过到店，人很多。套餐烤鱼，另外点了酥肉，鸭掌，分量都很大。酥肉不错，烤鱼味道还可以。鸭掌就有点儿不太好了，不入味，而且不热，温度不够，温温的。总体来说
鱼契·烤鱼（西南财大总店）,MDb177237729,环境方面还挺不错的，看上去很干净，店里全是好看的小姐姐。味道的话还是可以。
鱼契·烤鱼（西南财大总店）,MRr842184158,很满意的一次就餐体验，整体评价的话我觉得：口味、环境、服务、性价比、团购接待。
鱼契·烤鱼（西南财大总店）,dtX562806222,烤五花真的超级无敌好吃！环境是真的很好！看图！服务也很好，当时去的很早，但是我们刚坐下背景音乐就放起来了哈哈哈哈，好评！烤鱼味道也很不错！玉米饼好吃！
鱼契·烤鱼（西南财大总店）,滴滴哈哈哈哈,装修很有逼格呀 暖色调灯光 温馨让人有食欲 价格出乎意料得亲民 完全适合团建聚餐家宴 太划算了 装潢看起来不便宜的样子 其实比街边普通烤鱼店还要划算些 分量太足了 很舍得给小料 鱼很大一条 肉质紧实 也很入味 玉米饼很有特色 香香甜甜 就是烤五花肉有点肥 哈哈哈 点名表扬酸梅汤 不是用粉兑的那种 比较正宗 我超级喜欢 虽然随行小伙伴觉得可以再甜点 我觉得非常合适  解腻开胃哦~服务员阿姨很热情 太可爱了哈哈哈
鱼契·烤鱼（西南财大总店）,pyy328520,因为咽炎只点了蒜香味，其实还可以，就是吃几口后会比较腻。这个时候迫切需要蔬菜沙拉，结果没有，换成了酥肉，没法吃，几乎原封不动。估计会端给下一桌客人吧，而我们吃的估计也是别的客人吃剩的？玉米饼太甜了，导致不香。喜欢山楂汁，就靠它解腻了！可能吃其他口味的烤鱼要好吃的多！
鱼契·烤鱼（西南财大总店）,Jhy91422,大湾区的烤鱼超级多、出来一家吃一家、最近发现这家新开的、外面看像是一家西餐厅、装修很高档、装菜的碗碟看起也很上档次。 点了套餐、里面的掌中宝真的超级好吃、后面又单独点了几串、烧烤很入味、串的分量大。玉米饼好吃不腻、重点来了、说说我们的烤鱼、烤鱼很入味、肉质很鲜嫩。里面的洋葱和花菜好吃、土豆不像其他家那么容、脆的。发现新大陆啦、下次再来吃、乘活动、吃起走。
鱼契·烤鱼（西南财大总店）,垒妈的旅途时光,「#套餐：超值三至四人餐」和朋友约了晚餐，然后看见这里新开的烤鱼店，环境很好。一进来服务很到位。 「#招牌烤鱼」点的经典麻辣味的，味道超赞。 「#玉米饼」玉米饼很嫩很香，还有自助的免费的水果小吃。 「#自制酸梅汤」冰冻的酸梅汁喝起爆爽，冰冰凉的，特别解暑。 「#沙拉时蔬」这个特别适合减肥，哈哈，吃点儿鱼吃点沙拉，很爽。 「#烤掌中宝」撸串的感觉也很不错。 整体环境，味道都超赞，以后还会来的，主要味道好，比其他烤鱼好吃，价格还便宜。爱了爱了
鱼契·烤鱼（西南财大总店）,冬冬冬冬冬儿0.0,在美团上团的两人份的，份量大，真的非常划算。烤鱼、小吃、饮品味道都很不错哦。用餐环境也还可以，上菜速度还蛮快的，赞👍
鱼契·烤鱼（西南财大总店）,lidan554340132,环境不错，位置也很好找，新开的店，两层有独立的卡座，私密性很好！ 「#招牌烤鱼」烤鱼很入味，点的经典麻辣的，配菜很丰富 ，料很足，鱼很嫩～～～～ 「#烤掌中宝」脆脆的，恰到好处！ 「#沙拉时蔬」吃完肉类的，来一口蔬菜沙拉，很解腻，还配了一大杯冰镇的酸梅汁！ 「#套餐：超值三至四人餐」菜品份量还是很足的，四个人刚合适！
鱼契·烤鱼（西南财大总店）,蚂蚁呀嘿嘿fff,好吃 很入味哦 蒜香和香辣都爱💗「#套餐：超值烤鱼三至四人餐」
鱼契·烤鱼（西南财大总店）,天选之子ya,好吃，和图片几乎没差别，酥肉也好吃。
鱼契·烤鱼（西南财大总店）,rHl722786550,忘了以前这里开得什么店铺了，看见新开的这家美团还特别划算，就试一下，还真不错，环境很好，比较适合请客跟约会🤭，我们的战斗力比较强，没上一样才立马吃得精光，特别喜欢吃烧烤的我试了一下，它们的烧烤味道还真不错，比较喜欢，烤鱼吃肉感就能感觉出鱼的新鲜，味道很好吃，也不辣，总体感觉都非常好！
鱼契·烤鱼（西南财大总店）,ty741,环境不错！不过大学城这边不好停车是真的，很多被贴了罚单！交警应该是故意饭点来贴的！这个鱼呢！看着还行！不过多吃几口就腻了！以前没来以为是金银蒜！现在吃了才知道上面撒的面包糠！因为有小孩点了这个！后面孩子还是挺喜欢的！五花肉烤得不错！吃完第一口就又点了！
鱼契·烤鱼（西南财大总店）,jRf407207594,很满意的一次，味道不错，服务态度也好
鱼契·烤鱼（西南财大总店）,raX856339316,味道不错，装修不错。服务员很热情周到！赞
鱼契·烤鱼（西南财大总店）,匿名用户,环境挺好的，我们去的时候还有人在过生日，菜品也比较便宜
鱼契·烤鱼（西南财大总店）,yry嘿嘿,第二次吃了，真的很nice，不同烤鱼味有不同的特色，物美价廉，环境和服务都很不错，蒜香味的烤鱼很适合不喜欢辣的小仙女小哥哥吃，豆瓣推荐可以接受辣味的人吃，酸梅汤里面有真的梅子，真的真的超级安逸，超级安逸，小宝藏店铺。
