店铺名称,用户名,评论
鸡毛店·川菜（同兴西路店）,_qqnkd1436192216,此次用餐总体来说不错，觉得比较认可的地方有：口味。味道很好，住在附近，经常过来吃，朋友小聚选择这里非常不错，环境好，装修风格比较喜欢，服务也不错，上菜特别快，菜品比较新鲜，锅边磨，花椒鱼，萝卜汤味道都很好，
鸡毛店·川菜（同兴西路店）,plK125744800,"太棒了，绝绝子！！爱了爱了  
那个鱼真的超级好吃，第一次来成都，吃到这么好吃的当地特色菜，真的真心觉得超级棒！！！推荐初来成都逛的小可爱们，快快来吃啊啊啊！！！！！！！！！！！！！！！！！！！！！！！！！！！"
鸡毛店·川菜（同兴西路店）,lixinxin0615,菜味道不错，分量也还可以，人也是真的多。特别喜欢冰粉
鸡毛店·川菜（同兴西路店）,H哗啦啦啦130,因为朋友生日才去选择吃的这家，也是好久没有去吃了就想吃。推荐烤馍，甜甜的好吃，窝窝头也不错，肉菜以前吃过彩虹排骨，现在好像换了，青菜还挺清淡的，可以搭配辣菜吃比较缓解辣度，凉面还是不错的，三种颜色，比较偏辣，喜欢辣的可以试试。
鸡毛店·川菜（同兴西路店）,Asy鑫,之前去的玉林店和双流店，店面小服务好。 这次来的同兴西路，店面很大，服务相对没有那么好。 每个菜都很好吃。就是扫码点菜很多找不到，显示的菜品数量很少，得去拿卡片到服务台点菜，希望能升级一下扫码点餐系统。
鸡毛店·川菜（同兴西路店）,Marlboro0322,很棒 五星好评 环境很好 菜品新鲜 两个人吃饱饱
鸡毛店·川菜（同兴西路店）,XXk472951458,已经不是记忆里的鸡毛店了，记忆里的好吃的菜已经不存在了，巴骨肉，鹅掌粉丝煲等等，都没有了。好吃的萝卜汤已经巨难吃了，萝卜都空花了，而且作为温江大众点评必吃榜居然是萝卜采购品种的问题。夫妻肺片好看，难吃，让我感受到农村酒碗水准。手撕鸭好吃，炒菜出品不错。唯一不变的锅边馍馍。哎！
鸡毛店·川菜（同兴西路店）,uMz471193327,每次来都好多人，环境很有特色，除了包间，还有亭阁间幸好预定了，在美团上团购的，很划算，菜品搭配的好，都是评价很好的菜，适合各种年龄段的人，老人小孩都爱吃，味道不错，非常合胃口，自产的鸡毛酒好喝，号称是粮食酒，朋友很喜欢，下次还要来
鸡毛店·川菜（同兴西路店）,pYL111866390,分量很足，味道不错，多次分享，👌🏻
鸡毛店·川菜（同兴西路店）,lgnewe,味道不错，环境优美！
鸡毛店·川菜（同兴西路店）,,
鸡毛店·川菜（同兴西路店）,傻傻呆呆的图图,【性价比】 【性价比】 【口味】 【服务】 【性价比】？ 【性价比】 【性价比】 【性价比】「#汽锅双拼」
鸡毛店·川菜（同兴西路店）,YVz765411720,味道一般 期望太高 可能不会再去。。。
鸡毛店·川菜（同兴西路店）,YK9688,菜品分量十足，味道一如既往的好，值得推荐
鸡毛店·川菜（同兴西路店）,碧海云天77,不错
鸡毛店·川菜（同兴西路店）,匿名用户,来了很多次了，不错
鸡毛店·川菜（同兴西路店）,闪电旋风2,很好的一家川菜馆，
鸡毛店·川菜（同兴西路店）,MLL329329,环境舒适，菜品干净分量足，就是套餐里没有下酒菜，希望店家改进
鸡毛店·川菜（同兴西路店）,Dhv871984461,经常来，从没失望
鸡毛店·川菜（同兴西路店）,Asy鑫,味道很不错，来过很多次了
鸡毛店·川菜（同兴西路店）,匿名用户,菜挺大份的，味道可以，整体服务都不错(除了一个要你注册会员的阿姨态度不太好)，哈哈整体环境和感觉还🉑
鸡毛店·川菜（同兴西路店）,pNb599902259,味道可以，肉新鲜，辣味十足。以后还会点这个菜！
鸡毛店·川菜（同兴西路店）,dTf443582557,很满意的一次就餐体验，整体评价的话我觉得：口味、环境、性价比、服务。
鸡毛店·川菜（同兴西路店）,辰光red,性比价很高，菜品可以
鸡毛店·川菜（同兴西路店）,XMd366647636,经常来这家店吃饭，味道和口味都很好。不过最近菜量变化挺大
鸡毛店·川菜（同兴西路店）,世界我最便宜,老主顾，家住附近，希望多点新菜式。
鸡毛店·川菜（同兴西路店）,ZCS1234567890,味道好，环境好，服务员态度好，菜品丰富，虾仁做的好
鸡毛店·川菜（同兴西路店）,sGg420850117,差评，这个菜 吃起都是苦的！来了一次的人就不会来第二次了
鸡毛店·川菜（同兴西路店）,pUr600696351,【口味】一般口味不太好5分 【环境】一般 【服务】一般
鸡毛店·川菜（同兴西路店）,蓝迦SUN,点的基本上都是招牌菜。口味和味道很巴适 不过建议和服务员大妈说让顾客先看好，一直推荐还是很聒噪
鸡毛店·川菜（同兴西路店）,zXu906981907,菜品不错，服务好和环境干净整洁
鸡毛店·川菜（同兴西路店）,匿名用户,朋友过生一起庆祝，服务态度很好。
鸡毛店·川菜（同兴西路店）,mdz299039485,不错的感觉。味道不错👍服务态度比较好
鸡毛店·川菜（同兴西路店）,Pure丶丶,非常巴适，这个2-3人餐估计3个人吃完都很困难，分量很足，吃的超级饱。夫妻肺片红油特别香。萝卜汤很鲜，有肉香，超大一份，好吃又好喝。环境好，服务员服务态度也很好，主动倒茶水，打米饭，打包。下次又来。。
鸡毛店·川菜（同兴西路店）,赵赵6036,味道真不错，价格便宜，环境很好，以后还会再来！停车也很方便！
鸡毛店·川菜（同兴西路店）,mIk996889175,碗大内容少。味道还可以，服务一般
鸡毛店·川菜（同兴西路店）,xIU546879589,味道很不错，服务员态度很好，热情周到。店子很大，
鸡毛店·川菜（同兴西路店）,xaP640512597,锅边馍馍真的好好吃啊
鸡毛店·川菜（同兴西路店）,gauss2001,建议到成都，或者成都温江的，一定去吃一下，本地特色味道刚刚的
鸡毛店·川菜（同兴西路店）,阳阳0226,一如既往地好吃，3个人点了四个菜，两个小吃，没吃完打包了，非常划算。 汽锅双拼每次必点，锅边馍也是回回不落下。下次再去尝下当家巴骨肉，还有彩虹排骨。 这次是很久没去了，店里扩了装修，浓浓的古风味，去的时间已经过了饭点，所以没排队，上菜也特别快。
鸡毛店·川菜（同兴西路店）,IJX581172167,好吃好吃 来的太晚没有锅边馍了 环境很好
鸡毛店·川菜（同兴西路店）,elf130969800,味道还不错，便宜实惠哦
鸡毛店·川菜（同兴西路店）,lovelyylyyyy,还行
鸡毛店·川菜（同兴西路店）,360U81862600,老店回头客人，老夫妻先到排位，小妹没注意老人腿脚不方便，安排在最最里面位置，蹒跚走了很久，其实像这种顾客，可以安排在门口位置，就近坐。菜品一如既往满意。
鸡毛店·川菜（同兴西路店）,IOl901167514,味道不错，特色鱼🐠好吃，价格实惠，店家的环境不错，服务员态度很好，没有特殊收费，适合来吃，二人餐我们都没吃完，分量还是不错的
鸡毛店·川菜（同兴西路店）,IoP328841598,菜品口味一般，用餐环境不错，服务态度也还好，性价比可以
鸡毛店·川菜（同兴西路店）,谢军1818048,盘子大，里面菜品份量太少，上菜速度慢
鸡毛店·川菜（同兴西路店）,笨小孩120089266,菜的口味挺好。就是上菜顺序一言难尽。。。先把主食素菜给上完，然后等了很久才上主菜荤菜。。。
鸡毛店·川菜（同兴西路店）,匿名用户,还行吧，味道还可以的！
鸡毛店·川菜（同兴西路店）,橙子7145,店内环境还可以，服务态度也不错，菜品味道还是比较有特色
鸡毛店·川菜（同兴西路店）,小汪汪和大白,特意跟男朋友还有几个朋友一起去吃的，大家都觉得很好吃，还是原来那个鸡毛店哈哈。门店重新装修过，环境更为雅致清净，去的时候已经是下午了，店里人不多，我们选了靠窗的位置，一顿饭吃的很满意。特别点赞一下鸡丝凉面，真的当属鸡毛店代表菜品之一。
鸡毛店·川菜（同兴西路店）,猫er123,感觉没有以前好吃了，说不上来怎么不好吃，就是口味不怎么样
鸡毛店·川菜（同兴西路店）,liutingjiang,还可以的，可以下次再去的店！！
鸡毛店·川菜（同兴西路店）,Pure丶丶,味道好，价格实惠，分量足，环境好
鸡毛店·川菜（同兴西路店）,GHL922094603,老店了，牛肉超好吃，四川味道巴适，
鸡毛店·川菜（同兴西路店）,zhangjvwei8,味道不错，上菜很快，下次还来才。
鸡毛店·川菜（同兴西路店）,古佳554,春节期间去消费的，店面大，生意好，菜的味道，品样都还不错
鸡毛店·川菜（同兴西路店）,jiangdong泊,味道巴适，N次就餐，味道还是一样的好。姐妹们节日快乐
鸡毛店·川菜（同兴西路店）,bjygmm,经常去吃，味道巴适得板，阔以阔以阔以阔以
鸡毛店·川菜（同兴西路店）,球球有爱哒,之前半夜抢了优惠券，去过很多次，味道大赞
鸡毛店·川菜（同兴西路店）,lWj857118600,鱼也是大份 两个人点的双人餐 吃的很撑还打包了，生意真的是火爆得不得了 环境也不错
鸡毛店·川菜（同兴西路店）,UZY40016124,鸡毛店还是比较推荐的，菜品多，性价比也高，聚餐常去，小朋友也喜欢。
鸡毛店·川菜（同兴西路店）,lindn57,昨天又到鸡毛店（同心店）和朋友小聚，大家都说这个店的菜品很好，有特色，特别是炖萝卜，遗憾的是没有吃到鸡，原因超级奇怪：是配送的鸡没有送到，超级抓狂……哈哈又忘了晒图片。环境和服务还是一如既往的好。有想聚一聚的朋友强烈推荐去光顾一下喔。
鸡毛店·川菜（同兴西路店）,EqX517806376,菜品口味不错，环境不错，服务态度可以。
鸡毛店·川菜（同兴西路店）,Lotus3342,此次用餐总体来说不错，觉得比较认可的地方有：环境、口味。
鸡毛店·川菜（同兴西路店）,ziyue003,还不错
鸡毛店·川菜（同兴西路店）,uMz471193327,味道不错，请朋友吃饭，六个人吃得很开心，量足够了，因为喝酒，加了一盘花生米，另外加了一份女儿喜欢吃的锅边馍，很喜欢！
鸡毛店·川菜（同兴西路店）,360U81862600,听朋友宣传慕名而来，品菜后立马入了会员，家有宾客带来倍有面子！路过几年，第一次进，真不知里面有宝藏哦！
鸡毛店·川菜（同兴西路店）,小莉HL,菜品很丰富，味道很好！进店服务非常热情，没有因为团购而怠慢，上菜速度也很快
鸡毛店·川菜（同兴西路店）,匿名用户,六人餐五个人吃的，菜量就很足，上菜路程。
鸡毛店·川菜（同兴西路店）,aRN228695597,满意，鸭子味道不错，就是上菜在最后，都有点饱了。
鸡毛店·川菜（同兴西路店）,方草123,老顾客了，价格实惠，分量很足
鸡毛店·川菜（同兴西路店）,花尔尔,很棒
鸡毛店·川菜（同兴西路店）,今夕何夕2009,对此美团团购价和现场点菜价，价格几乎没有差异，同时套餐中特色菜、硬菜偏少，套餐的性价比很低
鸡毛店·川菜（同兴西路店）,jjv596302317,味道不错，上菜速度快。价格实惠。
鸡毛店·川菜（同兴西路店）,匿名用户,鸡毛店价格暴涨 和红杏酒家一个价 但是红杏100元返60，鸡毛店100元返0。。
鸡毛店·川菜（同兴西路店）,IIw974674531,味道不错，分量足！环境也不错！
鸡毛店·川菜（同兴西路店）,雾眠气泡水O,用餐体验感不是很好 菜上了很久 虽然没有超时但是差不多踩点上的 每次上一盘 等我们吃完了才来下一盘 心累 而且很多菜都没有了 那个时候才八点哎 后厨不能多备货嘛 想加菜都没有 很不喜欢 手撕鸭有点油腻不推荐
鸡毛店·川菜（同兴西路店）,PXJ454146203,菜品很不错，大碗鸡丝凉面好吃
鸡毛店·川菜（同兴西路店）,静1110静,有特色，味道好，分量足！带外地朋友去很不错哦！
鸡毛店·川菜（同兴西路店）,jjv596302317,份量大，味道不错，值得品尝品尝。
鸡毛店·川菜（同兴西路店）,你得不到的琴子,小龙虾分量挺足的，当时就是虾有点小，稍微有点麻了。其他还行
鸡毛店·川菜（同兴西路店）,jiangdong泊,不错，离家近，味道好，待客首选，可惜没照片
鸡毛店·川菜（同兴西路店）,fast....,感觉没以前好吃了。。。。。。。。。
鸡毛店·川菜（同兴西路店）,frY340936441,味道不错，个别菜性价比不高。干净卫生。
鸡毛店·川菜（同兴西路店）,CCandYST,性价比高
鸡毛店·川菜（同兴西路店）,五星赛道,菜品可以，但是我对于大厅这个设施真的不满意。一个8人桌子居然不能转菜品，太奇葩了吧。换一个转盘也才多少钱而已。不过味道菜品是真的非常丰富好吃。服务的话即便大厅也服务得比较周到的。环境的话这个环境在中餐馆中算很好的了不错
鸡毛店·川菜（同兴西路店）,亜馹YouNG7in,这次就餐整体感觉很赞，比较满意的方面有：环境、性价比、服务、团购接待。
鸡毛店·川菜（同兴西路店）,WWR613925818,第一次跟同事一起去吃，其它菜都还可以就是虾，下面那个米线有点太焦了，希望师傅可以改进，服务员太热情了
鸡毛店·川菜（同兴西路店）,sHU417853153,家附近，生意火爆，上菜快，份量足
鸡毛店·川菜（同兴西路店）,Gin924519912,味道很好
鸡毛店·川菜（同兴西路店）,CsK242129385,可以，分量差不多，只是没有以前那么辣，总体还是不错的，，，，，，，，，，，，，，，，，，，，，，，，，，，，，，，，，，，，，，，，，，，，，，，，，，，，，，凉拌鸡挺好吃，辣子鸡和跳水蛙没有以前的好吃了，lllllllll
鸡毛店·川菜（同兴西路店）,Ser428366934,菜品有特色，非常丰富，价格合理，很好吃，分量足，上菜快，门口好停车老顾客了，经常回去，红烧肉，酸萝卜老鸭汤，糯米排骨，咸烧白各种特色川菜非常推荐👍👍👍 #锅边馍# #彩虹排骨# #汽锅双拼# #特色花椒鱼# #毛氏红烧肉# #甜烧白# #酸萝卜老鸭汤#
鸡毛店·川菜（同兴西路店）,绿琳仙子,菜品好像涨价了不少，而且巴骨肉品质没有以前好。作为一个常客，难免有点失望，希望店家再接再厉
鸡毛店·川菜（同兴西路店）,hi小李智障,环境很好  我已经是回头客 以前请客总喜欢请大家去这一家！ 有川菜的特色 有四川的特色，菜品也好吃。 今年请大家吃了几次 反响不好 都说难吃 。
鸡毛店·川菜（同兴西路店）,静思12,挺好
鸡毛店·川菜（同兴西路店）,dYn874228694,我们总共去了7个人，聚餐完毕后每个人都吃的饱饱的，服务也很到位。屋里面给布置的还不错👍👍👍也比较温馨。后面光顾着吃了也没来得及拍照，我最爱的蒜蓉粉蒸虾，高压双拼也不错，鸡丝凉面也挺好吃的，就是碗巨大「#套餐：8 人套餐」
鸡毛店·川菜（同兴西路店）,匿名用户,这次就餐整体感觉很赞，比较满意的方面有：口味、服务。
鸡毛店·川菜（同兴西路店）,翠翠儿的meituan,吃中餐基本都是去鸡毛店，酸汤肥牛、全家福和锅边馍是我们的必点菜。
鸡毛店·川菜（同兴西路店）,葉小九,实惠，便宜
鸡毛店·川菜（同兴西路店）,glj183735318,味道好，份量足，价格合理，上菜快，服务好。 #萝卜大骨汤# #石锅生焖虾# #蒜泥白肉# #特色花椒鱼# #干锅有机花菜# #石锅老豆腐# #特色圆子汤# #干煸肥肠# #毛氏红烧肉# #招牌豆腐# #特色巴骨肉#
鸡毛店·川菜（同兴西路店）,匿名用户,菜很好吃，环境也超棒
鸡毛店·川菜（同兴西路店）,lyla1986,感觉非常一般，尝了一口，放弃了。
鸡毛店·川菜（同兴西路店）,Hje559109187,路边停车方便，店里装修风格很不错，服务员态度很好。
鸡毛店·川菜（同兴西路店）,糖糖48759,菜品好吃，服务好，上菜快，请客吃饭推荐
鸡毛店·川菜（同兴西路店）,wang511525,上错菜，味道没以前好了，装修过后性价比也不高了，说不出那个味道，请远道而来的朋友去吃，结果差强人意！！！
鸡毛店·川菜（同兴西路店）,xzy1971,吃了很多次了，价格便宜，味道不错👍
鸡毛店·川菜（同兴西路店）,等风的旗8736, #锅边馍# #莲白粉丝# #毛氏红烧肉# #土豆绘四季豆#
鸡毛店·川菜（同兴西路店）,dqx318,"环境很不错，有两层楼，堂食也有软隔断。我们坐的二楼包间，上菜也很快,菜的分量很大。不错"
鸡毛店·川菜（同兴西路店）,happy西凉,十月一号，中秋节国庆节，这么好的日子，带着家里长辈过来吃饭，结果端上来的第一个菜里面就有虫！！！！！！！
鸡毛店·川菜（同兴西路店）,uXN951636856,鸡毛店非常好吃  吃过好几次了 很开心 #特色巴骨肉# #毛氏红烧肉#
鸡毛店·川菜（同兴西路店）,匿名用户,价廉物美，非常实惠 #特色巴骨肉# #蒜泥白肉# #毛氏红烧肉#
鸡毛店·川菜（同兴西路店）,匿名用户,环境服务很好，菜品比较少，想吃的彩虹排骨只有总店才有😭粉蒸排骨扎肉的双拼有些咸，全家福的汤汁很下饭，菜略少。饭是免费自己盛的，豇豆茄子🍆放的醋比较多有点酸，味道不是很好。下次想来尝尝鸡脚芋儿，看着不错。
鸡毛店·川菜（同兴西路店）,洋洋呆,一般家常菜 茄饼很油腻很油腻 锅边馍值得推荐
鸡毛店·川菜（同兴西路店）,wNc117514143,服务态度好，菜品新鲜卫生，回头客了。
鸡毛店·川菜（同兴西路店）,cDS193175205,无人不舒服到店想吃口热的。一个素菜一个番茄牛腩。等菜途中也喊服务员催过菜。大概15分钟左右素菜来了，先吃起。两人米饭和菜吃着。素菜快见底的时候又喊服务员催下菜，结果服务员回来告知没有？请问你们之前干嘛
鸡毛店·川菜（同兴西路店）,wNc117514143,我们是老顾客了，经常会去鸡毛店。
鸡毛店·川菜（同兴西路店）,wNc117514143,菜品品种多，份量尺，味道还不错！
鸡毛店·川菜（同兴西路店）,Ijh974493516,好吃，就是辣了点。希望下次不要那么辣！！
鸡毛店·川菜（同兴西路店）,知行合一398,味道一如既往的巴适，环境也很好
鸡毛店·川菜（同兴西路店）,dGy806793875,我订的八人餐，那天是我老爸生日，店家特意布置一下很温馨的一次就餐，菜品味道很好，以后有朋友来会继续光顾
鸡毛店·川菜（同兴西路店）,LyeenoO,鸡毛店有多好吃不用我多说了吧？服务也好，特别是那个上菜机器人太可爱了吧哈哈哈哈😍😍性价比很高 超喜欢这家
鸡毛店·川菜（同兴西路店）,LIW15828251210,此次用餐总体来说不错，觉得比较认可的地方有：口味。
鸡毛店·川菜（同兴西路店）,梁子敬819,已经来过很多次了，一如既往的好吃，压锅双拼不错点了很多回次
鸡毛店·川菜（同兴西路店）,满满0500,都很好，就是彩虹排骨这道菜没了，在菜谱上消失了，鸡毛店不做彩虹排骨实在是太不可思议了，我家孩子最喜欢这道菜了，很遗憾
鸡毛店·川菜（同兴西路店）,jjv596302317,小桌没有等位子。
鸡毛店·川菜（同兴西路店）,wtZ164236566,味道还是一如既往的好！环境重新装修了的，很不错！
鸡毛店·川菜（同兴西路店）,好吃猫儿麻麻,好吃
鸡毛店·川菜（同兴西路店）,duoduodi,说了不要辣椒，给我撤回去，辣椒拿出来继续上，孩子不能吃辣，真的差劲
鸡毛店·川菜（同兴西路店）,t1104546712,味道棒，最爱的彩虹排骨没有了，很伤心
鸡毛店·川菜（同兴西路店）,詹炼,此次用餐总体来说不错，觉得比较认可的地方有：环境。
鸡毛店·川菜（同兴西路店）,mbu193094872,新装修的，环境不错，菜品一如既往的好
鸡毛店·川菜（同兴西路店）,廖洁796,此次用餐总体来说不错，觉得比较认可的地方有：口味。
鸡毛店·川菜（同兴西路店）,Wgd648500255,很满意的一次就餐体验，整体评价的话我觉得：环境。
鸡毛店·川菜（同兴西路店）,baN118429561,就是一家川菜馆，味道一般吧？速度比较快
鸡毛店·川菜（同兴西路店）,xiaoggaimm,盘子大，菜少，套餐真心不行，建议单点。
鸡毛店·川菜（同兴西路店）,uUj564123198,没有以前好吃了，原材料很差，以后不会去吃了
鸡毛店·川菜（同兴西路店）,xfxlj,性价比高，大厅有点吵，包厢还不错～
鸡毛店·川菜（同兴西路店）,露露小吃货,很不错，菜品口味好，份量足！！！！！
鸡毛店·川菜（同兴西路店）,风继续吹吹吹0889,这次就餐整体感觉很赞，比较满意的方面有：口味好，价格实惠，服务周到！
鸡毛店·川菜（同兴西路店）,匿名用户,觉得味道不如以前了呢？服务挺好，菜多，性价比还是可以
鸡毛店·川菜（同兴西路店）,薇V1112,经常去吃，味道不错。
鸡毛店·川菜（同兴西路店）,dUC695676478,装修风格有中国古韵特色，菜品的味道巴适
鸡毛店·川菜（同兴西路店）,小糯米芒果,一如既往的好
鸡毛店·川菜（同兴西路店）,BsD503475096,店很大，装修多样有趣，论环境是个不错的家宴或者会客的好地方。 然后着重就我们这一餐宴请客人的过程评价一下。 上菜太慢超出想象，我们一共点了10个菜，自点菜开始，大约等了将近30分钟的样子，第一个给我们上的是饮料？？？接着过了10分钟左右，上了一个凉菜，然后陆陆续续上了4个菜左右。宴请客人实在不好再等，开始用餐，这过程中去询问了两次，均说在上，这就导致大家吃吃歇歇，满桌尴尬气氛围绕着每个人。直到我们吃饭结束还有2个菜没有上，无奈只好退掉。 服务大多都是老阿姨，有需要叫她们时，他们也忙不过来，饭得自己去煲饭处盛等等…… 会客宴请，重来没遇到过这样的情况。选择了他们家宴请客人，这一餐下来，不如不请，尴尬什么的就不说了吧，真怕客人觉得我们诚心不待见他们🙂🙂🙂
鸡毛店·川菜（同兴西路店）,nyW274810816,这次就餐整体感觉很赞，比较满意的方面有：性价比。
鸡毛店·川菜（同兴西路店）,xXo361513112,还行
鸡毛店·川菜（同兴西路店）,iUY926221958,不错的色香味俱全
鸡毛店·川菜（同兴西路店）,夏志民,去了几次了、味道还是不错就是今天去计时都过了好久了、我们还有4个菜没有上、催了以后才上来、希望服务更进。
鸡毛店·川菜（同兴西路店）,X….Sir,这次就餐整体感觉很赞，比较满意的方面有：环境优美、口味好。
鸡毛店·川菜（同兴西路店）,tAI387254815,这次就餐整体感觉很赞，比较满意的方面有：配菜合理、口味好、菜品丰富、环境优美、份量充足、服务到位。
鸡毛店·川菜（同兴西路店）,WhH388970082,很满意的一次就餐体验，整体评价的话我觉得：配菜合理。
鸡毛店·川菜（同兴西路店）,UVh687819356,装修更好了，菜品价格也比之前高了
鸡毛店·川菜（同兴西路店）,旧铁皮往南开丶,服务很好，菜品味道也好。
鸡毛店·川菜（同兴西路店）,mcu610850993,我们喜欢去鸡毛店吃饭，这次还是有点让人失望，点了一个青椒皮蛋，皮蛋是臭的，青花椒鱼，没一点味道，他们的宣传图片上还有一些青花椒，做的实物确一粒花椒都没有，是不是你们换厨师了。但他家的服务还算可以，当时他们的负责人马上再重做一份，我们也吃不下了，也就没要了。
鸡毛店·川菜（同兴西路店）,安初七,性价比非常高，味道好上菜也快
鸡毛店·川菜（同兴西路店）,匿名用户,不好吃 虾没有新鲜的  四斤的虾 个头还贼小  第一次吃到这么难吃的虾  喜欢吃虾的人千万别买。不然这辈子你都有阴影了
鸡毛店·川菜（同兴西路店）,随便改一个称呼,鸡毛店还是一如既往的好吃，我还得到了一百无门槛优惠券
鸡毛店·川菜（同兴西路店）,袁周率,老店了
鸡毛店·川菜（同兴西路店）,qUY711822915,经常去他们家吃饭，现在改了，还是喜欢以前的大堂，人多吃着热闹。
鸡毛店·川菜（同兴西路店）,老夫子驾到,很满意的一次就餐体验，整体评价的话我觉得：配菜合理。
鸡毛店·川菜（同兴西路店）,dFS623614310,这次就餐整体感觉很赞，比较满意的方面有：口味好。
