店铺名称,用户名,评论
鸡毛店·川菜（同兴西路店）,小晓470,味道很不错，特别是花椒鱼，没刺，小朋友很爱吃
鸡毛店·川菜（同兴西路店）,BEY180996504,足
鸡毛店·川菜（同兴西路店）,cei650813087,味道巴适，服务态度也很好！
鸡毛店·川菜（同兴西路店）,jJm675238424,不错，味道很好，分量也不错，唯一不好就是用美团买单不给开发票。
鸡毛店·川菜（同兴西路店）,Flora蜜蜜,所有菜品分量都很足，两个人吃三个菜实在太多了。双拼好吃不油腻、鱼鲜香下饭，关键是基本没有什么鱼刺，吃起来爽歪歪，最赞的是萝卜棒子骨汤盐味刚好合适，反而衬托了白萝卜的清甜味儿十分好喝。服务员服务也很热情周到哈，坐在里面凉快干净。
鸡毛店·川菜（同兴西路店）,fRt827377949,上菜太慢
鸡毛店·川菜（同兴西路店）,zpf586362993,打包要收费也不提前说下，白出3块钱
鸡毛店·川菜（同兴西路店）,云萧晴川,没有锅边馍馍的鸡毛店，差评
鸡毛店·川菜（同兴西路店）,我彻底震惊了,贼好吃！回头客！
鸡毛店·川菜（同兴西路店）,alice987789,超级棒
鸡毛店·川菜（同兴西路店）,xQK633658587,一直觉得是温江味道最好聚餐最佳餐厅之一，铁粉! 最爱彩虹排骨!
鸡毛店·川菜（同兴西路店）,BPf346502260,好吃！
鸡毛店·川菜（同兴西路店）,奋斗8086,对温江总店，有点失望。味道很一般
鸡毛店·川菜（同兴西路店）,RNG006,菜品味道不错，分量也挺足，好吃…
鸡毛店·川菜（同兴西路店）,逛吃不胖大胃王,味道一如既往的好，就是人太多，等的久
鸡毛店·川菜（同兴西路店）,FC1000W,彩虹排骨如果全烤就不错了。这种的肉虽然很烂 但是比较腻 比较推荐
鸡毛店·川菜（同兴西路店）,OkR359037554,一如既往 棒
鸡毛店·川菜（同兴西路店）,匿名用户,菜品味道不错，服务也可以，就是人太多，上菜速度较慢，其他还好。
鸡毛店·川菜（同兴西路店）,jMY237547211,菜品一般。没有评论的那么好
鸡毛店·川菜（同兴西路店）,OQc695157720,挺好的，不过那个酸汤江团就不咋得了，可能家常菜还好吃些吧
鸡毛店·川菜（同兴西路店）,Kiwi706,在家附近，经常来。周末爆满！
鸡毛店·川菜（同兴西路店）,Jjp759978230,剁椒鱼头不错，其他一般般
鸡毛店·川菜（同兴西路店）,Twt749161329,服务员太笨了，海椒水都不晓得。
鸡毛店·川菜（同兴西路店）,bdq120150914,点菜员没有起到引导点菜的作用，菜的份量很大，一个劲的说不够吃，诱导多点菜，最后上菜后才发现4个人点了7个人的份量，此餐厅本是革命主题餐厅，结果很多吃不了，严重铺张浪费，第一个菜上来发现份量很大，要求退
鸡毛店·川菜（同兴西路店）,莱奥m10,味道很好，分量很足，服务也很热情周到。
鸡毛店·川菜（同兴西路店）,_qqwtx1416129039,锅边馍少上一份。不满意。也不送
鸡毛店·川菜（同兴西路店）,猫不闹记忆,好吃，还送了银耳汤，哈哈哈哈，彩虹排骨好吃，那个鸭爪味道一般，最喜欢歌这里的汤
鸡毛店·川菜（同兴西路店）,vJd342636257,无论是菜的味道还是菜的份量都不入以前
鸡毛店·川菜（同兴西路店）,eAu376429952,每次都是排队，烦死了
鸡毛店·川菜（同兴西路店）,ciD750390547,好咸
鸡毛店·川菜（同兴西路店）,d3295,味道很好，分量足！
鸡毛店·川菜（同兴西路店）,FYZ462598074,半个小时一盘菜，点三个菜要一个半小时
鸡毛店·川菜（同兴西路店）,meshle,分量超足 味道不错 家庭聚会好地方
鸡毛店·川菜（同兴西路店）,djj304599617,这次上菜太慢
鸡毛店·川菜（同兴西路店）,vIM199302394,服务员态度不好，脾气大
鸡毛店·川菜（同兴西路店）,alexfengt,菜还可以，服务一般。酒水有点贵。
鸡毛店·川菜（同兴西路店）,hJh779022029,好吃
鸡毛店·川菜（同兴西路店）,wqrx,服务跟不上，都吃完了也没上锅边馍，而且没有诚信，结账时没有兑现超过30分钟免费那个菜品。
鸡毛店·川菜（同兴西路店）,崇州农民,啥都好，真的啥都好，包括生意也好，好的爆，所以有些菜就慢了，人超多，老板生意好，发大财
鸡毛店·川菜（同兴西路店）,xiahjunsu1,蛮好吃的
鸡毛店·川菜（同兴西路店）,HNB420417632,上菜慢了点，但是味道不错
鸡毛店·川菜（同兴西路店）,Kfi832789287,专门从高新西区开车过来吃，非常不错
鸡毛店·川菜（同兴西路店）,HNB420417632,上菜速度慢了些
鸡毛店·川菜（同兴西路店）,cuO337461667,味道，色 香 味不错，  天天排队！！！
鸡毛店·川菜（同兴西路店）,憨厚老伟,老店了，很不错，经常消费
鸡毛店·川菜（同兴西路店）,JNw895781712,还行吧
鸡毛店·川菜（同兴西路店）,dorothyyin,超喜欢吃的一家店，就是生意太好，人越多，排队越久
鸡毛店·川菜（同兴西路店）,匿名用户,菜品不错，味道也和以前一样
鸡毛店·川菜（同兴西路店）,LUR407936592,分量足，要人多吃起来比较好。
鸡毛店·川菜（同兴西路店）,ifM283140204,肥肠芋儿鸡59块钱全是芋头，只有三片肥肠......
鸡毛店·川菜（同兴西路店）,OJi544515336,还是很不错……服务态度也好，就是上菜慢了点。
鸡毛店·川菜（同兴西路店）,vTn600201656,可以，味道不错
鸡毛店·川菜（同兴西路店）,Zqv726476945,味道一般，听别人说好吃才特意过来的，有点失望
鸡毛店·川菜（同兴西路店）,匿名用户,鸡蛋羹是冷的 鸭掌粉丝煲不太好吃 萝卜汤味道很好
鸡毛店·川菜（同兴西路店）,tYf329622929,牙签肥牛太肥了，但萝卜汤特别好喝
鸡毛店·川菜（同兴西路店）,OQi922925111,太吵了
鸡毛店·川菜（同兴西路店）,STONE学长,属于温江比较有特色的中餐馆
鸡毛店·川菜（同兴西路店）,sornli,服务员忙得晕头转向，对我们的服务自然就谈不上周到了。 菜品，大部分可以，但那个牙签肥牛，纯粹是坑爹!建议不要点，全是肥泡泡!
鸡毛店·川菜（同兴西路店）,CND185565732,牙签肥牛是真的“肥”🐮
鸡毛店·川菜（同兴西路店）,xKt468410324,绍子蒸蛋不是很好吃。。其他还可以。。个人来说菜品不错，有一点偏贵。。。。
鸡毛店·川菜（同兴西路店）,WxF689593942,装修过后，什么都要钱了。老板太小气了。生意这么好是不是可以把停车费给大家免了
鸡毛店·川菜（同兴西路店）,rGH204091817,挺不错的
鸡毛店·川菜（同兴西路店）,zOk187423990,秘制红烧肉烧糊了，其他菜还可以
鸡毛店·川菜（同兴西路店）,tEc257398851,虽然和以前不一样了，但是锅边膜上得太慢了，其它都吃完了几个人干坐着等它！
鸡毛店·川菜（同兴西路店）,vZh632862236,好吃，量足
鸡毛店·川菜（同兴西路店）,ZfQ731096567,可以推荐
鸡毛店·川菜（同兴西路店）,cyz麻麻,经常来吃，很棒
鸡毛店·川菜（同兴西路店）,yVW292188982,一般
鸡毛店·川菜（同兴西路店）,Mr.vallentine,味道好，每次到温江都会吃这家，貌似成都也开了一家
鸡毛店·川菜（同兴西路店）,JsK670463349,服务一般，来了半天没有人问，我叫了两到才来点菜，点了六个菜有三个菜没有，菜里面的干海椒都发霉了还在拿来炒菜，菜里面还有鸡毛，还真的是鸡毛店额！还写的是地道成都味，我不知道哪里来的成都味，基本炒菜都没有
鸡毛店·川菜（同兴西路店）,fJa640454602,一般般
鸡毛店·川菜（同兴西路店）,家有仙妻2012,人太多了，服务有点跟不上。包间环境一般
鸡毛店·川菜（同兴西路店）,HGd652731031,前面先上的两个菜太辣，后面的菜还没上上来，就告诉服务员让后厨帮我调一下菜的口味，服务员的态度极不友善，各种推委，
鸡毛店·川菜（同兴西路店）,ZxM287954431,服务员之间传话效率有待提高
鸡毛店·川菜（同兴西路店）,Mr.vallentine,好评，来过很多次了，每一次都不后悔
鸡毛店·川菜（同兴西路店）,hugoking2012,怎么没有折扣？
鸡毛店·川菜（同兴西路店）,kTL174717043,去吃过几次了，人很多。上菜很快。招牌菜不错，小孩子喜欢吃彩虹排骨
鸡毛店·川菜（同兴西路店）,妱姢,一般般
鸡毛店·川菜（同兴西路店）,枝枝心头闹,很棒哦
鸡毛店·川菜（同兴西路店）,solo骨头圣君,上菜稍微慢了一点。味道很不错。
鸡毛店·川菜（同兴西路店）,楽里,菜味、菜色都不错，不足的是服务因为人多稍欠，价格同比高了些
鸡毛店·川菜（同兴西路店）,JzA673674840,味道不错，就是人多，服务一般，价格便宜
鸡毛店·川菜（同兴西路店）,川东片羽,菜品一如既往的地道，新装修的店铺也让人赏心悦目。不过厨房与大厅连通，好处是一览无余，弊端是空气中弥漫着油烟。
鸡毛店·川菜（同兴西路店）,JzA673674840,服务一般，味道好不错！消费不高
鸡毛店·川菜（同兴西路店）,hathaway1018,凉菜太糊弄人了。还有个菜感觉没熟
鸡毛店·川菜（同兴西路店）,改个名字好麻烦哎,啤酒强制消费
鸡毛店·川菜（同兴西路店）,智羲,生意好了，服务就不好，望改善
鸡毛店·川菜（同兴西路店）,STM95216248,可以
鸡毛店·川菜（同兴西路店）,jee008,请朋友几个吃饭
鸡毛店·川菜（同兴西路店）,hEg234737779,味道只能说一般
鸡毛店·川菜（同兴西路店）,SFi430746299,味道很好，没到菜都好吃，上菜速度也还可以。
鸡毛店·川菜（同兴西路店）,床头的小强,服务周到，菜品很棒，下次还来
鸡毛店·川菜（同兴西路店）,匿名用户,还行，有多。服务员有态度不怎么好
鸡毛店·川菜（同兴西路店）,川东片羽,味道不错。但是店家估倒收所谓的每人2元消毒餐具费。而免费提供消毒餐具是市场监管部门对餐馆的基本要求。纯属变起花样乱收费！
鸡毛店·川菜（同兴西路店）,川东片羽,来过多次了，味道一流，价格亲民。美中不足的是汤的种类太少，就两样。
鸡毛店·川菜（同兴西路店）,eRf406597929,菜品不错。心情不好！
鸡毛店·川菜（同兴西路店）,suby028,空调不给力
鸡毛店·川菜（同兴西路店）,yVO385526625,的确不错，支持
鸡毛店·川菜（同兴西路店）,我是道长,就是不太分得清总经理和服务员。因为衣服穿一样。
鸡毛店·川菜（同兴西路店）,蔬鲜生,要得
鸡毛店·川菜（同兴西路店）,Yic639777048,栋
鸡毛店·川菜（同兴西路店）,iCC480702288,味道棒棒的！量大很实惠！
鸡毛店·川菜（同兴西路店）,完美生活625,不给发票，不打折。
鸡毛店·川菜（同兴西路店）,匿名用户,口味不错，传统地道川菜，分量足，实惠！
鸡毛店·川菜（同兴西路店）,HSV993992154,太辣，少一点小米辣
鸡毛店·川菜（同兴西路店）,匿名用户,菜品味道不错，分量很足，就是排队的人太多了。
鸡毛店·川菜（同兴西路店）,OUR630806783,上菜超时，后面的菜就回答你今天没有这款菜了，小吃也超时了，告诉你小吃不在超时范围！
鸡毛店·川菜（同兴西路店）,匿名用户,味道好，分量足，昨晚去吃了，今晚还去！
鸡毛店·川菜（同兴西路店）,PZH473002996,好多菜都没有了！点菜时换了好几道。喜欢吃的菜没点上！
鸡毛店·川菜（同兴西路店）,zy861282479,味道很棒。服务态度也好，分量也足，很不错哦
鸡毛店·川菜（同兴西路店）,糊涂妖怪,以前就经常吃，味道确实不错。分量足，如果团购优惠力度更大点就完美了。
鸡毛店·川菜（同兴西路店）,eVR292828319,环境嘈杂，热。不过巴骨肉很好吃。
鸡毛店·川菜（同兴西路店）,夏天的柠檬水,变成我家食堂
鸡毛店·川菜（同兴西路店）,cpc6806982715571,菜品味道很好，干净，服务态度也好
鸡毛店·川菜（同兴西路店）,hQa804802377,整体来说都很不错，招牌菜味道很棒，物美价廉，就是菜系味道普遍偏咸，开始不觉得，越吃越咸
鸡毛店·川菜（同兴西路店）,Quatey,超赞，忠实粉丝
鸡毛店·川菜（同兴西路店）,iII980739688,挺好，值得推荐的！
鸡毛店·川菜（同兴西路店）,爱无夜来风,真是名不虚传，太好吃了……以后再来
鸡毛店·川菜（同兴西路店）,匿名用户,性价比蛮高，服务态度超级不好，慎行
鸡毛店·川菜（同兴西路店）,mIm378492652,分量足，味道不错
鸡毛店·川菜（同兴西路店）,Ohh452322811,还可以 就是空调不给力 也没有风扇，大热天吃太累
鸡毛店·川菜（同兴西路店）,匿名用户,多次光临了，菜品不错，实惠。就是每次点多。
鸡毛店·川菜（同兴西路店）,bVc634202656,味道很好，会长期光顾
鸡毛店·川菜（同兴西路店）,QCH184181808,老客户了，下次还来
鸡毛店·川菜（同兴西路店）,reV879395009,回头来吃，常点的菜都没有了。新菜品又没更新！！
鸡毛店·川菜（同兴西路店）,weblue6561,好吃，不过好难得排队，🌈排骨很棒。
鸡毛店·川菜（同兴西路店）,GgD205447035,味道还可以，不过有点小贵，嘿嘿嘿。
鸡毛店·川菜（同兴西路店）,HhX194962675,味道一般，环境还可以，还是双流那边好吃
鸡毛店·川菜（同兴西路店）,xfu630007875,点了两样菜觉得味道不是太好，一个是他们必点的招牌 蒜泥白肉，有点腻。还有一个是擂椒茄子。。西瓜汁喝着也有点酸味
鸡毛店·川菜（同兴西路店）,weblue6561,🌈排骨很棒
鸡毛店·川菜（同兴西路店）,bwang38,不错
鸡毛店·川菜（同兴西路店）,MFe504003150,安逸
鸡毛店·川菜（同兴西路店）,dtU767811375,服务员把水倒身上了
鸡毛店·川菜（同兴西路店）,Honey1130,味道不错，分量足，没吃完，打包了
鸡毛店·川菜（同兴西路店）,KQW527149996,跳水蛙不好吃，拌猪头肉不好吃，红烧肉不好吃……其它都还不错。
鸡毛店·川菜（同兴西路店）,BLU864078112,吃太饱了
鸡毛店·川菜（同兴西路店）,oeK485658974,很好吃
鸡毛店·川菜（同兴西路店）,SrM695684360,环境再好点就对了
鸡毛店·川菜（同兴西路店）,JSV125878747,想吃跳水蛙才来的结果没有了，不开心
鸡毛店·川菜（同兴西路店）,侯安安308,菜品撇，排队排半天，服务人员是大爷，喊不动的
鸡毛店·川菜（同兴西路店）,Yeg889669809,味道一般
鸡毛店·川菜（同兴西路店）,noZ206155330,服务太差
鸡毛店·川菜（同兴西路店）,gPi942515917,味道一次比一次差，锅边馍是冷的，上汤娃娃菜麻的吃不得，居然饭里还有塑料薄膜，必须差评
鸡毛店·川菜（同兴西路店）,Xiaopz01,中午去人都是满的。生意太火爆，所以要提前。性价比也不错，确实味道巴实。停车很方便的。
鸡毛店·川菜（同兴西路店）,hahwx,本地菜最好吃的一家店之一。
鸡毛店·川菜（同兴西路店）,vEy224976487,真的好吃。
鸡毛店·川菜（同兴西路店）,jJw989829277,七彩排骨
鸡毛店·川菜（同兴西路店）,CrA108375486,就是太热了，没有空调
鸡毛店·川菜（同兴西路店）,Ewf636481184,装修后感觉比之前好些了
鸡毛店·川菜（同兴西路店）,adminlvbo,味道好，分量足。满意
鸡毛店·川菜（同兴西路店）,qcj595338990,还不错
鸡毛店·川菜（同兴西路店）,lOC406397250,味道可以，分量足。
鸡毛店·川菜（同兴西路店）,gege861129,鸡毛店算是温江的一个老字号了，好像开了好多年，之前一直没有去吃过，这吃去吃了，为了正确看待，专门去了两次。整个体验一般。为什么？第一次人确实太多了！！菜好像是提前做好的，我们要了一个汤菜，直接是温的，一下子就凉了！后面又去了一次，人要少很多，但是感觉也没有很好！不过份量还是挺大的，菜也挺有特色，味道算一般没有太好吃的感觉。
鸡毛店·川菜（同兴西路店）,ngn237251850,吃了很多次了，经济实惠
鸡毛店·川菜（同兴西路店）,匿名用户,味道不错经常吃，每次点菜都要点多- -
鸡毛店·川菜（同兴西路店）,我以为我是我,人多，菜品分量足，不错，性价比高
鸡毛店·川菜（同兴西路店）,匿名用户,传说中的网红鸡毛店也不过如此！呵呵！菜品不行，中看不中吃！不会再来第二次！也不知道为什么这么多人来吃！搞不懂！还是不要盲目跟风！
鸡毛店·川菜（同兴西路店）,流量多勇毅,味道还可以，就是人太多太多，每次都排队，有些菜还点不到。。。
鸡毛店·川菜（同兴西路店）,李铮倖,生意好，价格合适
鸡毛店·川菜（同兴西路店）,流量多勇毅,不错满意，就是人多，点不到想吃的东西.
鸡毛店·川菜（同兴西路店）,匿名用户,这服务态度简直无话可说，点菜的时候服务员一直往外看。结果兔子上成了鱼。半个多小时菜还没上齐，不是说半小时没上免单，呵呵了，服务员一直在打感情牌说我们不付的话就要她们付，这是要道德绑架？我简直无fuck说，辣鸡
鸡毛店·川菜（同兴西路店）,笑开花了的妈妈,服务员素质急需提高，不要认为生意好就可以忽视顾客
鸡毛店·川菜（同兴西路店）,市小小可可,不错  味道给力  朋友一起去吃的  有机会还去
鸡毛店·川菜（同兴西路店）,RENGQ79,很不错，味道经常去吃。
鸡毛店·川菜（同兴西路店）,yac992042282,去吃过几次，这次感觉太差了，可能我们是最后一桌了，点的菜分量都特别少。跳水蛙可能只有4只，青花椒鱼也没有几片的！以前也没要过发票，这次朋友想要发票，结果不给，说打了折就没有发票，这是什么道理。打个折少7块钱.连零头都没有去完，还让我把7块钱补起才开发票。朋友好几个在，我也没说什么，那就补吧！但是心里面确实很不舒服。都是60。70。一份的菜，分量却少的可怜！名副其实汤多肉少！还去排号吃的！以后请客再也不考虑这家店！现在的质量是越做越差了！
鸡毛店·川菜（同兴西路店）,ivylspain.,感觉真的好吃啊
鸡毛店·川菜（同兴西路店）,刘蔬蔬,我觉得我简直是鸡毛店的忠实粉丝。这个月都在里面吃了五次了，不仅朋友聚会，而且外地朋友来找我，我也带他来这，而且带男朋友来这吃，他是个外国人都对这里的菜喜欢的不得了。分量大不说，菜都很有特色，稍微点几个菜就是一大桌子了。不过他这的特色菜都有点油爆爆的。每次锅边馍是必点，彩虹排骨，花椒鱼，连白粉丝，蟹黄豆花都是我喜欢吃的
鸡毛店·川菜（同兴西路店）,qTP417506071,味道好
鸡毛店·川菜（同兴西路店）,yjL271190447,感觉消费高东西一般折扣太少，没有想象的好吃
鸡毛店·川菜（同兴西路店）,Peb337273622,还可以 …就是觉得菜品没有老城区的多…选择性不大
鸡毛店·川菜（同兴西路店）,YOp684642044,可以可以，就是人太多了，要排队。
鸡毛店·川菜（同兴西路店）,月月俊,口味多样化，菜品大众化，服务周到，环境相当有特色。
鸡毛店·川菜（同兴西路店）,匿名用户,便宜大碗，赞赞赞！味道不错哦……推荐！
鸡毛店·川菜（同兴西路店）,Qkw865297778,鸡毛店真的很好吃，那天班级聚餐，去晚了，同学还给我留了菜
鸡毛店·川菜（同兴西路店）,Niq847907094,一如既往的好，唯一要挑剔的就是位置不够多，
鸡毛店·川菜（同兴西路店）,头像要酷,味道还是不错，确实还是物美价廉
鸡毛店·川菜（同兴西路店）,dAc979993291,喊朋友吃饭就喜欢在这吃。。。
鸡毛店·川菜（同兴西路店）,Black_Dream_,菜式新颖，就是口味太重
鸡毛店·川菜（同兴西路店）,GNA94236081,菜相当好吃，来吃过不记得多少回了
鸡毛店·川菜（同兴西路店）,匿名用户,中午去的比较早，没排队，吃的时候已经开始排队了，以前晚上去都要排好久，每次去彩虹排骨和蒜泥白肉是必点，这次因为只有两个人，怕吃不完就没点彩虹排骨，喜欢吃甜食的婆婆说，印度飞饼味道不错，酸汤肥牛味道一般
鸡毛店·川菜（同兴西路店）,MWk616655444,彩虹排骨超好吃，牛肉和风味土豆也很好吃！我们三个人点了三个菜，一份小吃都没吃完，赞赞赞！
鸡毛店·川菜（同兴西路店）,vJd342636257,环境差点
鸡毛店·川菜（同兴西路店）,RsT666104421,菜品口味不错，服务也可以，就是为吃一个饭等的时间太长了。
鸡毛店·川菜（同兴西路店）,无食不欢233,味道不错，分量也很足
鸡毛店·川菜（同兴西路店）,零肆贰叁,胀惨了
鸡毛店·川菜（同兴西路店）,qol627681440,总体说来味道很不错，就是那个荞麦面太酸，大家都受不了😂
鸡毛店·川菜（同兴西路店）,WKa578809703,上菜速度够快，味道棒棒，生意满座。
鸡毛店·川菜（同兴西路店）,简单就好405,不错！朋友来都会去吃！性价比高！遇到人多的时候要多等一下！
鸡毛店·川菜（同兴西路店）,王小乖宝宝,多次光顾，菜品口感绝对美味，菜的价格也适合大众消费，好吃不贵，生意特别好，还会继续光顾
鸡毛店·川菜（同兴西路店）,无心的无心无心,道口正宗，菜量大！人多，排队等了很久
鸡毛店·川菜（同兴西路店）,JGo277555353,经常去，最后爱上她家的鸡爪子，但是我感觉份量怎么越来越少了？推荐锅边馍，好吃！
鸡毛店·川菜（同兴西路店）,nRM131938288,一如既往的好吃不贵，就是现在的服务员貌似新面孔的没以前的服务员热情。一扫光的照片，嘿嘿。
鸡毛店·川菜（同兴西路店）,_qq3dz1367221259,不错
鸡毛店·川菜（同兴西路店）,Xhc681479219,必须要说一下，味道好透题特色多  但是服务确实因为人多比较差，头天就电话定了二桌连座的席位 第二天还是没有。
鸡毛店·川菜（同兴西路店）,拉风的爱,环境有待提高
鸡毛店·川菜（同兴西路店）,匿名用户,菜品真的不错！味道好、分量大！服务员也挺热情的！
鸡毛店·川菜（同兴西路店）,zFy487480437,肉食动物会很喜欢吧 我不太喜欢
鸡毛店·川菜（同兴西路店）,匿名用户,服务员态度极差，打电话订位子说6个人不让订，难道非要说八个人？然后只去6个？
鸡毛店·川菜（同兴西路店）,YdC815209241,分量足，不错。
鸡毛店·川菜（同兴西路店）,EBd566217821,很好吃，12个人，吃的600的套餐，不错，菜量足
鸡毛店·川菜（同兴西路店）,jhe222009626,鸡毛店 吃过很多次 好吃 一有机会就要去吃呢 推荐大家去
鸡毛店·川菜（同兴西路店）,Gfj265333274,还行吧，就是汽锅双拼上面的排骨和蒸肉好少，下面的全是南瓜还没去皮
鸡毛店·川菜（同兴西路店）,周怀溢,彩虹排骨是我的最爱
鸡毛店·川菜（同兴西路店）,a吃货一枚呀,实惠便宜，大家吃得很开心彩虹排骨太赞了！
鸡毛店·川菜（同兴西路店）,stmimi,挺不错的，就是每次去人都好多要排位~~
鸡毛店·川菜（同兴西路店）,库伊特莫,去的早没有排队，非常好吃，是真的非常好吃
鸡毛店·川菜（同兴西路店）,malaohu_611,服务热情，菜品分量十足，价格也公道，味道也不错地，生意一直很好，周末包间都要个预约才行
鸡毛店·川菜（同兴西路店）,匿名用户,等了一个多小时，到号时居然没人安排位置，要自己到处找。如果你自己不主动，那你就白等
鸡毛店·川菜（同兴西路店）,skybang,性价比不错哈，味道可以，上菜也不错，唯独店内装修一般
鸡毛店·川菜（同兴西路店）,张小瑶yoyo,服务态度不如杨柳河那家，上菜速度太慢！太慢！太慢！
鸡毛店·川菜（同兴西路店）,MYn615809847,客观的说，吃了鸡毛店这么多年，今天的菜品质量太差了，凉拌土鸡几乎全是麻花，鸡肉都没有，绝对不上十小块，全部是佐料和麻花。如果是因为生意好，而这样忽悠顾客，不注重菜品质量.....再好的生意也......
鸡毛店·川菜（同兴西路店）,NhC650010431,味道不错，分量也很足，价格也不贵！
鸡毛店·川菜（同兴西路店）,南门吹雪,不错，便宜，味道好，
鸡毛店·川菜（同兴西路店）,eAg166384580,十五六个人吃了700还是很划算的，哪样分量都足，味道可以，还好吃，鸡毛店真的很不错
鸡毛店·川菜（同兴西路店）,meituan96,好吃不贵
鸡毛店·川菜（同兴西路店）,LPDR..,很好哦，环境还好，菜品味道不错
