店铺名称,用户名,评论
鸡毛店·川菜（同兴西路店）,HJJ348423888,很好吃，就是有点遗憾没有锅边贴
鸡毛店·川菜（同兴西路店）,FVW516020128,点多了，现在超30分钟未上菜品送，很好! 计时且自动告知客人! 建议注意提醒你客人是否点菜分量过重，如果不方便打包就不好了! 管理提高了，新菜炝锅鱼不错!!
鸡毛店·川菜（同兴西路店）,今天有好好减肥吗,性价比高味道好而且分量超级足哈哈哈
鸡毛店·川菜（同兴西路店）,匿名用户,好吃
鸡毛店·川菜（同兴西路店）,KOw175529578,好吃，又便宜，不错，吃了太多次了 #特色花椒鱼# #锅边馍# #擂椒茄子#
鸡毛店·川菜（同兴西路店）,zFk348814803,不错
鸡毛店·川菜（同兴西路店）,兮兮、。,菜品味道一般，没特色，萝卜汤里得萝卜都快成网了！
鸡毛店·川菜（同兴西路店）,VQq875039939,烤鸭之前提过建议切的太厚了  现在依旧很厚  还是凉的烤鸭   炒豌豆尖还是挺好吃的
鸡毛店·川菜（同兴西路店）,轻风511,带84岁母亲来吃，萝卜汤，太好吃了
鸡毛店·川菜（同兴西路店）,倔强3585,双椒鱼特好吃，回味无穷
鸡毛店·川菜（同兴西路店）,匿名用户,味道好，光顾了好多次了
鸡毛店·川菜（同兴西路店）,lanprouch,真的超棒了
鸡毛店·川菜（同兴西路店）,冰素1,菜可以，唯一降分的是没吃完的菜让打包时，服务员把餐盒拿过来就走了
鸡毛店·川菜（同兴西路店）,_qqc8z1373438221,第三次在这家店吃，听说是鸡毛店的总店，味道还不错！ #特色巴骨肉# #萝卜大骨汤# #锅边馍# #锅边馍# #特色巴骨肉# #萝卜大骨汤#
鸡毛店·川菜（同兴西路店）,vwB480707284,分量足，上菜快，感觉味道一般，可能各人口味不同吧！
鸡毛店·川菜（同兴西路店）,jiangmeiqi1028,这家店在温江很出名，性价比高，味道好，饭店一定是排队的。
鸡毛店·川菜（同兴西路店）,xCl852386466,味道不错哟
鸡毛店·川菜（同兴西路店）,xixiailvyou,米饭是生的，给服务员说她非说换一桶不是生的，建议改进下。
鸡毛店·川菜（同兴西路店）,匿名用户,除了贵也没太大毛病，感觉没有以前实惠了，分量少
鸡毛店·川菜（同兴西路店）,dkH183760448,二楼餐厅环境有点脏，特别是地板
鸡毛店·川菜（同兴西路店）,fWm680325574,跟以前比起来差了一些 不给力
鸡毛店·川菜（同兴西路店）,xbw113649741,要是大厅温度高点不要菜凉的太快就更完美了
鸡毛店·川菜（同兴西路店）,algomltee,这家店很优秀 量大 味道也好 人均不到50 很划算 推荐
鸡毛店·川菜（同兴西路店）,MFFABC,挺不错的，孩子生日，还给孩子唱了首歌曲，送了个杯子！
鸡毛店·川菜（同兴西路店）,kCr185607164,等太久了，其他都OK
鸡毛店·川菜（同兴西路店）,孙水木,菜品味道很好，上菜速度挺快的，不错不错
鸡毛店·川菜（同兴西路店）,_alipay272934315,老店味道就是巴适得很，中午1点去还要排队，还好一进门就有自动拍号机，服务员动作麻利，收台迅速，价格实惠，本来人均还可以再高点，但烤鸭，棒骨萝卜汤，冰粉都卖完了，下次再去补上。彩虹排骨，吧骨肉，凉拌鸡，蟹黄豆腐，一家老小都吃满足了 #彩虹排骨# #锅边馍馍# #巴骨肉# #萝卜大骨汤#
鸡毛店·川菜（同兴西路店）,匿名用户,"第一服务真的很垃圾，喊服务员拿一壶茶来，一直没有拿来，服务态度也很差。中间加了两个菜，等了很久都没来，我们大家都吃完了，还是没来，我们说那剩到两个菜就上了吧。服务员居然说:哎呀，等会儿打包回去吧！！！excuse  me??然后飞速的端了上来了。说要走了，就飞速端起来了？？我们还是无奈坐到吃了，打包回寝室也热不到。
真的各种都拖。如果真的生意好，请麻烦不要降低服务和菜的质量
以后再也不想去了。
菜味道不能算很好也不能算差，中规中矩，配不上它的价格。没以前好吃了。
真的很失望"
鸡毛店·川菜（同兴西路店）,vVw714634470,【口味】还不错， 【环境】很好 【服务】到位
鸡毛店·川菜（同兴西路店）,tpE284167978,4人套餐不建议点，商家配的太单调了，价格上也没多少实惠，如果四五人还是建议自己点。
鸡毛店·川菜（同兴西路店）,Lcy7866,将就
鸡毛店·川菜（同兴西路店）,yXK18628171252,菜品存在问题，应该好好管理、整治一下厨房
鸡毛店·川菜（同兴西路店）,pQG913989529,菜品一般，油菜太老了
鸡毛店·川菜（同兴西路店）,DNO926212383,味道一如既往地好，价格稍贵了点。 #彩虹排骨# #锅边馍# #茄子豇豆# #肉沫小土豆# #干锅茶树菇#
鸡毛店·川菜（同兴西路店）,匿名用户,经常来吃，味道好
鸡毛店·川菜（同兴西路店）,贵妃骑牛,菜味道、上菜舒服都不错。但是服务员有待提高，理解高峰期她们忙，但是一直无视顾客的基本要求，就太没礼貌了，告诉服务员大姐桌子太脏，好油，能不能再擦一次，不理。换了3个人问最后一个让我们自己擦，她们帕子油
鸡毛店·川菜（同兴西路店）,匿名用户,鸡毛店，温江人最喜爱的特色餐厅。也是我接待外地人的首选。
鸡毛店·川菜（同兴西路店）,jLC892317272,太慢了。
鸡毛店·川菜（同兴西路店）,_qq8ck1399100268,跳水蛙很一般
鸡毛店·川菜（同兴西路店）,Gnq938407793,好，
鸡毛店·川菜（同兴西路店）,MWA679806314,建议培训一下打包的技术
鸡毛店·川菜（同兴西路店）,lvE729506083,都可以，就是菜品都有点油
鸡毛店·川菜（同兴西路店）,风暴258,服务员服务态度极差，好在菜品不错
鸡毛店·川菜（同兴西路店）,rvh365950163,前台短头发，太拽了，命令口气，下次换其他地方去了……
鸡毛店·川菜（同兴西路店）,lwO574884643,菜一直都不错，经常吃
鸡毛店·川菜（同兴西路店）,匿名用户,菜品味道还是不错的，性价比也不错
鸡毛店·川菜（同兴西路店）,NEk445619792,烧菜油腻，茄饼油腻，锅边馍不脆，只有个莲白粉丝将就能吃，很差的体验
鸡毛店·川菜（同兴西路店）,孙水木,口味不错，菜品丰富，回头客啦
鸡毛店·川菜（同兴西路店）,,今天太慢了，等半个小时才上第二份菜
鸡毛店·川菜（同兴西路店）,西昌本土吃货,切饼不好吃。酸的。
鸡毛店·川菜（同兴西路店）,_qqf421322883709,环境好，味道好，性价比高，满意
鸡毛店·川菜（同兴西路店）,美沙拉嗪, #锅边馍# #萝卜大骨汤# #蒜泥白肉#
鸡毛店·川菜（同兴西路店）,匿名用户, #石锅生焖虾#
鸡毛店·川菜（同兴西路店）,UQA900788583,强烈推荐彩虹排骨，花椒鱼，谁吃谁知道！人多得一塌糊涂，但是也能井然有序，不到20分钟菜上齐了，忙而不乱。而且可以手机排号，路上把号要了，走到只等一会儿就能吃上，方便。要说不足，菜品油重，容易腻，不过偶尔打打牙祭，不用顾忌了。总之好评，推荐！ #彩虹排骨# #花椒鱼#
鸡毛店·川菜（同兴西路店）,LGn838422038,菜品太好快哦，价格适中，份量很足 #巴骨肉# #花椒鱼# #萝卜大骨汤#
鸡毛店·川菜（同兴西路店）,ryX391761383,菜品不错，就是卷只能用两张，有点不高兴
鸡毛店·川菜（同兴西路店）,starainny,味道不错，经常来，很不错的川菜馆 #彩虹排骨# #锅边馍馍# #花椒鱼#
鸡毛店·川菜（同兴西路店）,OWE177586282,分量很大 不适合人少来吃哦
鸡毛店·川菜（同兴西路店）,June圈圈,来过很多次了，菜品分量比较足，就是上菜比较慢
鸡毛店·川菜（同兴西路店）,oWp770005556,好
鸡毛店·川菜（同兴西路店）,石榴树5678,这次去觉得巴骨肉太硬了，一点也不好吃，服务员很热情，总体还是挺好的，就是巴骨肉太硬了，太干了咬不动
鸡毛店·川菜（同兴西路店）,,太好吃了
鸡毛店·川菜（同兴西路店）,匿名用户,菜上错，点的菜饭都吃完了，菜也没用，服务态度差。
鸡毛店·川菜（同兴西路店）,UVh687819356,味道不错，环境也好，服务热情，价位合理
鸡毛店·川菜（同兴西路店）,小馒头－,说什么美团订购不能开发票。呵呵了！！！！
鸡毛店·川菜（同兴西路店）,xId233001177,小米排骨好好吃
鸡毛店·川菜（同兴西路店）,小果子Gebaby,好次的板 #彩虹排骨# #萝卜大骨汤# #开边虾#
鸡毛店·川菜（同兴西路店）,hnD944648441,服务周到，上菜快，味道巴适，价格实惠！
鸡毛店·川菜（同兴西路店）,匿名用户,老店了，味道很好，专程从成都过去吃的。
鸡毛店·川菜（同兴西路店）,mnO463676314,环境比其它店好，宽敞，菜的味道一般。
鸡毛店·川菜（同兴西路店）,贝贝乐育婴坊,好评
鸡毛店·川菜（同兴西路店）,YpT754503050,菜可以，上菜快，味道还不错，满意
鸡毛店·川菜（同兴西路店）,GDA339418541,5个人，点多了，打包回去的，那个青椒鱼好吃
鸡毛店·川菜（同兴西路店）,珈应紫s舒姝,工作人员把剩菜汤汤到得到处都是，溅到我们衣服上，桌子上到处都是，太恼火了，饭还没吃到，就被泔水泼
鸡毛店·川菜（同兴西路店）,ggX518588200,味道很好 然后 前台小姐姐有点凶😞 😞
鸡毛店·川菜（同兴西路店）,微亨利,脆肚真心难吃啊
鸡毛店·川菜（同兴西路店）,HmN990145148,可以，份量很足
鸡毛店·川菜（同兴西路店）,石榴树5678,菜品好好吃的，还回去，谢谢做的菜太好吃了
鸡毛店·川菜（同兴西路店）,cgW242448401,烤鸭不好吃！肉厚皮不好吃
鸡毛店·川菜（同兴西路店）,,这样的呢？我是
鸡毛店·川菜（同兴西路店）,jee722,味道不错，价格实惠。
鸡毛店·川菜（同兴西路店）,川东片羽,家常味，实惠。但是人太多，环境太嘈杂了
鸡毛店·川菜（同兴西路店）,Qed638308623,菜品味道不错，份量很足，就餐环境卫生
鸡毛店·川菜（同兴西路店）,KVQ820387379,红烧肉里一半是红薯，其他的还不错
鸡毛店·川菜（同兴西路店）,熊猫会武术_,舌尖上的味道不好吃 用的料也不好
鸡毛店·川菜（同兴西路店）,CHs489983256,好
鸡毛店·川菜（同兴西路店）,dWL430927869,上菜速度慢，有点热了，人多但是要控制。
鸡毛店·川菜（同兴西路店）,诗人和他的诗,挺不错的，可以看看，哈哈哈哈哈
鸡毛店·川菜（同兴西路店）,流年紫艺,分量可以 味道中规中矩  环境服务很一般
鸡毛店·川菜（同兴西路店）,ULo301330283,我十二点四十点菜。一点二十才上。垃圾玩意
鸡毛店·川菜（同兴西路店）,QxO235741534,夫妻肺片全是芹菜
鸡毛店·川菜（同兴西路店）,萌x315,太尼玛吵了
鸡毛店·川菜（同兴西路店）,UqU423936177,菜还行，人多服务差
鸡毛店·川菜（同兴西路店）,ahI669193120,菜品很好，服务略欠
鸡毛店·川菜（同兴西路店）,yqX252939692,味道变了，好咸
鸡毛店·川菜（同兴西路店）,匿名用户, #锅边馍馍# #巴骨肉#
鸡毛店·川菜（同兴西路店）,yaya30000,菜一般 流水线弄的菜
鸡毛店·川菜（同兴西路店）,匿名用户,都还可以，就是收银台的人态度生硬！其
鸡毛店·川菜（同兴西路店）,fast....,味道好，上菜速度快，环境不错。。。。 #彩虹排骨# #花椒鱼#
鸡毛店·川菜（同兴西路店）,匿名用户,听说味道还行，希望服务态度再好一点儿。
鸡毛店·川菜（同兴西路店）,Utw52855401,菜简直太难吃了，我很失望
鸡毛店·川菜（同兴西路店）,Yxx291458997,菜品太少，太大份
鸡毛店·川菜（同兴西路店）,r33096379,菜品好吃，价格实惠，我们很远都愿意专门开车去吃
鸡毛店·川菜（同兴西路店）,Yvonnesunzy,味道赞分量足菜品不错服务好只是需要排队
鸡毛店·川菜（同兴西路店）,XEF148501547,味道很好，服务不错，娃娃都很喜欢。
鸡毛店·川菜（同兴西路店）,Lisa。。,拥挤 热
鸡毛店·川菜（同兴西路店）,srP909679310,味道好！！
鸡毛店·川菜（同兴西路店）,Coa521324054,环境可以，菜品前几口好吃，后面不行，不耐吃。品种丰富
鸡毛店·川菜（同兴西路店）,_qqktw1437740016,菜可以，太慢了
鸡毛店·川菜（同兴西路店）,DvD504998598,上菜很难 差
鸡毛店·川菜（同兴西路店）,aQc890341189,服务一般   菜品有异味（青椒鸡）上菜慢
鸡毛店·川菜（同兴西路店）,acw883630128,好吃
鸡毛店·川菜（同兴西路店）,GbU423210903,上菜慢，鱼里有一个小蚊子
鸡毛店·川菜（同兴西路店）,曼哈顿游客,生意火爆，还好在外面排队时可以免费吃西瓜。菜品丰富，味道好，只是今天的锅边馍没上次好吃 #彩虹排骨# #开边虾# #锅边馍馍# #巴骨肉#
鸡毛店·川菜（同兴西路店）,li秉瀓,不错不错，分量很足
鸡毛店·川菜（同兴西路店）,大脸猫爱星星,服务有点跟不上
鸡毛店·川菜（同兴西路店）,mwa853997893,回头客
鸡毛店·川菜（同兴西路店）,hrk278934042,菜一般 服务实在没什么可说的 也就是离家近
鸡毛店·川菜（同兴西路店）,RXG454431791,还行吧 环境味道都还可以。。zzz
鸡毛店·川菜（同兴西路店）,Vbl951310665,加快图 花椒兔不好吃 兔子榨得干干的
鸡毛店·川菜（同兴西路店）,cpc1975763312177,上菜还是准时 刚好30分钟
鸡毛店·川菜（同兴西路店）,贰老湿,味道还是可以的，人很多，需要排队，比较推荐凉面。
鸡毛店·川菜（同兴西路店）,fKY943136194,还可以
鸡毛店·川菜（同兴西路店）,NLt552412698,特色菜鱼肉太硬，只吃了一口。  你们问服务员吧，真是难吃
鸡毛店·川菜（同兴西路店）,rWd163421562,风量大
鸡毛店·川菜（同兴西路店）,dWM698171711,性价比低
鸡毛店·川菜（同兴西路店）,WTm593545765,还行，人挺多的
鸡毛店·川菜（同兴西路店）,Wmg815075297,服务态度太差
鸡毛店·川菜（同兴西路店）,iRD229572331,味道好，服务好，环境好！！！
鸡毛店·川菜（同兴西路店）,aVV677126551,以后价格再实惠点
鸡毛店·川菜（同兴西路店）,RNH959693749,好久没来了，都差点把这忘记了，味道很好，最喜欢吃巴骨肉太好吃了
鸡毛店·川菜（同兴西路店）,Vlh700230376,红烧肉还需要改进，肉没选好，五花肉最好，选的坐墩肉，瘦肉太柴了，没有做到入口即化，烧制的时间火候也要改进。
鸡毛店·川菜（同兴西路店）,ZzzLl0,服务员不行，每次来，叫她拿点什么都要叫三次以上，一直在那忙自己的，比如让打个饭，菜都吃的差不多了，叫三四次打饭，才把饭拿上来
鸡毛店·川菜（同兴西路店）,Shaun楊慧翔,味道超棒，又好吃又大份量。
鸡毛店·川菜（同兴西路店）,ble103606168,味道太咸了！
鸡毛店·川菜（同兴西路店）,喵柯森瑟,很好
鸡毛店·川菜（同兴西路店）,panda0709,不好吃  太油腻了  千篇一律  不知道为什么那么红
鸡毛店·川菜（同兴西路店）,DTe686360620,不错
鸡毛店·川菜（同兴西路店）,prl722665634,味道不错，环境太差，座位很不舒服，服务很好
鸡毛店·川菜（同兴西路店）,uER691609692,味道非常有特色，份量也大，下次还会来
鸡毛店·川菜（同兴西路店）,雷志强564335,没有点下饭的菜，全都将就娃儿了。。
鸡毛店·川菜（同兴西路店）,RcT327267034,006服务好
鸡毛店·川菜（同兴西路店）,elf130969800,环境不巴适
鸡毛店·川菜（同兴西路店）,,鱼头、红烧肉、招牌豆腐
鸡毛店·川菜（同兴西路店）,ZtJ959610039,很好很好
鸡毛店·川菜（同兴西路店）,rDr200647066,好吃
鸡毛店·川菜（同兴西路店）,Sher8781,真的太棒太棒太棒了！！！！
鸡毛店·川菜（同兴西路店）,Tfd809131131,027服务周到！
鸡毛店·川菜（同兴西路店）,HFt494244817,还不错 汤美味
鸡毛店·川菜（同兴西路店）,jml508130245,一如既往的好吃
鸡毛店·川菜（同兴西路店）,sonw解,味道不错，已经来几次了
鸡毛店·川菜（同兴西路店）,京津871,凉粉变了，没有冬天的好吃
鸡毛店·川菜（同兴西路店）,gqb373270275,服务差
鸡毛店·川菜（同兴西路店）,Efr786233511,味道没有以前好了
鸡毛店·川菜（同兴西路店）,Krp370211981,服务员素质真的不行。
鸡毛店·川菜（同兴西路店）,AyR871771426,味道好，价格不贵！巴适
鸡毛店·川菜（同兴西路店）,Lhl576126111,性价比很高，物美价廉！
鸡毛店·川菜（同兴西路店）,ZCA552159995,当风口有点冷
鸡毛店·川菜（同兴西路店）,HAQ716813936,后来的其他桌必点菜素菜都上了，我们桌的素菜都还没上来
鸡毛店·川菜（同兴西路店）,Vgx317169190,超级棒！
鸡毛店·川菜（同兴西路店）,NLi446169941,环境太吵了
鸡毛店·川菜（同兴西路店）,rQr631406571,不太好吃
鸡毛店·川菜（同兴西路店）,GKB271291099,服务态度很好，菜有点咸
鸡毛店·川菜（同兴西路店）,秋7047,就是来晚了
鸡毛店·川菜（同兴西路店）,,人太多
鸡毛店·川菜（同兴西路店）,Jvs538477167,服务也好，有个别菜还是不擅长的所
鸡毛店·川菜（同兴西路店）,yuckywon,等号久，上菜慢，服务态度差，特别是那个胖胖和门口的那个喊号的
鸡毛店·川菜（同兴西路店）,SkY813453024,很好吃
鸡毛店·川菜（同兴西路店）,sunflower98520,味道不错，去了很多次了，每次都排队
鸡毛店·川菜（同兴西路店）,iHg602870842,味道，服务都在提升，不错哦！
鸡毛店·川菜（同兴西路店）,vyO264161039,好吃，味道很好，值得点赞。
鸡毛店·川菜（同兴西路店）,Ehi963083621,服务不热情
鸡毛店·川菜（同兴西路店）,JQl847564230,实际121.7元，尾款处理3毛居然不找了，实收了122。我服了。
鸡毛店·川菜（同兴西路店）,莫失风雅,今天来，有点失望！茄子豇豆，豇豆没输，气锅双拼，杂肉太肥！
鸡毛店·川菜（同兴西路店）,邱JunK,阔以好吃
鸡毛店·川菜（同兴西路店）,Eox500686759,味道可以，老客户了，就是年轻服务员不太给力，爱理不理的样子
鸡毛店·川菜（同兴西路店）,CwR283477144,菜品味道不错，人均50足矣。
鸡毛店·川菜（同兴西路店）,何以笙萧秣,菜品很不错，味道很好，大众消费，强烈推荐
鸡毛店·川菜（同兴西路店）,章噪噪,超级好吃
鸡毛店·川菜（同兴西路店）,num517146049,味美量足
鸡毛店·川菜（同兴西路店）,Iki782954149,味道好
鸡毛店·川菜（同兴西路店）,阿迪说你很拉风,味道不错哦！！！！！！
鸡毛店·川菜（同兴西路店）,cUj959135824,还可以啦
鸡毛店·川菜（同兴西路店）,FCS204035167,分量巨大 只吃了一半...
鸡毛店·川菜（同兴西路店）,TLU534868807,没我喜欢吃的土豆片，美中不足！
鸡毛店·川菜（同兴西路店）,LnM517033350,咸 油 闷
鸡毛店·川菜（同兴西路店）,Nci802301345,味道好！分量很足
鸡毛店·川菜（同兴西路店）,SVT115973606,人太多
鸡毛店·川菜（同兴西路店）,QxC126281522,好吃
鸡毛店·川菜（同兴西路店）,xUn957668064,带女盆友来吃的，还不错。上菜很快，服务态度很好。味道也挺不错的。
鸡毛店·川菜（同兴西路店）,januaryoung,好吃！
鸡毛店·川菜（同兴西路店）,whc962,不愧为老字号名店，从杨柳河店跟踪到花都店，口味质量没变，人气旺上菜快、服务好，就是重新装修后菜价略有提高，其它都还不错，好评。
鸡毛店·川菜（同兴西路店）,lee慕田,味道就是正宗的川菜。分量很足，适合家庭聚餐。上菜比较快。
鸡毛店·川菜（同兴西路店）,KjE602352559,开发票
鸡毛店·川菜（同兴西路店）,WLK493327846,一样的菜，每次来味道都不一样
鸡毛店·川菜（同兴西路店）,cor786861125,非常值得一吃
鸡毛店·川菜（同兴西路店）,匿名用户,味道不错，服务态度很好，就是人多，要等位置。
鸡毛店·川菜（同兴西路店）,pQc650129125,菜品依然很好吃，环境很干净，服务也很好
鸡毛店·川菜（同兴西路店）,,叫一个饭叫了4次 其他还是挺好的
鸡毛店·川菜（同兴西路店）,Onl479841266,来过很多次了，来了朋友就往这里带😃
鸡毛店·川菜（同兴西路店）,faO886863418,不错
鸡毛店·川菜（同兴西路店）,Whn30470699,这次来吃的菜不是很满意，绍子蒸蛋都是冷的，饭也是冷的
鸡毛店·川菜（同兴西路店）,RcH716302931,说好得超过三十分钟不上菜免费送 买单打折 结果过了时间又说锅边馍 小吃 肉串河鲜都不算……既然不算就说清楚嘛
鸡毛店·川菜（同兴西路店）,hoL456914101,辣
鸡毛店·川菜（同兴西路店）,wpV722623055,环境很好 里面很热火
鸡毛店·川菜（同兴西路店）,韩琳0311,饭菜一如既往的好吃
鸡毛店·川菜（同兴西路店）,ADa660076746,上菜超过30分钟，服务态度差
鸡毛店·川菜（同兴西路店）,匿名用户,可以还可以，菜品跟温江的有点差别
鸡毛店·川菜（同兴西路店）,IqX439199513,为什么给4星？！锅边馍等了半天没上
鸡毛店·川菜（同兴西路店）,link2014,相比其他店，价格稍贵一点点，人很多，要排队
鸡毛店·川菜（同兴西路店）,luv157357884,锅边馍呀，你就慢慢等把
鸡毛店·川菜（同兴西路店）,廖伟383,上菜速度需要提升
鸡毛店·川菜（同兴西路店）,eYG778933050,鱼头没煮熟  还有血呢
鸡毛店·川菜（同兴西路店）,czn757238399,进来安排位置错了。菜很难吃。只不过是炒作起来滴
鸡毛店·川菜（同兴西路店）,dLu638999508,上了个鱼好难吃，强烈要求下，还是退了
鸡毛店·川菜（同兴西路店）,zVu598718193,价格实惠，菜品还可以，环境一般，很多人店内抽烟
鸡毛店·川菜（同兴西路店）,雪雨沉,味道好，服务好，价格便宜
鸡毛店·川菜（同兴西路店）,爱吃还爱做,份量缩水呀
鸡毛店·川菜（同兴西路店）,fLR711247108,吃的时候环境里弥漫着油漆味
鸡毛店·川菜（同兴西路店）,TyV566075244,价廉物美，强烈推荐
鸡毛店·川菜（同兴西路店）,Iao263135943,好吃就是有点贵
鸡毛店·川菜（同兴西路店）,kDY207291054,饭碗、茶杯清洗不彻底，有油污！
鸡毛店·川菜（同兴西路店）,人间极痞,上菜速度明显慢了，还有菜等不了，取消了
鸡毛店·川菜（同兴西路店）,xRA206369134,今天上的锅边摸居然是凉的，让热一下诸多借口，大失所望！
鸡毛店·川菜（同兴西路店）,PVu602429980,很棒很棒
鸡毛店·川菜（同兴西路店）,陈先生28425,好吃  上菜快味道好，大家都来吃
鸡毛店·川菜（同兴西路店）,uqW496462404,真的可以
鸡毛店·川菜（同兴西路店）,Sweety2c,去了三次 个人觉得最好吃的是巴骨肉和大骨萝卜汤   彩虹排骨很容易冷 冷了就不好吃了  可能一开始对彩虹排骨期待太高 味道并没有想象的那么好吃  蒜蓉粉丝虾很普通 虾没能保留原有的鲜味  巴骨肉很满意 很多筋味道很足回味无穷 两个人就解决了一大盘  大骨汤也很推荐 可惜只有第一次去吃到了 后来两次去都没有了
鸡毛店·川菜（同兴西路店）,匿名用户,分量很足，味道很好吃，整体很不错～
鸡毛店·川菜（同兴西路店）,zhangyxh,味道超好
鸡毛店·川菜（同兴西路店）,aSL849473699,非常好吃
鸡毛店·川菜（同兴西路店）,honey小智520,挺好的，一直喜欢他们家的味道，分量很大，很有特色。人也很多
鸡毛店·川菜（同兴西路店）,窦兰心,味道还行，服务妹妹也不错，甜。
鸡毛店·川菜（同兴西路店）,pvk548191139,份量足。味道不错
鸡毛店·川菜（同兴西路店）,阳光下的松林,有创意的菜
鸡毛店·川菜（同兴西路店）,阳光下的松林,下次还来！
鸡毛店·川菜（同兴西路店）,HOs797591175,一般般
鸡毛店·川菜（同兴西路店）,cdtytsglei,感觉很巴适，菜品味道不错，常常去吃，晚了要排队！
鸡毛店·川菜（同兴西路店）,mwn164843555,味道挺好的，巴骨肉好吃，分量足，排了好久队呢
鸡毛店·川菜（同兴西路店）,匿名用户,味道挺不错的，挺干净，卫生，就是等的时间长了点。
鸡毛店·川菜（同兴西路店）,FbV671226061,一切都是美好的回忆
鸡毛店·川菜（同兴西路店）,心鱼1122,味道不错，算是附近性价比很高的餐厅之一，份量之大，我们三个人点了彩虹排骨，气锅双拼，大骨萝卜汤和一个炒冰，吃撑了，也没吃完，只好打包带走咯！
鸡毛店·川菜（同兴西路店）,EFg493839476,点错菜
